会社名,法人番号,業種,住所,電話番号,資本金,代表氏名
大阪特殊運輸株式会社,9120901009177,ビジネス > 運送・貨物・倉庫,〒566-0064大阪府摂津市鳥飼中2-9-5,0726544626（072-654-4626）,14500（千円）,満中　幸一（ミツナカ コウイチ）
株式会社ルミナス,9120901010226,ビジネス > 運送・貨物・倉庫,〒566-0052大阪府摂津市鳥飼本町3-12-46,0726501857（072-650-1857）,"",""
大阪トヨペットロジスティック株式会社,9120901010589,ビジネス > 運送・貨物・倉庫,〒569-0823大阪府高槻市芝生町4-6-2,0726777351（072-677-7351）,"",""
株式会社大福商事,9120901011364,ビジネス > 運送・貨物・倉庫,〒569-0034大阪府高槻市大塚町4-17-1,0726722716（072-672-2716）,"",""
株式会社ハズカンパニー,9120901020860,ビジネス > 運送・貨物・倉庫,〒562-0032大阪府箕面市小野原西3-1-12,0727305511（072-730-5511）,23000（千円）,中村　悟（ナカムラ サトル）
日大運送株式会社,9120901025125,ビジネス > 運送・貨物・倉庫,〒561-0814大阪府豊中市豊南町東1-2-9,0663347518（06-6334-7518）,"",""
株式会社イタニ,9122001000529,ビジネス > 運送・貨物・倉庫,〒578-0984大阪府東大阪市菱江3-9-13,0729641081（072-964-1081）,"",""
叶運輸株式会社,9122001001683,ビジネス > 運送・貨物・倉庫,〒578-0982大阪府東大阪市吉田本町1-7-36,0729655061（072-965-5061）,"",""
サンケイ城北サービス株式会社,9122001003606,ビジネス > 運送・貨物・倉庫,〒577-0033大阪府東大阪市御厨東1-1-22,0667818051（06-6781-8051）,78100（千円）,柘植　茂（ツゲ シゲル）
株式会社ナサ,9122001005668,ビジネス > 運送・貨物・倉庫,〒578-0932大阪府東大阪市玉串町東3-2-16,0729641573（072-964-1573）,"",""
服部商事株式会社,9122001006204,ビジネス > 運送・貨物・倉庫,〒577-0062大阪府東大阪市森河内東2-8-5,0667832533（06-6783-2533）,"",""
山口運送株式会社,9122001007796,ビジネス > 運送・貨物・倉庫,〒579-8036大阪府東大阪市鷹殿町17-17,0729855444（072-985-5444）,"",""
横山運送株式会社,9122001007904,ビジネス > 運送・貨物・倉庫,〒577-0065大阪府東大阪市高井田中2-5-33,0667830680（06-6783-0680）,"",""
ＡＫＧ株式会社,9122001012813,ビジネス > 運送・貨物・倉庫,〒577-0013大阪府東大阪市長田中4-6-15,0667447577（06-6744-7577）,20000（千円）,代表取締役社長／合原　誠二（ゴウハラ セイジ）
ダイエー株式会社,9122001012895,ビジネス > 運送・貨物・倉庫,〒578-0914大阪府東大阪市箕輪2-8-26,0729647553（072-964-7553）,"",""
株式会社日知和,9122001016319,ビジネス > 運送・貨物・倉庫,大阪府四條畷市雁屋南町16番36号,0728780333（072-878-0333）,30000（千円）,石川　行一（イシカワ コウイチ）
曙川運輸倉庫株式会社,9122001017564,ビジネス > 運送・貨物・倉庫,〒581-0016大阪府八尾市八尾木北4-74,0729912648（072-991-2648）,"",""
小川運送株式会社,9122001017795,ビジネス > 運送・貨物・倉庫,〒581-0016大阪府八尾市八尾木北6-16-1,0729939063（072-993-9063）,"",""
辻運輸株式会社,9122001019313,ビジネス > 運送・貨物・倉庫,〒581-0814大阪府八尾市楠根町5-25,0729230281（072-923-0281）,10000（千円）,代表取締役社長／中川　隆司（ナカガワ タカシ）
株式会社リリーフ,9122001024321,ビジネス > 運送・貨物・倉庫,〒578-0921大阪府東大阪市水走5-5-32,0729663681（072-966-3681）,10000（千円）,中牟田　満麗（ナカムタ ミツヨシ）
株式会社西川組,9122001028074,ビジネス > 運送・貨物・倉庫,〒577-0055大阪府東大阪市長栄寺20-20,0667824455（06-6782-4455）,"",""
有限会社山中商事,9122002012218,ビジネス > 運送・貨物・倉庫,〒574-0064大阪府大東市御領1-668,0728062105（072-806-2105）,"",""
河本運送有限会社,9122002013455,ビジネス > 運送・貨物・倉庫,〒581-0042大阪府八尾市南木の本5-5,0729222727（072-922-2727）,"",""
