会社名,法人番号,業種,住所,電話番号,資本金,代表氏名
株式会社トレックス,6120101031067,ビジネス > 運送・貨物・倉庫,〒584-0049大阪府富田林市川向町2-10,0721347030（0721-34-7030）,"",""
阪南運輸倉庫株式会社,6120101037510,ビジネス > 運送・貨物・倉庫,〒596-0015大阪府岸和田市地蔵浜町11,0724222985（072-422-2985）,49000（千円）,前藤　秀郷（ゼントウ ヒデサト）
水鉄タクシー株式会社,6120101038186,ビジネス > 運送・貨物・倉庫,〒597-0093大阪府貝塚市二色中町5-1,0724227181（072-422-7181）,3000（千円）,中塚　貴志（ナカツカ タカシ）
新星運輸株式会社,6120101041504,ビジネス > 運送・貨物・倉庫,〒594-0041大阪府和泉市いぶき野3-21-7,0725434747（0725-43-4747）,20000（千円）,吉田　清治（ヨシダ キヨハル）
東鉄運輸株式会社,6120101042535,ビジネス > 運送・貨物・倉庫,〒595-0075大阪府泉大津市臨海町1-15-1,0725221631（0725-22-1631）,"",""
メイワ株式会社,6120101045819,ビジネス > 運送・貨物・倉庫,〒594-1154大阪府和泉市松尾寺町2164-130,0725513090（0725-51-3090）,"",""
株式会社太星インターナショナル,6120901021498,ビジネス > 運送・貨物・倉庫,〒562-0001大阪府箕面市箕面6-2-5,0727257101（072-725-7101）,"",""
樽仙運送株式会社,6122001004879,ビジネス > 運送・貨物・倉庫,〒577-0011大阪府東大阪市荒本北2-6-24,0667453910（06-6745-3910）,"",""
株式会社ニッソー,6122001019563,ビジネス > 運送・貨物・倉庫,大阪府八尾市太田7丁目43番地,0729205771（072-920-5771）,"",""
明光運輸株式会社,6122001021271,ビジネス > 運送・貨物・倉庫,〒582-0005大阪府柏原市法善寺3-526,0729712215（072-971-2215）,45000（千円）,代表取締役社長／末松　靖章（スエマツ ヤスアキ）
関西陸運株式会社,6122001021362,ビジネス > 運送・貨物・倉庫,〒581-0856大阪府八尾市水越4-144,0729403030（072-940-3030）,"",""
有限会社スタッフ,6122002002584,ビジネス > 運送・貨物・倉庫,〒578-0958大阪府東大阪市新庄南6-3,0667474719（06-6747-4719）,"",""
有限会社ドリーム,6122002003582,ビジネス > 運送・貨物・倉庫,〒578-0901大阪府東大阪市加納6-6-15,0728692876（072-869-2876）,"",""
株式会社トータルサポート,6140001084080,ビジネス > 運送・貨物・倉庫,大阪府大阪市中央区島之内1-17-12,0662526335（06-6252-6335）,"",""
株式会社マヤマ,7120001002605,ビジネス > 運送・貨物・倉庫,〒538-0054大阪府大阪市鶴見区緑1-3-18,0669310631（06-6931-0631）,"",""
株式会社サンキ運輸,7120001003446,ビジネス > 運送・貨物・倉庫,〒557-0062大阪府大阪市西成区津守1-14-22,0664498793（06-6449-8793）,33000（千円）,中西　茂（ナカニシ シゲル）
株式会社栄幸運送店,7120001007018,ビジネス > 運送・貨物・倉庫,〒535-0002大阪府大阪市旭区大宮4-20-5,0669514961（06-6951-4961）,15000（千円）,藤原　輝男（フジハラ テルオ）
サンコー運送株式会社,7120001014930,ビジネス > 運送・貨物・倉庫,〒536-0022大阪府大阪市城東区永田2-5-5,0669630821（06-6963-0821）,"",""
株式会社安楽商店,7120001026736,ビジネス > 運送・貨物・倉庫,〒554-0032大阪府大阪市此花区梅町2-2-37,0664640691（06-6464-0691）,20000（千円）,安楽　竜彦（アンラク タツヒコ）
兼六商事運輸株式会社,7120001028856,ビジネス > 運送・貨物・倉庫,〒552-0021大阪府大阪市港区築港1-1-8,0665731951（06-6573-1951）,15000（千円）,山下　敦裕（ヤマシタ アツヒロ）
ミナト物流株式会社,7120001029895,ビジネス > 運送・貨物・倉庫,〒552-0005大阪府大阪市港区田中2-12-2,0665744755（06-6574-4755）,"",""
港運送株式会社,7120001029920,ビジネス > 運送・貨物・倉庫,〒552-0012大阪府大阪市港区市岡1-7-16,0665711321（06-6571-1321）,"",""
大阪港湾作業株式会社,7120001030093,ビジネス > 運送・貨物・倉庫,〒552-0023大阪府大阪市港区港晴2-13-19,0665762111（06-6576-2111）,40000（千円）,川田　茂実（カワタ シゲミ）
敷島交通株式会社,7120001030829,ビジネス > 運送・貨物・倉庫,〒559-0017大阪府大阪市住之江区中加賀屋4-4-29,0666851647（06-6685-1647）,"",""
ダイキチ運送株式会社,7120001031050,ビジネス > 運送・貨物・倉庫,〒559-0026大阪府大阪市住之江区平林北2-6-35,0666827551（06-6682-7551）,10000（千円）,片山　勝（カタヤマ マサル）
長門マリン株式会社,7120001046040,ビジネス > 運送・貨物・倉庫,〒550-0002大阪府大阪市西区江戸堀1-2-14,0664413416（06-6441-3416）,10000（千円）,代表取締役社長／松田　武士（マツダ タケシ）
株式会社河東建資,7120001054563,ビジネス > 運送・貨物・倉庫,〒532-0027大阪府大阪市淀川区田川3-1-14,0663093481（06-6309-3481）,10000（千円）,河東　雅己（カトウ マサミ）
安芸海運株式会社,7120001059876,ビジネス > 運送・貨物・倉庫,〒530-0001大阪府大阪市北区梅田1-1-3大阪駅前第3ビル1600,0663442068（06-6344-2068）,170000（千円）,関田　拓生（セキダ タクセイ）
株式会社昭和倉庫,7120001081467,ビジネス > 運送・貨物・倉庫,〒534-0027大阪府大阪市都島区中野町2-14-18,0668820808（06-6882-0808）,50000（千円）,代表取締役社長／松本　尚久（マツモト ナオヒサ）
株式会社ティーピーアイ西日本,7120001085807,ビジネス > 運送・貨物・倉庫,〒541-0054大阪府大阪市中央区南本町4-5-20住宅金融支援機構･住友生命ビル7F･8F,0662517391（06-6251-7391）,75000（千円）,代表取締役社長／江南　誠人（エナミ マコト）
ニッシントランスコンソリデーター株式会社,7120001095038,ビジネス > 運送・貨物・倉庫,〒554-0012大阪府大阪市此花区西九条1-27-12日立物流第一ビル内,0664624804（06-6462-4804）,50000（千円）,代表取締役社長／坂本　泰典（サカモト ヤスノリ）
株式会社サンライナー,7120001108591,ビジネス > 運送・貨物・倉庫,〒559-0025大阪府大阪市住之江区平林南1-5-22,0665696700（06-6569-6700）,10000（千円）,井内　一孝（イウチ ヒロタカ）
株式会社エムティーサービス,7120001119746,ビジネス > 運送・貨物・倉庫,〒533-0005大阪府大阪市東淀川区瑞光3-3-22,0663290330（06-6329-0330）,"",""
コクボ通商株式会社,7120001128755,ビジネス > 運送・貨物・倉庫,〒535-0004大阪府大阪市旭区生江3-12-18,0726531000（072-653-1000）,9000（千円）,小久保　周一（コクボ シユウイチ）
脇田運輸株式会社,7120001134043,ビジネス > 運送・貨物・倉庫,大阪府大阪市住之江区南港中一丁目1-72,0666121953（06-6612-1953）,60000（千円）,代表取締役社長／脇田　浩二（ワキタ コウジ）
田村運輸株式会社,7120001148167,ビジネス > 運送・貨物・倉庫,〒572-0848大阪府寝屋川市秦町12-33,0728223686（072-822-3686）,"",""
株式会社野出運輸,7120001148464,ビジネス > 運送・貨物・倉庫,〒572-0801大阪府寝屋川市寝屋1-37-28,0728252301（072-825-2301）,32000（千円）,代表取締役社長／園田　常徳（ソノダ ツネノリ）
株式会社斉藤組,7120001149611,ビジネス > 運送・貨物・倉庫,〒573-1138大阪府枚方市招提北町2-18-1,0728574450（072-857-4450）,"",""
常盤運輸株式会社,7120001150156,ビジネス > 運送・貨物・倉庫,〒573-0114大阪府枚方市穂谷2188-5,0728580401（072-858-0401）,"",""
若林運送株式会社,7120001156995,ビジネス > 運送・貨物・倉庫,〒570-0032大阪府守口市菊水通2-19-1菊水第二ビル207,0669915254（06-6991-5254）,"",""
株式会社喜多重機興業,7120101001878,ビジネス > 運送・貨物・倉庫,〒591-8012大阪府堺市北区中村町601番地の1,0722521300（072-252-1300）,10000（千円）,喜多　壽明（キタ トシアキ）
株式会社クロイワ電設運輸,7120101023468,ビジネス > 運送・貨物・倉庫,〒587-0043大阪府堺市美原区青南台2-15-5,0723627018（072-362-7018）,25000（千円）,黒岩　秀一（クロイワ シユウイチ）
アサヒ急配株式会社,7120101033500,ビジネス > 運送・貨物・倉庫,〒586-0067大阪府河内長野市南青葉台34-7,0721636607（0721-63-6607）,39000（千円）,福井　美公子（フクイ ミキコ）
八木運送株式会社,7120101037724,ビジネス > 運送・貨物・倉庫,〒596-0802大阪府岸和田市西大路町17,0724432862（072-443-2862）,"",""
岡田運送株式会社,7120101038004,ビジネス > 運送・貨物・倉庫,〒597-0083大阪府貝塚市海塚69-1,0724323500（072-432-3500）,"",""
神野潜水土木工業株式会社,7120101042930,ビジネス > 運送・貨物・倉庫,〒595-0805大阪府泉北郡忠岡町忠岡東2-8-3,0725323396（0725-32-3396）,"",""
大恵運輸株式会社,7120101043771,ビジネス > 運送・貨物・倉庫,〒594-1135大阪府和泉市坪井町381-1,0725920968（0725-92-0968）,"",""
有限会社平山商店,7120102018995,ビジネス > 運送・貨物・倉庫,〒583-0841大阪府羽曳野市駒ヶ谷158,0729572254（072-957-2254）,"",""
株式会社クリエイト,7120102019291,ビジネス > 運送・貨物・倉庫,〒550-0001大阪府大阪市西区土佐堀1-6-20新栄ビル10F,0664440209（06-6444-0209）,"",""
有限会社ヒラマツ,7120102022642,ビジネス > 運送・貨物・倉庫,〒596-0011大阪府岸和田市木材町15-2,0724399872（072-439-9872）,"",""
木下運送株式会社,7120901006119,ビジネス > 運送・貨物・倉庫,〒564-0043大阪府吹田市南吹田5-20-7,0663858811（06-6385-8811）,"",""
アジア運輸株式会社,7120901008957,ビジネス > 運送・貨物・倉庫,〒566-0052大阪府摂津市鳥飼本町2-5-31,0726537577（072-653-7577）,"",""
旭興産運輸株式会社,7120901008981,ビジネス > 運送・貨物・倉庫,〒566-0035大阪府摂津市鶴野3-5-15,0726322091（072-632-2091）,"",""
昭和運輸株式会社,7120901011333,ビジネス > 運送・貨物・倉庫,〒569-0834大阪府高槻市唐崎1182,0726772306（072-677-2306）,"",""
産交バス株式会社,7120901026430,ビジネス > 運送・貨物・倉庫,〒561-0825大阪府豊中市二葉町1-1-35,0648678181（06-4867-8181）,25000（千円）,谷川　健男（タニガワ タテオ）
川口運送株式会社,7122001001504,ビジネス > 運送・貨物・倉庫,〒579-8063大阪府東大阪市横小路町5-7-35,0729871125（072-987-1125）,"",""
土屋運送株式会社,7122001004960,ビジネス > 運送・貨物・倉庫,〒577-0065大阪府東大阪市高井田中4-1-15,0667817551（06-6781-7551）,"",""
米田産業株式会社,7122001014464,ビジネス > 運送・貨物・倉庫,〒579-8003大阪府東大阪市日下町5-3-34,0729871736（072-987-1736）,"",""
アトム物流株式会社,7122001016106,ビジネス > 運送・貨物・倉庫,〒575-0003大阪府四條畷市岡山東3-1-49,0728621221（072-862-1221）,10000（千円）,橋本　新一（ハシモト シンイチ）
大通運輸株式会社,7122001016849,ビジネス > 運送・貨物・倉庫,〒574-0052大阪府大東市新田北町5-14,0728061101（072-806-1101）,"",""
株式会社翔神通商,7122001017203,ビジネス > 運送・貨物・倉庫,〒574-0025大阪府大東市御供田3-1-14,0728693502（072-869-3502）,5000（千円）,神田　依弘也（カンダ イクヤ）
株式会社サンコー運輸,7122001024736,ビジネス > 運送・貨物・倉庫,〒578-0963大阪府東大阪市新庄4-12-24,0729682071（072-968-2071）,40000（千円）,代表取締役社長／山津　昌之（ヤマツ マサユキ）
株式会社グリーン,7122001027623,ビジネス > 運送・貨物・倉庫,〒578-0903大阪府東大阪市今米1-3-6,0729657103（072-965-7103）,10000（千円）,平山　武広（ヒラヤマ タケヒロ）
大阪旭海運株式会社,8010401005770,ビジネス > 運送・貨物・倉庫,〒552-0001大阪府大阪市港区波除6丁目2番33号,0665817536（06-6581-7536）,"",""
新栄運輸株式会社,8120001007751,ビジネス > 運送・貨物・倉庫,〒534-0027大阪府大阪市都島区中野町2-14-18,0663561362（06-6356-1362）,"",""
鳥居運送株式会社,8120001010524,ビジネス > 運送・貨物・倉庫,〒546-0001大阪府大阪市東住吉区今林3丁目1番55号,0667571136（06-6757-1136）,15147（千円）,代表取締役社長／鳥居　俊彦（トリイ トシヒコ）
大成運輸株式会社,8120001012792,ビジネス > 運送・貨物・倉庫,〒537-0003大阪府大阪市東成区神路3-7-29,0669760021（06-6976-0021）,17000（千円）,代表取締役社長／浦尾　吉樹（ウラオ ヨシキ）
櫻島埠頭株式会社,8120001026363,ビジネス > 運送・貨物・倉庫,〒554-0032大阪府大阪市此花区梅町1丁目2番地,0664665813（06-6466-5813）,770000（千円）,代表取締役社長／平井　正博（ヒライ マサヒロ）
石丸運輸株式会社,8120001027080,ビジネス > 運送・貨物・倉庫,〒551-0002大阪府大阪市大正区三軒家東2-8-8,0665523401（06-6552-3401）,"",""
三浦運送株式会社,8120001028194,ビジネス > 運送・貨物・倉庫,〒551-0002大阪府大阪市大正区三軒家東5-13-12,0665546626（06-6554-6626）,"",""
東和運送株式会社,8120001045768,ビジネス > 運送・貨物・倉庫,大阪府大阪市西区江戸堀1丁目26番28号,0664410222（06-6441-0222）,"",""
日本交通株式会社,8120001049042,ビジネス > 運送・貨物・倉庫,〒550-0013大阪府大阪市西区新町3-21-15,0665417551（06-6541-7551）,"",""
宮崎興業株式会社,8120001050743,ビジネス > 運送・貨物・倉庫,〒555-0043大阪府大阪市西淀川区大野2-1-21,0664713737（06-6471-3737）,"",""
株式会社グリーン,8120001063340,ビジネス > 運送・貨物・倉庫,大阪府大阪市北区梅田1丁目1番3-900号大阪駅前第3ビル9階,0663451789（06-6345-1789）,"",""
株式会社リンケージ,8120001072077,ビジネス > 運送・貨物・倉庫,〒530-0044大阪府大阪市北区東天満1-2-6,0663550261（06-6355-0261）,"",""
三浦運輸株式会社,8120001156739,ビジネス > 運送・貨物・倉庫,〒570-0043大阪府守口市南寺方東通2-10-15,0669916011（06-6991-6011）,"",""
株式会社丸和,8120001158198,ビジネス > 運送・貨物・倉庫,〒571-0073大阪府門真市北巣本町19-12,0728851571（072-885-1571）,"",""
河合運輸株式会社,8120001158719,ビジネス > 運送・貨物・倉庫,〒571-0007大阪府門真市北岸和田3-13-22,0728009121（072-800-9121）,"",""
大阪北合同運送株式会社,8120001159262,ビジネス > 運送・貨物・倉庫,〒571-0041大阪府門真市柳町20-10,0669092162（06-6909-2162）,"",""
有限会社鶴亀組,8120002014895,ビジネス > 運送・貨物・倉庫,〒551-0001大阪府大阪市大正区三軒家西3-2-23,0665512992（06-6551-2992）,8000（千円）,田川　正則（タガワ マサノリ）
正和運送有限会社,8120002022031,ビジネス > 運送・貨物・倉庫,〒550-0015大阪府大阪市西区南堀江1-27-9道頓堀紀和ビル,0665310515（06-6531-0515）,"",""
有限会社マルマサ運送,8120002042269,ビジネス > 運送・貨物・倉庫,〒546-0022大阪府大阪市東住吉区住道矢田6-9-11,0667005186（06-6700-5186）,"",""
有限会社山崎,8120002071796,ビジネス > 運送・貨物・倉庫,〒576-0062大阪府交野市神宮寺1-4-10,0728918161（072-891-8161）,"",""
株式会社大阪食品流通センター,8120101001381,ビジネス > 運送・貨物・倉庫,〒599-8101大阪府堺市東区八下町1-122,0722505522（072-250-5522）,"",""
佐竹運送株式会社,8120101008360,ビジネス > 運送・貨物・倉庫,〒592-0001大阪府高石市高砂3-78,0722680525（072-268-0525）,"",""
東西運輸株式会社,8120101008451,ビジネス > 運送・貨物・倉庫,〒592-0001大阪府高石市高砂2-9-6,0722681171（072-268-1171）,20000（千円）,村田　吉隆（ムラタ ヨシタカ）
株式会社柿本,8120101026800,ビジネス > 運送・貨物・倉庫,〒580-0032大阪府松原市天美東7-12-25-302,0723335746（072-333-5746）,"",""
林運送株式会社,8120101031148,ビジネス > 運送・貨物・倉庫,〒584-0044大阪府富田林市別井3-1-8,0721245459（0721-24-5459）,"",""
金剛運送株式会社,8120101032055,ビジネス > 運送・貨物・倉庫,〒583-0852大阪府羽曳野市古市7-10-1,0729571661（072-957-1661）,"",""
小山運送株式会社,8120101038119,ビジネス > 運送・貨物・倉庫,〒597-0033大阪府貝塚市半田129,0724312684（072-431-2684）,"",""
サザンエアポート交通株式会社,8120101039711,ビジネス > 運送・貨物・倉庫,〒598-0034大阪府泉佐野市長滝3963-1,0724667701（072-466-7701）,20000（千円）,代表取締役社長／大喜多　治（オオキタ オサム）
株式会社日本トラフィックサービス,8120101044331,ビジネス > 運送・貨物・倉庫,〒549-0021大阪府泉南市泉州空港南1JALKAS輸入貨物ビル2F,0724568411（072-456-8411）,"",""
株式会社ミナトライン,8120101044439,ビジネス > 運送・貨物・倉庫,〒590-0531大阪府泉南市岡田2-547-2,0724820033（072-482-0033）,"",""
株式会社岡本運輸,8120901000376,ビジネス > 運送・貨物・倉庫,〒567-0805大阪府茨木市橋の内3-11-16,0726344944（072-634-4944）,"",""
株式会社新生,8120901001077,ビジネス > 運送・貨物・倉庫,〒579-8001大阪府東大阪市善根寺町3-1-28,0729867477（072-986-7477）,"",""
総合物流サービス株式会社,8120901001184,ビジネス > 運送・貨物・倉庫,〒567-0029大阪府茨木市五日市緑町5-17,0726255886（072-625-5886）,"",""
株式会社大阪西物流,8120901009178,ビジネス > 運送・貨物・倉庫,〒566-0052大阪府摂津市鳥飼本町3-1-11,0726540308（072-654-0308）,"",""
シンヨウ倉庫運輸株式会社,8120901011118,ビジネス > 運送・貨物・倉庫,〒569-0833大阪府高槻市唐崎南2-2-1,0726782121（072-678-2121）,38300（千円）,代表取締役社長／秋友　清志（アキトモ キヨシ）
株式会社リボンド,8120901015457,ビジネス > 運送・貨物・倉庫,〒566-0001大阪府摂津市千里丘7-10-24アメニティブワ2F,0663840181（06-6384-0181）,"",""
株式会社ロイヤルコーポレーション,8120901026181,ビジネス > 運送・貨物・倉庫,大阪府豊中市庄内宝町1丁目5番1号,0648679313（06-4867-9313）,"",""
ザイロ株式会社,8122001002559,ビジネス > 運送・貨物・倉庫,〒577-0016大阪府東大阪市長田西1-4-44,0667822311（06-6782-2311）,10000（千円）,東　敏郎（ヒガシ トシロウ）
株式会社リリーフセンター,8122001008234,ビジネス > 運送・貨物・倉庫,〒578-0921大阪府東大阪市水走5-5-32,0729663681（072-966-3681）,10000（千円）,中牟田　満麗（ナカムタ ミツヨシ）
阪神トランスポート株式会社,8122001015833,ビジネス > 運送・貨物・倉庫,〒574-0064大阪府大東市御領1-10-4,0728748894（072-874-8894）,70009（千円）,藤岡　正哉（フジオカ マサヤ）
川崎商事株式会社,8122001018159,ビジネス > 運送・貨物・倉庫,〒581-0883大阪府八尾市恩智中町4-229,0729436787（072-943-6787）,"",""
株式会社マックスラン,8122001020081,ビジネス > 運送・貨物・倉庫,〒581-0014大阪府八尾市中田3-62-2,0729953070（072-995-3070）,"",""
ヨーコーサービス有限会社,8122002005866,ビジネス > 運送・貨物・倉庫,〒578-0914大阪府東大阪市箕輪2-2-29,0729641575（072-964-1575）,6000（千円）,横山　江里子（ヨコヤマ エリコ）
株式会社ケイ・ティーデポ,9120001017361,ビジネス > 運送・貨物・倉庫,〒544-0013大阪府大阪市生野区巽中1-25-12-202ナティノース202,0667541516（06-6754-1516）,10000（千円）,高井　義之（タカイ ヨシユキ）
酒見自動車株式会社,9120001027492,ビジネス > 運送・貨物・倉庫,〒551-0031大阪府大阪市大正区泉尾5-18-28,0665540099（06-6554-0099）,"",""
大阪港検数株式会社,9120001030091,ビジネス > 運送・貨物・倉庫,〒552-0021大阪府大阪市港区築港4-2-17,0665720071（06-6572-0071）,"",""
ダイシン物流株式会社,9120001035438,ビジネス > 運送・貨物・倉庫,大阪府大阪市福島区福島8丁目19-9,0664585812（06-6458-5812）,"",""
新井運送株式会社,9120001049140,ビジネス > 運送・貨物・倉庫,〒555-0001大阪府大阪市西淀川区佃6-4-13,0664712102（06-6471-2102）,"",""
山根運送株式会社,9120001050973,ビジネス > 運送・貨物・倉庫,〒555-0043大阪府大阪市西淀川区大野1-10-27,0664740165（06-6474-0165）,20000（千円）,山根　仁志（ヤマネ ヒトシ）
株式会社グリーンフィールド,9120001063364,ビジネス > 運送・貨物・倉庫,大阪府大阪市北区梅田1丁目1番3-900号大阪駅前第3ビル9階,0663451789（06-6345-1789）,"",""
大真船舶株式会社,9120001066508,ビジネス > 運送・貨物・倉庫,〒530-0005大阪府大阪市北区中之島3-3-23中之島ダイビル910-d,0664452013（06-6445-2013）,10000（千円）,代表取締役社長／眞鍋　挙秀（マナベ タカヨシ）
株式会社ベストトランス,9120001105777,ビジネス > 運送・貨物・倉庫,〒542-0081大阪府大阪市中央区南船場2-6-26安二ビル401,0662668848（06-6266-8848）,"",""
山藤運送株式会社,9120001119620,ビジネス > 運送・貨物・倉庫,〒559-0024大阪府大阪市住之江区新北島7-4-53,0666825011（06-6682-5011）,"",""
株式会社湘南アールサービス,9120001129933,ビジネス > 運送・貨物・倉庫,〒530-0012大阪府大阪市北区芝田2-4-4大阪ビジネスソリューション（株）,0663722121（06-6372-2121）,"",""
株式会社グリーン,9120001139940,ビジネス > 運送・貨物・倉庫,大阪府大阪市北区梅田1丁目1番3-900号大阪駅前第3ビル9階,0663451789（06-6345-1789）,"",""
下田運輸株式会社,9120001147035,ビジネス > 運送・貨物・倉庫,〒576-0054大阪府交野市幾野4-20-1,0728921151（072-892-1151）,"",""
株式会社フジ物流,9120001147200,ビジネス > 運送・貨物・倉庫,〒576-0054大阪府交野市幾野2-37-14,0728943451（072-894-3451）,"",""
関西トランスシティサービス株式会社,9120001149287,ビジネス > 運送・貨物・倉庫,〒573-0101大阪府枚方市長尾峠町46-1,0728568699（072-856-8699）,10000（千円）,瀬古　智広（セコ トモヒロ）
有限会社山秀運送店,9120002015991,ビジネス > 運送・貨物・倉庫,〒552-0007大阪府大阪市港区弁天4-10-3,0665738890（06-6573-8890）,"",""
株式会社大木組,9120101000969,ビジネス > 運送・貨物・倉庫,〒590-0986大阪府堺市堺区北波止町42番47,0722322184（072-232-2184）,"",""
株式会社関西ライン,9120101001612,ビジネス > 運送・貨物・倉庫,〒592-0001大阪府高石市高砂3-80,0722692255（072-269-2255）,20000（千円）,岩尾　直人（イワオ ナオト）
株式会社ダイキ,9120101004012,ビジネス > 運送・貨物・倉庫,〒590-0142大阪府堺市南区檜尾3951,0722348868（072-234-8868）,10000（千円）,境家　克行（サカイヤ カツユキ）
矢野物流サービス株式会社,9120101007618,ビジネス > 運送・貨物・倉庫,〒590-0968大阪府堺市堺区南旅篭町西3-2-20,0722389419（072-238-9419）,"",""
久米田運送株式会社,9120101038092,ビジネス > 運送・貨物・倉庫,〒597-0061大阪府貝塚市浦田101,0724312233（072-431-2233）,10000（千円）,杉本　茂和（スギモト シゲカズ）
有限会社久米田流通センター,9120102021989,ビジネス > 運送・貨物・倉庫,〒597-0061大阪府貝塚市浦田101,0724237117（072-423-7117）,"",""
横山運輸有限会社,9120102025651,ビジネス > 運送・貨物・倉庫,〒594-1122大阪府和泉市北田中町243-1,0725920613（0725-92-0613）,"",""
ハヤト運輸株式会社,9120901001729,ビジネス > 運送・貨物・倉庫,〒567-0022大阪府茨木市三島町2-1-906,0726389551（072-638-9551）,"",""
株式会社ハンワ,9120901001745,ビジネス > 運送・貨物・倉庫,〒567-0865大阪府茨木市横江1-17-25,0726369700（072-636-9700）,"",""
株式会社新聞発送サービスセンター,9120901002710,ビジネス > 運送・貨物・倉庫,〒567-0865大阪府茨木市横江1-4-5,0726303131（072-630-3131）,10000（千円）,高松　義信（タカマツ ヨシノブ）
株式会社オーアイロジテム,9120901005762,ビジネス > 運送・貨物・倉庫,〒564-0071大阪府吹田市西の庄町7-24,0663880563（06-6388-0563）,"",""
