会社名,法人番号,業種,住所,電話番号,資本金,代表氏名
小林運輸株式会社,7070001001257,道路貨物運送業,〒371-0103群馬県前橋市富士見町小暮1412-2,0272887064（027-288-7064）,10000（千円）,小林　哲也（コバヤシ テツヤ）
株式会社プライムプラン,7070001002833,航空運輸業,〒371-0846群馬県前橋市元総社町142-1,0272533373（027-253-3373）,20000（千円）,代表取締役社長／伊勢　光一（イセ コウイチ）
前橋定期運送株式会社,7070001002981,道路貨物運送業,〒379-2134群馬県前橋市力丸町463,0272652345（027-265-2345）,50000（千円）,茂木　幸男（モギ ユキオ）
株式会社三山運輸,7070001003220,道路貨物運送業,〒379-2117群馬県前橋市二之宮町1439,0272686996（027-268-6996）,10000（千円）,坂井　秀明（サカイ ヒデアキ）
株式会社Ｓ．Ｙ．Ｌ,7070001004482,倉庫業,〒371-0201群馬県前橋市粕川町中之沢8-15,0272306226（027-230-6226）,10000（千円）,山口　茂（ヤマグチ シゲル）
株式会社大伸,7070001004714,道路貨物運送業,〒371-0221群馬県前橋市樋越町515-5,0272304331（027-230-4331）,3500（千円）,根本　伸一（ネモト シンイチ）
株式会社ライズ,7070001005935,道路貨物運送業,〒371-0857群馬県前橋市高井町1-13-10,0272533302（027-253-3302）,10000（千円）,相原　佳寛（アイハラ ヨシヒロ）
株式会社泰平トラベル,7070001007584,運輸に付帯するサービス業,〒370-0857群馬県高崎市上佐野町435-2,0273283871（027-328-3871）,10000（千円）,酒井　次男（サカイ ツギオ）
堤自動車運送株式会社,7070001007725,道路貨物運送業,〒370-0031群馬県高崎市上大類町1025,0273523608（027-352-3608）,10000（千円）,堤　文男（ツツミ フミオ）
みつわ運輸株式会社,7070001008500,道路貨物運送業,〒370-0862群馬県高崎市片岡町1-17-22,0273259236（027-325-9236）,10000（千円）,代表取締役社長／轟　英治（トドロキ エイジ）
株式会社吉原,7070001008723,道路貨物運送業,〒370-0069群馬県高崎市飯塚町210,0273613984（027-361-3984）,10000（千円）,吉原　秀忠（ヨシハラ ヒデタダ）
株式会社ＬＵＣ,7070001010134,道路貨物運送業,〒379-0133群馬県安中市原市880-1,0273802455（027-380-2455）,10000（千円）,内田　光彦（ウチダ ミツヒコ）
群馬環境物流株式会社,7070001010357,運輸に付帯するサービス業,〒370-1201群馬県高崎市倉賀野町3250-12群馬環境リサイクルセンター内,0273462511（027-346-2511）,10000（千円）,臼田　信昭（ウスダ ノブアキ）
株式会社サンシンデーター管理センター,7070001013384,倉庫業,〒379-2214群馬県伊勢崎市下触町746-1,0270632166（0270-63-2166）,10000（千円）,福田　景晴（フクダ カゲハル）
境運輸株式会社,7070001014093,道路貨物運送業,〒370-0134群馬県伊勢崎市境島村238-3,0270745520（0270-74-5520）,12000（千円）,橋本　公章（ハシモト キミアキ）
田中興業株式会社,7070001014242,道路貨物運送業,〒370-1128群馬県佐波郡玉村町後箇248-8,0270651400（0270-65-1400）,10000（千円）,田中　利夫（タナカ トシオ）
株式会社高木運輸,7070001014341,道路貨物運送業,〒370-0104群馬県伊勢崎市境木島160,0270763925（0270-76-3925）,20000（千円）,高木　秀幸（タカギ ヒデユキ）
Ｇ２・サポート株式会社,7070001014795,道路貨物運送業,〒379-2221群馬県伊勢崎市国定町1-993,0270400400（0270-40-0400）,3000（千円）,剣持　輝明（ケンモチ テルアキ）
株式会社新井グループ運輸,7070001015224,道路貨物運送業,〒379-2203群馬県伊勢崎市曲沢町1554,0270632322（0270-63-2322）,50000（千円）,新井　徹（アライ トオル）
久保田運輸倉庫株式会社,7070001015892,道路貨物運送業,〒379-2312群馬県みどり市笠懸町久宮70-16,0277762008（0277-76-2008）,20000（千円）,代表取締役社長／永井　正之（ナガイ マサユキ）
東群運送株式会社,7070001016874,道路貨物運送業,〒376-0003群馬県桐生市琴平町2-6,0277450195（0277-45-0195）,15000（千円）,代表取締役／斎藤　佳代子（サイトウ カヨコ）
株式会社ディー・カンパニー,7070001018367,道路貨物運送業,〒377-0027群馬県渋川市金井2734-193,0279250418（0279-25-0418）,6000（千円）,山崎　晃嗣（ヤマザキ コウジ）
株式会社アスク,7070001018615,道路貨物運送業,〒370-0332群馬県太田市新田中江田町1221-5,0276562432（0276-56-2432）,25000（千円）,浅香　次男（アサカ ツギオ）
株式会社小澤運送店,7070001018937,道路貨物運送業,〒373-0012群馬県太田市清原町2-1,0276378080（0276-37-8080）,20000（千円）,小平　稔（コダイラ ミノル）
蛭間運送株式会社,7070001020488,道路貨物運送業,〒379-2304群馬県太田市大原町38-1,0277786001（0277-78-6001）,10000（千円）,蛭間　幹夫（ヒルマ ミキオ）
株式会社山芳荷役,7070001021305,道路貨物運送業,〒370-0421群馬県太田市粕川町73-7,0276526107（0276-52-6107）,4000（千円）,山田　芳民（ヤマダ ヨシタミ）
マルエー運輸倉庫株式会社,7070001022006,道路貨物運送業,〒370-0704群馬県邑楽郡明和町斗合田115-2,0276733025（0276-73-3025）,15000（千円）,荒井　一男（アライ カズオ）
株式会社ＴＲＵＳＴ,7070001022609,道路貨物運送業,〒370-0524群馬県邑楽郡大泉町古海369,0276639399（0276-63-9399）,1000（千円）,田村　修一（タムラ シユウイチ）
浅間観光自動車株式会社,7070001023648,運輸に付帯するサービス業,〒377-1612群馬県吾妻郡嬬恋村大前775,0279961221（0279-96-1221）,10000（千円）,宮崎　法夫（ミヤザキ ノリオ）
株式会社ＡＬＳ,7070001027021,道路貨物運送業,〒372-0022群馬県伊勢崎市日乃出町701-9,0270207720（0270-20-7720）,5000（千円）,秋山　洋一（アキヤマ ヨウイチ）
株式会社上徳総業,7070001027566,道路貨物運送業,〒370-0314群馬県太田市新田市野井町810-1,0276556161（0276-55-6161）,3000（千円）,徳田　和弥（トクダ カズヤ）
大島倉庫運輸有限会社,7070002001025,道路貨物運送業,〒379-2152群馬県前橋市下大島町573,0272660244（027-266-0244）,5000（千円）,関口　宣男（セキグチ ノブオ）
有限会社倉持商事,7070002001933,道路貨物運送業,〒379-2132群馬県前橋市東善町341-2,0272665172（027-266-5172）,7000（千円）,倉持　司（クラモチ ツカサ）
細野物流有限会社,7070002007971,道路貨物運送業,〒379-2122群馬県前橋市駒形町821-185,0272661623（027-266-1623）,4000（千円）,細野　茂信（ホソノ シゲノブ）
小幡運送有限会社,7070002016072,道路貨物運送業,〒370-2202群馬県甘楽郡甘楽町小幡131-5,0274744280（0274-74-4280）,12000（千円）,田中　三郎（タナカ サブロウ）
ニッタル運輸有限会社,7070002017649,道路貨物運送業,〒375-0054群馬県藤岡市上大塚248-9,0274224370（0274-22-4370）,15000（千円）,西村　進（ニシムラ ススム）
喜多野通舞総業有限会社,7070002018003,道路貨物運送業,〒375-0053群馬県藤岡市中大塚738-5,0274246435（0274-24-6435）,15000（千円）,茂木　一喜（モギ カズキ）
金田運輸株式会社,7070002020685,道路貨物運送業,〒370-1122群馬県佐波郡玉村町上茂木421-1,0270652933（0270-65-2933）,30000（千円）,金田　充夫（カネタ ミツオ）
有限会社城南商事,7070002021337,道路貨物運送業,〒379-2211群馬県伊勢崎市市場町2-446-1,0270626442（0270-62-6442）,9500（千円）,神沢　博（カンザワ ヒロシ）
有限会社宝船商運,7070002021898,道路貨物運送業,〒379-2201群馬県伊勢崎市間野谷町1167,0270633717（0270-63-3717）,5200（千円）,寶船　弓広（ホウセン ユミヒロ）
有限会社丸喜運送,7070002022046,道路貨物運送業,〒379-2201群馬県伊勢崎市間野谷町93-109,0270628688（0270-62-8688）,5000（千円）,時崎　丈夫（トキザキ タケオ）
丸正運輸有限会社,7070002022062,道路貨物運送業,〒379-2221群馬県伊勢崎市国定町1-186-1,0270630245（0270-63-0245）,5000（千円）,大山　佳男（オオヤマ ヨシオ）
有限会社群馬中部運送,7070002023283,道路貨物運送業,〒376-0125群馬県桐生市新里町山上1403-1,0277748343（0277-74-8343）,7000（千円）,千本木　誠（センボンギ マコト）
有限会社トラベルサロン,7070002024265,運輸に付帯するサービス業,〒376-0101群馬県みどり市大間々町大間々40,0277307011（0277-30-7011）,3000（千円）,福島　孝（フクシマ タカシ）
有限会社田村運送,7070002027342,道路貨物運送業,〒370-3502群馬県北群馬郡榛東村山子田1823,0279544063（0279-54-4063）,5000（千円）,田村　元伸（タムラ モトノブ）
群馬急行運送有限会社,7070002028910,道路貨物運送業,〒379-2302群馬県太田市山之神町297-9,0277787638（0277-78-7638）,10000（千円）,星野　雅英（ホシノ マサヒデ）
有限会社竹澤運輸,7070002029917,道路貨物運送業,〒370-0604群馬県邑楽郡邑楽町石打645-5,0276888711（0276-88-8711）,21500（千円）,竹澤　好（タケザワ ヨシミ）
有限会社タカノ物流,7070002029941,道路貨物運送業,〒373-0825群馬県太田市高林東町1690,0276380209（0276-38-0209）,17000（千円）,高野　忠義（タカノ タダヨシ）
有限会社マキタ,7070002030957,運輸に付帯するサービス業,〒370-0314群馬県太田市新田市野井町1712-2,0276571233（0276-57-1233）,10000（千円）,有野　たみ江（アリノ タミエ）
有限会社ユーユータイムズ,7070002032292,運輸に付帯するサービス業,〒373-0813群馬県太田市内ケ島町340-1,0276306111（0276-30-6111）,3000（千円）,小川　恒夫（オガワ ツネオ）
トレジャー興業有限会社,7070002034272,道路貨物運送業,〒374-0011群馬県館林市羽附町684-6,0276756008（0276-75-6008）,3000（千円）,藤原　弘志（フジワラ ヒロシ）
有限会社Ｔ．Ｋコーポレーション,7070002034438,道路貨物運送業,〒374-0132群馬県邑楽郡板倉町板倉1164-2,0276822099（0276-82-2099）,3000（千円）,荻野　孝行（オギノ タカユキ）
有限会社入沢運送店,7070002035262,道路貨物運送業,〒378-0415群馬県利根郡片品村鎌田3951,0278583018（0278-58-3018）,3000（千円）,入澤　榮（イリサワ サカエ）
赤城造林有限会社,7070002035345,水運業,〒378-0312群馬県沼田市利根町根利450,0278548825（0278-54-8825）,3000（千円）,新井　貴幸（アライ タカユキ）
有限会社北部運輸,7070002035493,道路貨物運送業,〒379-1303群馬県利根郡みなかみ町上牧1848-1,0278723791（0278-72-3791）,10000（千円）,阿部　信幸（アベ ノブユキ）
有限会社青木建材土木,7070002036104,道路貨物運送業,〒377-0807群馬県吾妻郡東吾妻町泉沢811,0279682749（0279-68-2749）,5000（千円）,青木　貞夫（アオキ サダオ）
有限会社浅井建材運輸,7070002036137,道路貨物運送業,〒377-1411群馬県吾妻郡長野原町応桑1984-109,0279852323（0279-85-2323）,8500（千円）,浅井　征夫（アサイ ユキオ）
高崎ガス供給センター事業協同組合,7070005002581,道路貨物運送業,〒370-0871群馬県高崎市上豊岡町558-4,0273236006（027-323-6006）,34700（千円）,茂木　俊宏（モテキ トシヒロ）
権田生産森林組合,7070005002755,鉄道業,〒370-3401群馬県高崎市倉渕町権田1156,0273783036（027-378-3036）,91460（千円）,矢野　幸雄（ヤノ ユキオ）
上野原生産森林組合,7070005005634,鉄道業,〒370-3503群馬県北群馬郡榛東村新井1429-1,0279548014（0279-54-8014）,13158（千円）,三俣　三郎（ミツマタ サブロウ）
株式会社群馬トラベルサービス,8070001000976,運輸に付帯するサービス業,〒371-0013群馬県前橋市西片貝町5-4-36,0272237711（027-223-7711）,70000（千円）,高橋　功一（タカハシ コウイチ）
上武運送株式会社,8070001001677,道路貨物運送業,〒371-0122群馬県前橋市小坂子町1506-7,0272696360（027-269-6360）,18000（千円）,冨岡　寛（トミオカ ヒロシ）
株式会社ニュー・コロンブス・ツアーズ,8070001002510,運輸に付帯するサービス業,〒371-0841群馬県前橋市石倉町5-9-1,0272540746（027-254-0746）,17000（千円）,宮崎　勝弘（ミヤザキ カツヒロ）
株式会社新美商事,8070001005141,道路貨物運送業,〒371-0235群馬県前橋市滝窪町1368-12,0272840123（027-284-0123）,5000（千円）,新井　友也（アライ トモヤ）
高崎陸送株式会社,8070001007526,道路貨物運送業,〒370-3105群馬県高崎市箕郷町西明屋952-8,0273713939（027-371-3939）,20000（千円）,卜部　桂樹（ウラベ ケイジ）
第一鋼業株式会社,8070001007542,道路貨物運送業,〒370-3333群馬県高崎市高浜町535,0273437323（027-343-7323）,10000（千円）,戸塚　將明（トツカ マサアキ）
昭和運輸株式会社,8070001009935,道路貨物運送業,〒379-0124群馬県安中市鷺宮921-1,0273805510（027-380-5510）,10000（千円）,梶山　勝日孫（カジヤマ カツヒコ）
株式会社新星運輸,8070001010389,道路貨物運送業,〒370-3101群馬県高崎市箕郷町柏木沢1971-12,0273715264（027-371-5264）,10000（千円）,瀧野　直樹（タキノ ナオキ）
株式会社かぶらロジシステム,8070001011131,運輸に付帯するサービス業,〒370-2464群馬県富岡市南蛇井1482,0274674556（0274-67-4556）,1000（千円）,櫻井　明彦（サクライ アキヒコ）
株式会社柳沢運送,8070001011965,道路貨物運送業,〒370-2202群馬県甘楽郡甘楽町小幡807,0274742016（0274-74-2016）,10000（千円）,柳沢　清司（ヤナギサワ セイジ）
株式会社萬場,8070001012567,道路貨物運送業,〒375-0012群馬県藤岡市下戸塚176-2,0274238241（0274-23-8241）,10000（千円）,石崎　勝宥（イシザキ カツヒロ）
株式会社アラックス,8070001013061,道路貨物運送業,〒372-0022群馬県伊勢崎市日乃出町701-6,0270236480（0270-23-6480）,10000（千円）,新井　一夫（アライ カズオ）
石善商会株式会社,8070001013103,道路貨物運送業,〒372-0001群馬県伊勢崎市波志江町3326-1,0270260492（0270-26-0492）,10000（千円）,石田　和夫（イシダ カズオ）
株式会社長岡運送,8070001013607,道路貨物運送業,〒379-2204群馬県伊勢崎市西久保町3-1143-9,0270756311（0270-75-6311）,10000（千円）,長岡　治（ナガオカ オサム）
中一陸運株式会社,8070001014836,道路貨物運送業,〒379-2235群馬県伊勢崎市三室町6201-9,0270628888（0270-62-8888）,27500（千円）,代表取締役社長／中川　一（ナカガワ ハジメ）
大賀運輸株式会社,8070001014927,道路貨物運送業,〒372-0015群馬県伊勢崎市鹿島町397-2,0270244876（0270-24-4876）,5000（千円）,大賀　庸博（オオガ ツネヒロ）
株式会社ビュートラベル,8070001016477,運輸に付帯するサービス業,〒376-0011群馬県桐生市相生町3-579-8,0277540113（0277-54-0113）,10000（千円）,綿貫　健児（ワタヌキ ケンジ）
東武北関東観光株式会社,8070001017822,運輸に付帯するサービス業,〒370-3604群馬県北群馬郡吉岡町南下525-4,0279550267（0279-55-0267）,10000（千円）,大澤　庄作（オオサワ シヨウサク）
株式会社友和興業,8070001017979,道路貨物運送業,〒379-1121群馬県渋川市赤城町宮田1131,0279563400（0279-56-3400）,10000（千円）,津久井　直治（ツクイ ナオジ）
株式会社エス・テー・エス,8070001018795,道路貨物運送業,〒370-0344群馬県太田市新田早川町3,0276562647（0276-56-2647）,11500（千円）,鈴木　雅裕（スズキ マサユキ）
株式会社久保,8070001019158,倉庫業,〒373-0011群馬県太田市只上町2548,0276371121（0276-37-1121）,10000（千円）,久保田　街香（クボタ マチカ）
株式会社シノザキ,8070001019430,道路貨物運送業,〒373-0033群馬県太田市西本町62-20,0276317234（0276-31-7234）,30000（千円）,篠崎　和子（シノザキ カズコ）
東群太田トラック株式会社,8070001019752,道路貨物運送業,〒370-0505群馬県邑楽郡千代田町新福寺275-4,0276865311（0276-86-5311）,10000（千円）,齊藤　勇（サイトウ イサム）
株式会社東陸,8070001019810,道路貨物運送業,〒373-0023群馬県太田市富若町627,0276261033（0276-26-1033）,10000（千円）,鈴木　秀和（スズキ ヒデカズ）
株式会社ＫＲＳ,8070001021114,道路貨物運送業,〒373-0015群馬県太田市東新町450-4,0276558087（0276-55-8087）,5000（千円）,平賀　健二（ヒラガ ケンジ）
大杉運輸倉庫株式会社,8070001021618,道路貨物運送業,〒374-0042群馬県館林市近藤町178-166,0276720002（0276-72-0002）,30000（千円）,大杉　康弘（オオスギ ヤスヒロ）
株式会社ゴカン産業,8070001023622,道路貨物運送業,〒379-1313群馬県利根郡みなかみ町月夜野1176,0278622875（0278-62-2875）,500（千円）,後閑　邦久（ゴカン クニヒサ）
大島運輸株式会社,8070001023688,道路貨物運送業,〒377-0802群馬県吾妻郡東吾妻町川戸41-1,0279682181（0279-68-2181）,13000（千円）,大島　拓也（オオシマ タクヤ）
群北運輸株式会社,8070001023762,道路貨物運送業,〒377-1612群馬県吾妻郡嬬恋村大前787-1,0279960521（0279-96-0521）,10000（千円）,宮崎　法夫（ミヤザキ ノリオ）
株式会社東毛急送,8070001024380,道路貨物運送業,〒373-0034群馬県太田市藤阿久町499-1,0276324534（0276-32-4534）,6000（千円）,楠田　糾（クスダ タダシ）
伊那倉庫運輸株式会社,8070001024694,道路貨物運送業,〒373-0043群馬県太田市西野谷町45,0276316197（0276-31-6197）,28000（千円）,平田　保（ヒラタ タモツ）
株式会社ライズ,8070001025206,道路貨物運送業,〒371-0857群馬県前橋市高井町1-13-10,0272533302（027-253-3302）,10000（千円）,相原　佳寛（アイハラ ヨシヒロ）
株式会社ブルーペッパー,8070001027020,道路貨物運送業,〒370-0303群馬県太田市新田小金井町320-21,0276309005（0276-30-9005）,50000（千円）,代表取締役社長／堂下　久泰（ドウシタ ヒサヤス）
ＷＯＲＫＳ株式会社,8070001027078,道路貨物運送業,〒379-2204群馬県伊勢崎市西久保町2-141-1,0270615601（0270-61-5601）,6000（千円）,千吉良　薫（チギラ カオル）
有限会社アオキ商事,8070002000059,道路貨物運送業,〒371-0817群馬県前橋市ヌデ島町57-2,0272129177（027-212-9177）,6000（千円）,青木　一也（アオキ カズヤ）
駒形運送有限会社,8070002002195,道路貨物運送業,〒379-2152群馬県前橋市下大島町449-5,0272663885（027-266-3885）,4000（千円）,諸田　精次（モロタ セイジ）
有限会社アイティパック,8070002013358,運輸に付帯するサービス業,〒370-3523群馬県高崎市福島町725-11,0273738828（027-373-8828）,3000（千円）,菅谷　秀雄（スガヤ ヒデオ）
有限会社喜多自動車,8070002014744,運輸に付帯するサービス業,〒379-0135群馬県安中市郷原1482,0273856220（027-385-6220）,3000（千円）,喜多　秀樹（キタ ヒデキ）
有限会社昭和観光,8070002016303,運輸に付帯するサービス業,〒370-2202群馬県甘楽郡甘楽町小幡115-5,0274742903（0274-74-2903）,9000（千円）,熊井戸　俊雄（クマイド トシオ）
高田運送有限会社,8070002017581,道路貨物運送業,〒375-0057群馬県藤岡市上落合941-40,0274245636（0274-24-5636）,7500（千円）,高田　正範（タカダ マサノリ）
有限会社中央旅行,8070002019355,運輸に付帯するサービス業,〒372-0006群馬県伊勢崎市太田町741-1,0270266211（0270-26-6211）,10000（千円）,中島　省三（ナカジマ シヨウゾウ）
有限会社フカサン運輸,8070002021229,道路貨物運送業,〒379-2236群馬県伊勢崎市八寸町4710-1,0270631174（0270-63-1174）,15000（千円）,深沢　和幸（フカサワ カズユキ）
有限会社プラスパア物流,8070002021237,道路貨物運送業,〒379-2235群馬県伊勢崎市三室町4356-1,0270633423（0270-63-3423）,3000（千円）,諏訪　雅彦（スワ マサヒコ）
有限会社共進林建,8070002023225,水運業,〒376-0301群馬県みどり市東町沢入1308,0277956404（0277-95-6404）,3000（千円）,小森谷　啓五（コモリヤ ケイゴ）
有限会社プラスツーリズム,8070002025683,運輸に付帯するサービス業,〒376-0035群馬県桐生市仲町2-11-23,0277208511（0277-20-8511）,6000（千円）,小林　聡（コバヤシ サトル）
有限会社須田商事,8070002026434,道路貨物運送業,〒377-0202群馬県渋川市中郷454-173,0279535124（0279-53-5124）,10000（千円）,須田　茂男（スダ シゲオ）
エルアローカーゴ有限会社,8070002028331,道路貨物運送業,〒379-2301群馬県太田市藪塚町3109-1,0277786861（0277-78-6861）,18000（千円）,矢崎　惠理子（ヤザキ エリコ）
有限会社金山商運,8070002028711,道路貨物運送業,〒379-2301群馬県太田市藪塚町3094-28,0277787717（0277-78-7717）,21000（千円）,長　篤史（チヨウ アツシ）
有限会社群馬商流,8070002028918,道路貨物運送業,〒373-0845群馬県太田市泉町1535,0276319507（0276-31-9507）,19000（千円）,田川　隆（タガワ タカシ）
有限会社野口オート輸送,8070002032011,道路貨物運送業,〒370-0306群馬県太田市新田市野倉町197,0276571707（0276-57-1707）,5000（千円）,野口　哲也（ノグチ テツヤ）
三村運送建材有限会社,8070002033967,道路貨物運送業,〒374-0019群馬県館林市尾曳町25-17,0276747677（0276-74-7677）,4000（千円）,三村　隆雄（ミムラ タカオ）
明和運輸有限会社,8070002033991,道路貨物運送業,〒374-0047群馬県館林市野辺町1247-4,0276722626（0276-72-2626）,20000（千円）,藤島　厚（フジシマ アツシ）
有限会社カネテック,8070002034321,道路貨物運送業,〒374-0046群馬県館林市上三林町1724-1,0276746850（0276-74-6850）,3000（千円）,金子　誠一（カネコ セイイチ）
大晃運送有限会社,8070002034916,道路貨物運送業,〒378-0031群馬県沼田市薄根町4122-8,0278238528（0278-23-8528）,5000（千円）,今井　克昌（イマイ カツマサ）
有限会社ケイ運送,8070002035443,道路貨物運送業,〒379-1307群馬県利根郡みなかみ町政所1059,0278621733（0278-62-1733）,15000（千円）,小林　計一（コバヤシ ケイイチ）
有限会社東橋,8070002037043,道路貨物運送業,〒377-0801群馬県吾妻郡東吾妻町原町246,0279683792（0279-68-3792）,5000（千円）,浦野　古壽（ウラノ ヒサヨシ）
公益財団法人前橋観光コンベンション協会,8070005001087,運輸に付帯するサービス業,〒371-0023群馬県前橋市本町2-12-1,0272352211（027-235-2211）,"",曽我　孝之（ソガ タカユキ）
相間生産森林組合,8070005002449,鉄道業,〒370-3403群馬県高崎市倉渕町水沼174,0273782299（027-378-2299）,6600（千円）,富田　三雄（トミタ ミツオ）
甘楽林業協業組合,8070005003777,鉄道業,〒370-2623群馬県甘楽郡下仁田町下小坂甲22,0274823321（0274-82-3321）,5500（千円）,相川　清治（アイカワ キヨハル）
Ｇ・Ｃ・Ｌ協同組合,8070005004643,運輸に付帯するサービス業,〒372-0011群馬県伊勢崎市三和町1404-1,0270230021（0270-23-0021）,5000（千円）,星野　敏男（ホシノ トシオ）
木村運輸株式会社,9070001000810,道路貨物運送業,〒371-0053群馬県前橋市幸塚町220,0272318647（027-231-8647）,50000（千円）,代表取締役社長／木村　弘典（キムラ ヒロツネ）
ニットー運輸株式会社,9070001002484,道路貨物運送業,〒371-0836群馬県前橋市江田町353-1,0272517046（027-251-7046）,50000（千円）,代表取締役社長／笠原　敏正（カサハラ トシマサ）
前橋運輸株式会社,9070001002947,道路貨物運送業,〒379-2134群馬県前橋市力丸町468,0272652331（027-265-2331）,65000（千円）,代表取締役社長／星野　陽司（ホシノ ヨウジ）
前橋倉庫株式会社,9070001002963,道路貨物運送業,〒379-2134群馬県前橋市力丸町828,0272652321（027-265-2321）,30000（千円）,曽我　隆一（ソガ リユウイチ）
赤南運送株式会社,9070001004951,道路貨物運送業,〒371-0205群馬県前橋市粕川町中70,0272852524（027-285-2524）,4000（千円）,岩田　宏（イワタ ヒロシ）
株式会社ボルテックスセイグン,9070001010074,道路貨物運送業,〒379-0133群馬県安中市原市432,0273823333（027-382-3333）,139500（千円）,代表取締役社長／武井　宏（タケイ ヒロシ）
