会社名,法人番号,業種,住所,電話番号,資本金,代表氏名
有限会社中商,4070002033731,道路貨物運送業,〒374-0033群馬県館林市堀工町368-5,0276753346（0276-75-3346）,5000（千円）,中村　操（ナカムラ ミサオ）
緑一貨物有限会社,4070002034085,道路貨物運送業,〒374-0067群馬県館林市岡野町560-24,0276737781（0276-73-7781）,5000（千円）,栗原　滋（クリハラ シゲル）
有限会社黒岩運輸,4070002036379,道路貨物運送業,〒377-1613群馬県吾妻郡嬬恋村大笹2200-12,0279960871（0279-96-0871）,10000（千円）,中村　三枝（ナカムラ ミエ）
松井典範有限会社,4070002036825,道路貨物運送業,〒377-0423群馬県吾妻郡中之条町伊勢町4-3,0279752333（0279-75-2333）,3000（千円）,角田　欣哉（ツノダ キンヤ）
一般社団法人草津温泉観光協会,4070005007476,運輸に付帯するサービス業,〒377-1711群馬県吾妻郡草津町草津28,0279880800（0279-88-0800）,"",中澤　敬（ナカザワ タカシ）
五領生産森林組合,4070005007716,鉄道業,〒377-0702群馬県吾妻郡高山村中山3726-1,0279633628（0279-63-3628）,30240（千円）,松本　泰（マツモト ユタカ）
群馬中央運送株式会社,5070001000970,道路貨物運送業,〒371-0055群馬県前橋市北代田町574,0272312873（027-231-2873）,10000（千円）,宮澤　房夫（ミヤザワ フサオ）
株式会社立川運輸,5070001002042,道路貨物運送業,〒379-2131群馬県前橋市西善町617,0272904343（027-290-4343）,50000（千円）,立川　一則（タチカワ カズノリ）
堀越運輸株式会社,5070001002942,道路貨物運送業,〒371-0845群馬県前橋市鳥羽町431-1,0272511328（027-251-1328）,15000（千円）,堀越　泰毅（ホリコシ ヤスタカ）
株式会社関東トラベルサービス,5070001006464,運輸に付帯するサービス業,〒370-1201群馬県高崎市倉賀野町1056-5,0273466287（027-346-6287）,10000（千円）,山口　剛（ヤマグチ タケシ）
上信電鉄株式会社,5070001007099,鉄道業,〒370-0848群馬県高崎市鶴見町51,0273238066（027-323-8066）,280000（千円）,木内　幸一（キウチ コウイチ）
高崎倉庫株式会社,5070001007462,倉庫業,〒370-0855群馬県高崎市下佐野町67-2,0273466161（027-346-6161）,50155（千円）,代表取締役社長／岡野　忠憲（オカノ タダノリ）
直井自動車運送株式会社,5070001007875,道路貨物運送業,〒370-0014群馬県高崎市元島名町482,0273525100（027-352-5100）,10000（千円）,直井　栄太（ナオイ エイタ）
新日本陸送株式会社,5070001009582,道路貨物運送業,〒370-0015群馬県高崎市島野町890-4,0273528422（027-352-8422）,30000（千円）,代表取締役／柳澤　佳雄（ヤナギサワ ヨシオ）
株式会社エイリク,5070001010235,運輸に付帯するサービス業,〒379-2133群馬県前橋市中内町325-10,0272893393（027-289-3393）,10000（千円）,田島　勝幸（タジマ カツユキ）
宮下運輸株式会社,5070001013782,道路貨物運送業,〒372-0056群馬県伊勢崎市喜多町16-2,0270250238（0270-25-0238）,30000（千円）,宮下　玉枝（ミヤシタ タマエ）
ケーシーエス株式会社,5070001015481,運輸に付帯するサービス業,〒370-1103群馬県佐波郡玉村町樋越932-6,0270653335（0270-65-3335）,9000（千円）,代表取締役社長／白石　克己（シライシ カツミ）
桐生冷蔵株式会社,5070001015845,倉庫業,〒379-2311群馬県みどり市笠懸町阿左美2761-1,0277764255（0277-76-4255）,10000（千円）,関根　隆博（セキネ タカヒロ）
上電通運株式会社,5070001016141,道路貨物運送業,〒376-0101群馬県みどり市大間々町大間々611-1,0277731721（0277-73-1721）,50000（千円）,代表取締役社長／星野　陽司（ホシノ ヨウジ）
カンデン渋川産業株式会社,5070001017536,運輸に付帯するサービス業,〒377-0008群馬県渋川市渋川1497,0279221705（0279-22-1705）,20000（千円）,守田　章（モリタ アキラ）
内宮物流株式会社,5070001018757,道路貨物運送業,〒373-0015群馬県太田市東新町363,0276373141（0276-37-3141）,10000（千円）,代表取締役社長／内宮　昌利（ウチミヤ マサトシ）
株式会社ケー・ライン,5070001019210,道路貨物運送業,〒370-0321群馬県太田市新田木崎町1768-1,0276208188（0276-20-8188）,20000（千円）,小林　一博（コバヤシ カツヒロ）
日本陸送株式会社,5070001019945,道路貨物運送業,〒373-0012群馬県太田市清原町2-6,0276378111（0276-37-8111）,40000（千円）,代表取締役社長／黒岩　一夫（クロイワ カズオ）
株式会社シルパック,5070001020366,運輸に付帯するサービス業,〒373-0012群馬県太田市清原町1-5,0276375811（0276-37-5811）,20000（千円）,永井　正雄（ナガイ マサオ）
新鋼商事株式会社,5070001021208,運輸に付帯するサービス業,〒370-0313群馬県太田市新田反町町107-2,0276608855（0276-60-8855）,5000（千円）,高橋　正彌（タカハシ マサヤ）
株式会社高義,5070001021273,道路貨物運送業,〒379-2302群馬県太田市山之神町615-8,0276550282（0276-55-0282）,10000（千円）,高橋　祐樹（タカハシ ユウキ）
館林倉庫株式会社,5070001021810,倉庫業,〒374-0071群馬県館林市下早川田町430,0276743240（0276-74-3240）,25800（千円）,森田　晏守（モリタ ヤスモリ）
株式会社今泉倉庫,5070001022098,倉庫業,〒374-0111群馬県邑楽郡板倉町海老瀬1059,0276824123（0276-82-4123）,10000（千円）,今泉　誠（イマイズミ マコト）
株式会社サンライズ,5070001022296,道路貨物運送業,〒374-0052群馬県館林市栄町23-15,0276720220（0276-72-0220）,8500（千円）,津久井　栄二（ツクイ エイジ）
株式会社相進産業,5070001022429,道路貨物運送業,〒373-0861群馬県太田市南矢島町661-1,0276382278（0276-38-2278）,20000（千円）,代表取締役社長／建川　三郎（タテカワ サブロウ）
株式会社カンセイ,5070001022791,運輸に付帯するサービス業,〒370-0523群馬県邑楽郡大泉町吉田2479-2,0276201965（0276-20-1965）,3580（千円）,米澤　雄大（ヨネザワ タケヒロ）
株式会社トーリン,5070001022998,水運業,〒378-0003群馬県沼田市上久屋町1210,0278223354（0278-22-3354）,20000（千円）,小倉　英輝（オグラ ヒデキ）
信正商事株式会社,5070001023352,道路貨物運送業,〒379-1205群馬県利根郡昭和村川額531,0278246057（0278-24-6057）,20000（千円）,野上　正和（ノガミ マサカズ）
株式会社関東デイリー,5070001025456,道路貨物運送業,〒373-0015群馬県太田市東新町837-7,0276495400（0276-49-5400）,72000（千円）,大園　圭一郎（オオゾノ ケイイチロウ）
株式会社物流サービス,5070001025514,道路貨物運送業,〒379-2152群馬県前橋市下大島町454-4,0272666540（027-266-6540）,10000（千円）,大谷内　光男（オオヤウチ ミツオ）
株式会社紅雅,5070001027171,道路貨物運送業,〒370-0011群馬県高崎市京目町812-3,0273539122（027-353-9122）,4000（千円）,砂盃　雅美（イサハイ マサミ）
株式会社志守物流,5070001027378,道路貨物運送業,〒372-0022群馬県伊勢崎市日乃出町702,0270618002（0270-61-8002）,5000（千円）,戸丸　守（トマル マモル）
昭和森林株式会社,5070001028590,水運業,〒379-1204群馬県利根郡昭和村森下3235-3,0278247811（0278-24-7811）,3000（千円）,小林　孝一郎（コバヤシ コウイチロウ）
株式会社マルショウ,5070001030340,道路貨物運送業,〒370-1124群馬県佐波郡玉村町角渕4450-20,0270650068（0270-65-0068）,500（千円）,新谷　昇（ニイヤ ノボル）
有限会社イベントネットワーク,5070002000672,道路貨物運送業,〒379-2147群馬県前橋市亀里町1073-36,0272656355（027-265-6355）,3000（千円）,竹内　康久（タケウチ ヤスヒサ）
有限会社スリー・エス,5070002003007,運輸に付帯するサービス業,〒371-0844群馬県前橋市古市町1-9-5,0272553657（027-255-3657）,3000（千円）,佐藤　寿（サトウ ヒサシ）
有限会社中沢運送,5070002003948,道路貨物運送業,〒379-2152群馬県前橋市下大島町42,0272613759（027-261-3759）,3000（千円）,山形　眞理子（ヤマガタ マリコ）
有限会社金子物流,5070002006430,道路貨物運送業,〒371-0002群馬県前橋市江木町166-2,0272871260（027-287-1260）,5000（千円）,金子　達之助（カネコ タツノスケ）
有限会社日本軽貨物,5070002008022,運輸に付帯するサービス業,〒371-0845群馬県前橋市鳥羽町149-1,0272804343（027-280-4343）,3000（千円）,岩田　祐司（イワタ ユウジ）
坂本通商有限会社,5070002009978,道路貨物運送業,〒370-1213群馬県高崎市山名町1619-12,0273471253（027-347-1253）,7000（千円）,坂本　久美（サカモト ヒサミ）
有限会社八木運輸,5070002012486,道路貨物運送業,〒370-1201群馬県高崎市倉賀野町3252,0273463006（027-346-3006）,10000（千円）,八木　議廣（ヤギ ノリヒロ）
有限会社新政,5070002019085,道路貨物運送業,〒379-2214群馬県伊勢崎市下触町142-3,0270705166（0270-70-5166）,9000（千円）,新井　政光（アライ マサミツ）
有限会社トラベルステーション,5070002019432,運輸に付帯するサービス業,〒372-0055群馬県伊勢崎市曲輪町8-20,0270266667（0270-26-6667）,8700（千円）,高月　知穂（タカツキ トモホ）
オコノギ運輸有限会社,5070002020340,道路貨物運送業,〒370-0128群馬県伊勢崎市境保泉916-2,0270740871（0270-74-0871）,8000（千円）,小此木　実（オコノギ ミノル）
日新物流有限会社,5070002021990,運輸に付帯するサービス業,〒370-1103群馬県佐波郡玉村町樋越752,0270503305（0270-50-3305）,3000（千円）,藤井　秀人（フジイ ヒデト）
有限会社ＢＲＳロジスティック,5070002022056,道路貨物運送業,〒379-2233群馬県伊勢崎市平井町1319-1,0270753711（0270-75-3711）,4000（千円）,鑓水　勇（ヤリミズ イサム）
有限会社ＭＳ運送,5070002022295,道路貨物運送業,〒372-0801群馬県伊勢崎市宮子町3467-6,0270243254（0270-24-3254）,4000（千円）,清水　光孝（シミズ ミツタカ）
有限会社群馬物流企画,5070002023285,道路貨物運送業,〒379-2204群馬県伊勢崎市西久保町3-623-1,0270634899（0270-63-4899）,3000（千円）,佐々木　貴志（ササキ タカシ）
小林運送有限会社,5070002023450,道路貨物運送業,〒376-0121群馬県桐生市新里町新川3960-2,0277741811（0277-74-1811）,8000（千円）,高畑　英示（タカハタ エイジ）
有限会社オン・ウエスト,5070002027658,道路貨物運送業,〒377-0062群馬県渋川市北橘町真壁1064,0279601032（0279-60-1032）,7000（千円）,清水　澄子（シミズ スミコ）
坂本商管有限会社,5070002029332,道路貨物運送業,〒373-0015群馬県太田市東新町625,0276205880（0276-20-5880）,10000（千円）,坂本　圭司（サカモト ケイジ）
有限会社神藤運輸,5070002029497,道路貨物運送業,〒370-0603群馬県邑楽郡邑楽町中野92,0276702288（0276-70-2288）,3000（千円）,神藤　隆行（カンドウ タカユキ）
日の出ライン有限会社,5070002031602,道路貨物運送業,〒373-0847群馬県太田市西新町77-17,0276314449（0276-31-4449）,9000（千円）,松本　光浩（マツモト ミツヒロ）
真貝運輸有限会社,5070002031643,道路貨物運送業,〒370-0403群馬県太田市岩松町568-4,0276607255（0276-60-7255）,13000（千円）,真貝　俊男（シンガイ トシオ）
有限会社金谷運輸機工,5070002031916,道路貨物運送業,〒370-0304群馬県太田市新田市町105-633,0276605004（0276-60-5004）,6000（千円）,金谷　信也（カナヤ ノブヤ）
有限会社マルミ通商,5070002032014,運輸に付帯するサービス業,〒379-2304群馬県太田市大原町95-31,0277788236（0277-78-8236）,3000（千円）,蛭間　幹夫（ヒルマ ミキオ）
高橋商運有限会社,5070002035842,道路貨物運送業,〒379-1205群馬県利根郡昭和村川額1182,0278246868（0278-24-6868）,12000（千円）,高橋　英吉（タカハシ エイキチ）
有限会社北伸運輸,5070002035850,道路貨物運送業,〒379-1202群馬県利根郡昭和村貝野瀬69,0278241772（0278-24-1772）,9000（千円）,脇本　貢（ワキモト ミツグ）
マルエス合資会社,5070003001315,倉庫業,〒370-0603群馬県邑楽郡邑楽町中野5298-1,0276880100（0276-88-0100）,23000（千円）,社長／小島　雅典（コジマ マサノリ）
高崎地区運送事業協同組合,5070005002625,道路貨物運送業,〒370-0006群馬県高崎市問屋町4-5-4,0273611201（027-361-1201）,47460（千円）,代表理事／三浦　文雄（ミウラ フミオ）
三愛興業株式会社,6060001018617,道路貨物運送業,〒373-0012群馬県太田市清原町9-3,0276378422（0276-37-8422）,20000（千円）,小山　政義（コヤマ マサヨシ）
アサヒアクシス株式会社,6070001000144,運輸に付帯するサービス業,〒379-2131群馬県前橋市西善町2004,0272666401（027-266-6401）,10000（千円）,宇井　孝廣（ウイ タカヒロ）
株式会社川和運輸,6070001000771,道路貨物運送業,〒371-0235群馬県前橋市滝窪町1327-1,0272837272（027-283-7272）,16000（千円）,川和　桂三郎（カワワ ケイザブロウ）
斉藤運送株式会社,6070001004946,道路貨物運送業,〒379-2134群馬県前橋市力丸町253,0272652288（027-265-2288）,10000（千円）,柴崎　博史（シバサキ ヒロシ）
北関東輸送株式会社,6070001005440,道路貨物運送業,〒371-0814群馬県前橋市宮地町43,0272123300（027-212-3300）,50000（千円）,沼田　栄子（ヌマタ エイコ）
上中居運輸株式会社,6070001006554,道路貨物運送業,〒370-0851群馬県高崎市上中居町1486-3,0273532121（027-353-2121）,15000（千円）,堤　進（ツツミ ススム）
高陽運輸株式会社,6070001006876,道路貨物運送業,〒370-0002群馬県高崎市日高町江田境甲163,0273623482（027-362-3482）,10000（千円）,代表取締役社長／岡村　桂伸（オカムラ ケイシン）
国際トラベルサービス株式会社,6070001006892,運輸に付帯するサービス業,〒370-0041群馬県高崎市東貝沢町3-24-2ビラHAKODABー102,0273628673（027-362-8673）,19600（千円）,箱田　英彦（ハコダ ヒデヒコ）
関越運輸株式会社,6070001011042,道路貨物運送業,〒370-0011群馬県高崎市京目町812-3,0273523199（027-352-3199）,10000（千円）,砂盃　大輔（イサハイ ダイスケ）
株式会社冨運,6070001011463,道路貨物運送業,〒370-0069群馬県高崎市飯塚町1735-1,0273622297（027-362-2297）,10000（千円）,冨所　敏浩（トミドコロ トシヒロ）
土屋運送株式会社,6070001011827,道路貨物運送業,〒370-2324群馬県富岡市南後箇1165-1,0274637234（0274-63-7234）,10000（千円）,土屋　茂雄（ツチヤ シゲオ）
吉田運輸倉庫株式会社,6070001012189,道路貨物運送業,〒370-2206群馬県甘楽郡甘楽町善慶寺550-1,0274704100（0274-70-4100）,10000（千円）,吉田　忠（ヨシダ タダシ）
株式会社トマル運輸,6070001013600,道路貨物運送業,〒372-0831群馬県伊勢崎市山王町1958-1,0270328248（0270-32-8248）,10000（千円）,都丸　賢（トマル マサル）
東日トランスポート株式会社,6070001013930,道路貨物運送業,〒379-2222群馬県伊勢崎市田部井町3-493-1,0270628622（0270-62-8622）,43000（千円）,佐藤　伸治（サトウ シンジ）
関越流通倉庫株式会社,6070001014177,倉庫業,〒370-1126群馬県佐波郡玉村町宇貫400,0270651141（0270-65-1141）,40000（千円）,代表取締役社長／春山　泰夫（ハルヤマ ヤスオ）
株式会社静和運輸,6070001014227,道路貨物運送業,〒370-1133群馬県佐波郡玉村町上新田158,0270652476（0270-65-2476）,10000（千円）,近藤　隆史（コンドウ タカシ）
淺貝運輸株式会社,6070001014689,道路貨物運送業,〒379-2221群馬県伊勢崎市国定町1-1190-2,0270623543（0270-62-3543）,10000（千円）,淺貝　安彦（アサカイ ヤスヒコ）
睦トータルサービス株式会社,6070001015258,道路貨物運送業,〒370-1135群馬県佐波郡玉村町板井836-1,0270306030（0270-30-6030）,3000（千円）,堀越　昭広（ホリコシ アキヒロ）
今成運送株式会社,6070001017485,道路貨物運送業,〒377-0003群馬県渋川市八木原1428,0279230840（0279-23-0840）,15000（千円）,今成　克之（イマナリ カツユキ）
アルファトレーディング株式会社,6070001018665,道路貨物運送業,〒373-0037群馬県太田市新道町101-1,0276325471（0276-32-5471）,10000（千円）,大島　豊（オオシマ ユタカ）
株式会社オザワ運輸,6070001018938,道路貨物運送業,〒370-0615群馬県邑楽郡邑楽町篠塚2746,0276886111（0276-88-6111）,10000（千円）,小澤　義則（オザワ ヨシノリ）
木村商運株式会社,6070001019077,道路貨物運送業,〒373-0012群馬県太田市清原町3-1,0276378123（0276-37-8123）,13000（千円）,木村　仁一（キムラ ジンイチ）
株式会社スバルロジスティクス,6070001019523,運輸に付帯するサービス業,〒373-0814群馬県太田市朝日町558-1,0276483131（0276-48-3131）,96000（千円）,上野　康男（ウエノ ヤスオ）
日通太田運輸株式会社,6070001019886,道路貨物運送業,〒373-0011群馬県太田市只上町2411-1,0276205705（0276-20-5705）,15000（千円）,田所　茂樹（タドコロ シゲキ）
両毛通運株式会社,6070001020373,道路貨物運送業,〒379-2304群馬県太田市大原町2346,0277783411（0277-78-3411）,30000（千円）,藤井　雄二（フジイ ユウジ）
川野辺運輸株式会社,6070001021652,道路貨物運送業,〒374-0133群馬県邑楽郡板倉町岩田1362,0276824670（0276-82-4670）,13000（千円）,川野辺　達也（カワノベ タツヤ）
磯野運送株式会社,6070001022147,道路貨物運送業,〒374-0055群馬県館林市成島町1230-2,0276740153（0276-74-0153）,10000（千円）,磯野　哲也（イソノ テツヤ）
小田原緑化開発株式会社,6070001023401,水運業,〒378-0062群馬県沼田市町田町694-1,0278222356（0278-22-2356）,10000（千円）,小田原　茂（オダワラ シゲル）
吾妻森林整備株式会社,6070001023640,鉄道業,〒377-1305群馬県吾妻郡長野原町与喜屋151-1,0279820260（0279-82-0260）,10350（千円）,立石　利雄（タテイシ トシオ）
株式会社ＫＯＫＵＢＯ,6070001024820,道路貨物運送業,〒372-0827群馬県伊勢崎市八斗島町1604-8,0270321542（0270-32-1542）,2000（千円）,小久保　剛利（コクボ タケトシ）
株式会社ネットセレモニー,6070001024977,道路貨物運送業,〒379-2144群馬県前橋市下川町45-1,0272890095（027-289-0095）,2000（千円）,福田　猛（フクダ タケシ）
株式会社エースライン,6070001025281,道路貨物運送業,〒370-0532群馬県邑楽郡大泉町坂田2-16-1,0276578009（0276-57-8009）,5000（千円）,坂本　将基（サカモト マサキ）
株式会社Ｋライン,6070001025959,道路貨物運送業,〒370-3522群馬県高崎市菅谷町893-1,0273606181（027-360-6181）,3500（千円）,金古　雅之（カネコ マサユキ）
株式会社ＭＡＲＵＫＯ,6070001026404,道路貨物運送業,〒374-0076群馬県館林市日向町1026,0276746561（0276-74-6561）,10000（千円）,小池　光（コイケ アキラ）
システムジェイピー株式会社,6070001027022,運輸に付帯するサービス業,〒371-0047群馬県前橋市関根町190-3,0272127798（027-212-7798）,3000（千円）,天海　裕司（アマガイ ユウジ）
株式会社Ｇライン,6070001029274,運輸に付帯するサービス業,〒379-2204群馬県伊勢崎市西久保町3-623-1,0270634899（0270-63-4899）,3000（千円）,星野　敏男（ホシノ トシオ）
ミニトラックサービス株式会社,6070001030372,運輸に付帯するサービス業,〒370-0403群馬県太田市岩松町473,0276495676（0276-49-5676）,1000（千円）,飯田　パウロ（イイダ パウロ）
株式会社あおば,6070001035685,道路貨物運送業,〒371-0847群馬県前橋市大友町1-5-4,0272568470（027-256-8470）,19800（千円）,加藤　敏雄（カトウ トシオ）
丸高運送有限会社,6070002006157,道路貨物運送業,〒379-2161群馬県前橋市富田町2357-1,0272303366（027-230-3366）,11000（千円）,大澤　高（オオサワ タカシ）
京目運送有限会社,6070002009531,道路貨物運送業,〒370-0011群馬県高崎市京目町468,0273521145（027-352-1145）,10000（千円）,佐藤　理徳（サトウ ミチノリ）
有限会社伸和運輸,6070002010456,道路貨物運送業,〒370-3334群馬県高崎市本郷町2238,0273446760（027-344-6760）,6000（千円）,後閑　秀喜（ゴカン ヒデキ）
有限会社藤井木材,6070002011801,道路貨物運送業,〒370-3342群馬県高崎市下室田町947-1,0273741056（027-374-1056）,5000（千円）,藤井　正吉（フジイ シヨウキチ）
有限会社関東グローバル,6070002014531,運輸に付帯するサービス業,〒370-0081群馬県高崎市浜川町745,0273866908（027-386-6908）,3000（千円）,宮内　哲也（ミヤウチ テツヤ）
中沢運送有限会社,6070002019448,道路貨物運送業,〒372-0824群馬県伊勢崎市柴町1785,0270328116（0270-32-8116）,15000（千円）,中澤　哲郎（ナカザワ テツロウ）
箱田運送有限会社,6070002019530,道路貨物運送業,〒372-0032群馬県伊勢崎市北千木町1866-2,0270258300（0270-25-8300）,10000（千円）,箱田　弘志（ハコダ ヒロシ）
有限会社設楽運輸,6070002021742,道路貨物運送業,〒372-0804群馬県伊勢崎市稲荷町4,0270263222（0270-26-3222）,5000（千円）,設樂　莞爾（シタラ ガンジ）
有限会社小林物流サービス,6070002021981,道路貨物運送業,〒370-0105群馬県伊勢崎市境伊与久1955,0270760117（0270-76-0117）,3000（千円）,小林　龍（コバヤシ シゲミ）
有限会社大間々急送,6070002022930,道路貨物運送業,〒376-0115群馬県みどり市大間々町塩原1533,0277721219（0277-72-1219）,8000（千円）,小堀　陽子（コボリ ヨウコ）
有限会社友結商事,6070002025479,道路貨物運送業,〒379-2314群馬県みどり市笠懸町西鹿田1329-15,0277772545（0277-77-2545）,3000（千円）,白川　正仁（シラカワ マサヒト）
有限会社興産運送,6070002029141,道路貨物運送業,〒370-0601群馬県邑楽郡邑楽町鶉727-1,0276883351（0276-88-3351）,5000（千円）,本間　美儀男（ホンマ ヨシオ）
有限会社あづま商運,6070002031626,道路貨物運送業,〒379-2304群馬県太田市大原町2353-1,0277781180（0277-78-1180）,10000（千円）,松本　美和子（マツモト ミワコ）
有限会社スワン輸送,6070002031980,道路貨物運送業,〒370-0414群馬県太田市堀口町90-1,0276607403（0276-60-7403）,7000（千円）,白鳥　智（シラトリ サトシ）
有限会社関東資材,6070002033267,道路貨物運送業,〒370-0718群馬県邑楽郡明和町大輪2083-2,0276842424（0276-84-2424）,4000（千円）,代表取締役社長／阿部　徳夫（アベ トクオ）
有限会社カタベ急送,6070002034190,道路貨物運送業,〒374-0111群馬県邑楽郡板倉町海老瀬1059-9,0276914100（0276-91-4100）,10000（千円）,櫻井　清之（サクライ キヨシ）
花咲造林有限会社,6070002035305,水運業,〒378-0408群馬県利根郡片品村花咲911,0278583520（0278-58-3520）,3000（千円）,山崎　義哉（ヤマザキ ヨシヤ）
美山運輸有限会社,6070002036889,道路貨物運送業,〒377-0932群馬県吾妻郡東吾妻町萩生543,0279692555（0279-69-2555）,11000（千円）,一場　光士（イチバ ミツシ）
有限会社黒岩建興,6070002037012,道路貨物運送業,〒377-1411群馬県吾妻郡長野原町応桑1984-63,0279852136（0279-85-2136）,3000（千円）,黒岩　幸子（クロイワ サチコ）
群馬県建設事業協同組合,6070005000537,運輸に付帯するサービス業,〒379-2161群馬県前橋市富田町587-1,0272871004（027-287-1004）,237410（千円）,青柳　剛（アオヤギ タケシ）
中尾生産森林組合,6070005002450,鉄道業,〒370-3403群馬県高崎市倉渕町水沼709,0273783589（027-378-3589）,27810（千円）,上原　治夫（ウエハラ ハルオ）
一般社団法人みなかみ町観光協会,6070005008068,運輸に付帯するサービス業,〒379-1313群馬県利根郡みなかみ町月夜野1744-1,0278620401（0278-62-0401）,"",須藤　温（ストウ ミツル）
一般社団法人渋川伊香保温泉観光協会,6070005008266,運輸に付帯するサービス業,〒377-0102群馬県渋川市伊香保町伊香保541-4,0279723151（0279-72-3151）,"",大森　隆博（オオモリ タカヒロ）
