会社名,法人番号,業種,住所,電話番号,資本金,代表氏名
新日本電業株式会社,5190001005066,電気機械器具製造業,〒513-0042三重県鈴鹿市長太旭町4-21-17,0593854355（059-385-4355）,20000（千円）,鈴木　健仁（スズキ ケンジ）
スズラン繊維加工株式会社,5190001005082,"繊維工業（衣服,その他の繊維製品を除く）",〒513-0001三重県鈴鹿市広瀬町2491,0593791688（059-379-1688）,39450（千円）,西崎　聖一（ニシザキ セイイチ）
清和酵源株式会社,5190001005132,食料品・飼料・飲料製造業,〒513-0051三重県鈴鹿市下箕田町1081-1,0593855647（059-385-5647）,10000（千円）,代表取締役社長／木本　清一（キモト セイイチ）
株式会社ミタカ電機,5190001005413,電気機械器具製造業,〒510-0227三重県鈴鹿市南若松町429-22,0593863191（059-386-3191）,10000（千円）,西高　通利（ニシタカ ミチトシ）
敷島スターチ株式会社,5190001005628,食料品・飼料・飲料製造業,〒513-0043三重県鈴鹿市長太栄町5-5-1,0593850512（059-385-0512）,300000（千円）,代表取締役社長／小川　敏郎（オガワ トシロウ）
株式会社ツルノテクニカルサービス,5190001005751,輸送用機械器具製造業,〒513-0825三重県鈴鹿市住吉町宮西8299,0593750955（059-375-0955）,28000（千円）,鶴野　浩（ツルノ ヒロシ）
ヒラオ産業株式会社,5190001005784,輸送用機械器具製造業,〒513-1124三重県鈴鹿市自由ヶ丘2-7-23,0593743488（059-374-3488）,10000（千円）,平尾　光（ヒラオ ヒカリ）
株式会社ささら,5190001005801,食料品・飼料・飲料製造業,〒519-0312三重県鈴鹿市椿一宮町3000,0593718288（059-371-8288）,12000（千円）,大野　博司（オオノ ヒロシ）
株式会社エビスプランニング,5190001005859,金属製品製造業,〒513-0018三重県鈴鹿市上田町2073-5,0593745381（059-374-5381）,2500（千円）,長谷部　誠（ハセベ マコト）
株式会社共新製作所,5190001005891,輸送用機械器具製造業,〒513-0818三重県鈴鹿市安塚町1500,0593824482（059-382-4482）,3500（千円）,澤村　共一（サワムラ キヨウイチ）
栄工業株式会社,5190001006155,金属製品製造業,〒519-0272三重県鈴鹿市東庄内町4318-5,0593710439（059-371-0439）,10000（千円）,佐野　隆則（サノ タカノリ）
伊勢舗装工業株式会社,5190001006493,石油製品・石炭製品製造業,〒519-0425三重県度会郡玉城町岩出397-1,0596586396（0596-58-6396）,12000（千円）,濱口　祐彦（ハマグチ ユウヒコ）
株式会社ＪＭＩ,5190001006551,一般機械器具製造業,〒516-0013三重県伊勢市鹿海町439-1,0596205545（0596-20-5545）,20000（千円）,西尾　文宏（ニシオ フミヒロ）
株式会社キタガワ電機,5190001006576,電気機械器具製造業,〒516-0006三重県伊勢市田尻町470-1,0596362170（0596-36-2170）,12500（千円）,代表取締役社長／石川　研人（イシカワ ケンド）
ヤマナカフーズ株式会社,5190001007120,食料品・飼料・飲料製造業,〒515-0507三重県伊勢市村松町3745,0596372511（0596-37-2511）,24000（千円）,代表取締役社長／山中　寛雅（ヤマナカ ヒロマサ）
南勢小橋電機株式会社,5190001007319,電気機械器具製造業,〒516-0107三重県度会郡南伊勢町飯満573-3,0599662351（0599-66-2351）,15000（千円）,代表取締役社長／村林　伸人（ムラバヤシ ノブヒト）
株式会社ＢＩＯＰＵＳ,5190001007450,食料品・飼料・飲料製造業,〒515-0507三重県伊勢市村松町198-3,0596648158（0596-64-8158）,37000（千円）,浦田　繁（ウラタ シゲル）
株式会社ＫＡＥＴＳＵプレシジョン,5190001007525,窯業・土石製品製造業,〒516-1106三重県伊勢市横輪町34,0596390121（0596-39-0121）,9000（千円）,加藤　確春（カトウ カクハル）
三洋真珠株式会社,5190001007995,その他の製造業,〒517-0501三重県志摩市阿児町鵜方971,0599432420（0599-43-2420）,10000（千円）,荒木　貢吉（アラキ コウキチ）
株式会社ヤマ一商店,5190001008110,食料品・飼料・飲料製造業,〒517-0507三重県志摩市阿児町安乗981-1,0599473020（0599-47-3020）,10000（千円）,坪谷　明美（ツボヤ アケミ）
糸伍株式会社,5190001008325,衣服・その他の繊維製品製造業,〒518-0847三重県伊賀市上野鉄砲町2398-2,0595213911（0595-21-3911）,45000（千円）,松田　智行（マツダ トモユキ）
株式会社高嶋鉄工所,5190001008531,一般機械器具製造業,〒518-0809三重県伊賀市西明寺2231-2,0595212268（0595-21-2268）,10000（千円）,高嶋　幸次（タカシマ コウジ）
中外医薬生産株式会社,5190001008548,化学工業,〒518-0131三重県伊賀市ゆめが丘7-5-5,0595210120（0595-21-0120）,53300（千円）,代表取締役社長／田山　雅敏（タヤマ マサトシ）
富田木材株式会社,5190001008564,木材・木製品製造業（家具を除く）,〒518-0825三重県伊賀市小田町鎌添346-6,0595234588（0595-23-4588）,10000（千円）,冨田　賢一（トミダ ケンイチ）
日本ニードルローラー製造株式会社,5190001008597,一般機械器具製造業,〒518-0001三重県伊賀市佐那具町沢1535-1,0595233380（0595-23-3380）,160000（千円）,代表取締役社長／西崎　達也（ニシザキ タツヤ）
ニチニチ製薬株式会社,5190001008606,食料品・飼料・飲料製造業,〒518-1417三重県伊賀市富永239-1,0595480201（0595-48-0201）,85000（千円）,代表取締役社長／安本　昌吉（ヤスモト シヨウキチ）
株式会社松田克夫商店,5190001008663,衣服・その他の繊維製品製造業,〒518-0847三重県伊賀市上野鉄砲町2375-2,0595211027（0595-21-1027）,10000（千円）,松田　哲夫（マツダ テツオ）
株式会社アスター美容,5190001008853,化学工業,〒518-0131三重県伊賀市ゆめが丘7-9-2,0595219827（0595-21-9827）,39000（千円）,代表取締役社長／高松　宏司（タカマツ ヒロシ）
株式会社アヤマ電子工業,5190001008969,電気機械器具製造業,〒518-1326三重県伊賀市槙山735-1,0595421211（0595-42-1211）,10000（千円）,秋田　堅太郎（アキタ ケンタロウ）
若戎酒造株式会社,5190001009083,食料品・飼料・飲料製造業,〒518-0226三重県伊賀市阿保1317,0595521153（0595-52-1153）,50000（千円）,重藤　邦子（シゲフジ クニコ）
株式会社大成産業,5190001009397,木材・木製品製造業（家具を除く）,〒518-0467三重県名張市赤目町相楽587,0595642616（0595-64-2616）,10000（千円）,辻　哲也（ツジ テツヤ）
株式会社ミエコー,5190001009711,ゴム製品製造業,〒518-1141三重県伊賀市菖蒲池2773,0595391110（0595-39-1110）,10000（千円）,代表取締役社長／金子　孝徳（カネコ タカノリ）
株式会社ダイウッド,5190001009892,木材・木製品製造業（家具を除く）,〒518-0809三重県伊賀市西明寺2782-23,0595238872（0595-23-8872）,50000（千円）,代表取締役社長／村井　均（ムライ ヒトシ）
飯高砂利株式会社,5190001010090,窯業・土石製品製造業,〒515-0011三重県松阪市高町450-1丸亀産業内,0598450171（0598-45-0171）,10000（千円）,代表取締役社長／橋本　美智也（ハシモト ミチヤ）
岡田パッケージ株式会社,5190001010132,パルプ・紙・紙加工品製造業,〒519-2144三重県松阪市八太町クリ穴550-4,0598292611（0598-29-2611）,44000（千円）,代表取締役社長／岡田　光生（オカダ ミツオ）
奥野食品株式会社,5190001010140,食料品・飼料・飲料製造業,〒515-0063三重県松阪市大黒田町698-3,0598212096（0598-21-2096）,10000（千円）,奥野　敦哉（オクノ アツヤ）
株式会社笹屋,5190001010231,食料品・飼料・飲料製造業,〒515-0056三重県松阪市宝塚町720-2,0598213908（0598-21-3908）,10000（千円）,阪井　政男（サカイ マサオ）
東海印刷株式会社,5190001010371,出版・印刷・同関連産業,〒515-0813三重県松阪市大塚町57-1,0598516137（0598-51-6137）,20000（千円）,代表取締役社長／服部　高明（ハツトリ タカアキ）
橋本電子工業株式会社,5190001010462,電気機械器具製造業,〒515-0104三重県松阪市高須町3866-12,0598513111（0598-51-3111）,20000（千円）,代表取締役社長／橋本　正敏（ハシモト マサトシ）
株式会社矢倉,5190001010685,木材・木製品製造業（家具を除く）,〒515-0103三重県松阪市西黒部町534-5,0598514051（0598-51-4051）,10000（千円）,矢倉　良隆（ヤグラ ヨシタカ）
正田食品株式会社,5190001010727,食料品・飼料・飲料製造業,〒515-2401三重県松阪市嬉野釜生田町588-2,0598432711（0598-43-2711）,20000（千円）,代表取締役社長／野口　三郎（ノグチ サブロウ）
辻製油株式会社,5190001010735,食料品・飼料・飲料製造業,〒515-2314三重県松阪市嬉野新屋庄町565-1,0598421711（0598-42-1711）,30000（千円）,代表取締役社長／辻　威彦（ツジ タケヒコ）
株式会社広島鉄工,5190001010792,金属製品製造業,〒515-2109三重県松阪市小野江町733-1,0598563811（0598-56-3811）,10000（千円）,廣島　弘（ヒロシマ ヒロシ）
三雲生コン株式会社,5190001010826,窯業・土石製品製造業,〒515-2112三重県松阪市曽原町293-3,0598562834（0598-56-2834）,20000（千円）,荷口　一則（ニグチ カズノリ）
河武醸造株式会社,5190001010875,食料品・飼料・飲料製造業,〒519-2174三重県多気郡多気町五桂234,0598372037（0598-37-2037）,10000（千円）,河合　英彦（カワイ ヒデヒコ）
神都工業株式会社,5190001010900,その他の製造業,〒519-2161三重県多気郡多気町土羽1225,0598383813（0598-38-3813）,10000（千円）,西井　達夫（ニシイ タツオ）
株式会社三ツ知製作所,5190001011139,金属製品製造業,〒515-1412三重県松阪市飯南町向粥見159-3,0598322200（0598-32-2200）,10000（千円）,代表取締役社長／小南　秀雄（コミナミ ヒデオ）
元坂酒造株式会社,5190001011171,食料品・飼料・飲料製造業,〒519-2422三重県多気郡大台町柳原346-2,0598850001（0598-85-0001）,15000（千円）,元坂　新（ゲンサカ アラタ）
株式会社ミエセイカ,5190001011188,その他の製造業,〒519-2404三重県多気郡大台町佐原498-6,0598821098（0598-82-1098）,10000（千円）,石山　剛（イシヤマ ツヨシ）
株式会社アキホールディングス,5190001011345,一般機械器具製造業,〒515-0083三重県松阪市中町1846,0598255400（0598-25-5400）,7000（千円）,中瀬古　章光（ナカセコ アキミツ）
株式会社山中化成,5190001011741,その他の製造業,〒515-0302三重県多気郡明和町大淀2855-42,0596552024（0596-55-2024）,5000（千円）,山中　輝雄（ヤマナカ テルオ）
三重ＪＲ株式会社,5190001011758,ゴム製品製造業,〒515-0052三重県松阪市山室町根後1938-2,0598291810（0598-29-1810）,3000（千円）,前田　弘一郎（マエダ コウイチロウ）
株式会社エスエ電子,5190001012062,電気機械器具製造業,〒511-0811三重県桑名市東方2820,0594221829（0594-22-1829）,20000（千円）,佐藤　敦（サトウ アツシ）
株式会社カワソウ,5190001012120,"鉄鋼業,非鉄金属製造業",〒511-0838三重県桑名市和泉5-197-1,0594215355（0594-21-5355）,10000（千円）,川瀬　重幸（カワセ シゲユキ）
栗田精工株式会社,5190001012145,一般機械器具製造業,〒511-0819三重県桑名市北別所1582,0594224111（0594-22-4111）,10000（千円）,栗田　勝久（クリタ カツヒサ）
日立金属ファインテック株式会社,5190001012161,一般機械器具製造業,〒511-0834三重県桑名市大福2,0594222200（0594-22-2200）,70000（千円）,徳永　浩樹（トクナガ ヒロキ）
瑞宝産業株式会社,5190001012310,食料品・飼料・飲料製造業,〒511-0844三重県桑名市福岡町384-1,0594231646（0594-23-1646）,15000（千円）,水谷　茂（ミズタニ シゲル）
フジタ電業株式会社,5190001012525,一般機械器具製造業,〒511-0834三重県桑名市大福寺跡463,0594214521（0594-21-4521）,20000（千円）,代表取締役社長／中川　四郎（ナカガワ シロウ）
株式会社ＮＴＮ多度製作所,5190001012723,一般機械器具製造業,〒511-0101三重県桑名市多度町柚井1077,0594482383（0594-48-2383）,10000（千円）,代表取締役社長／伊藤　勝敏（イトウ カツトシ）
北勢機械工業株式会社,5190001012756,一般機械器具製造業,〒511-0121三重県桑名市多度町美鹿1206,0594483249（0594-48-3249）,10000（千円）,水谷　寛数（ミズタニ ヒロカズ）
株式会社渡壁,5190001012863,金属製品製造業,〒498-0814三重県桑名郡木曽岬町三崎551,0567684801（0567-68-4801）,10000（千円）,渡壁　良（ワタカベ リヨウ）
株式会社水貝製作所,5190001012970,一般機械器具製造業,〒511-0201三重県いなべ市員弁町市之原2331-17,0594742785（0594-74-2785）,10000（千円）,水貝　重義（スガイ シゲヨシ）
株式会社マルデ鋳器,5190001012987,"鉄鋼業,非鉄金属製造業",〒511-0225三重県いなべ市員弁町西方538-2,0594745613（0594-74-5613）,10000（千円）,出口　博一（デグチ ヒロカズ）
株式会社三林,5190001013135,その他の製造業,〒511-0841三重県桑名市小貝須柳原413-1,0594231151（0594-23-1151）,10000（千円）,三林　典幸（ミツバヤシ ノリユキ）
株式会社山下精機製作所,5190001013366,輸送用機械器具製造業,〒511-0837三重県桑名市小泉伊原島421,0594233032（0594-23-3032）,10000（千円）,山下　修平（ヤマシタ シユウヘイ）
サンジルシ醸造株式会社,5190001013424,食料品・飼料・飲料製造業,〒511-0821三重県桑名市矢田572-1,0594223333（0594-22-3333）,290000（千円）,佐藤　強（サトウ ツヨシ）
株式会社栗田いなべ製作所,5190001013440,一般機械器具製造業,〒511-0433三重県いなべ市北勢町中山546,0594781800（0594-78-1800）,100000（千円）,毛利　正幸（モウリ マサユキ）
中央精密株式会社,5190001013754,輸送用機械器具製造業,〒511-0068三重県桑名市中央町4-13,0594223427（0594-22-3427）,5000（千円）,加藤　勝也（カトウ カツヤ）
株式会社朝日電機工作所,5190001014208,電気機械器具製造業,〒510-8102三重県三重郡朝日町小向915,0593772216（059-377-2216）,10000（千円）,葛山　博之（カツラヤマ ヒロユキ）
株式会社アスロン工業,5190001014216,その他の製造業,〒510-0961三重県四日市市波木町西浦1171,0593222616（059-322-2616）,10000（千円）,岩城　幸容（イワキ ユキヤス）
イング株式会社,5190001014257,衣服・その他の繊維製品製造業,〒510-8006三重県四日市市東富田町3-3,0593617141（059-361-7141）,30000（千円）,渡邉　俊介（ワタナベ シユンスケ）
株式会社伊藤鉄工所,5190001014323,一般機械器具製造業,〒512-8061三重県四日市市広永町1356-1,0593615030（059-361-5030）,10000（千円）,伊藤　善定（イトウ ヨシサダ）
稲垣製型株式会社,5190001014348,窯業・土石製品製造業,〒510-0812三重県四日市市西阿倉川1363,0593313935（059-331-3935）,10000（千円）,稲垣　裕司（イナガキ ユウジ）
株式会社イワマテクニカル,5190001014372,金属製品製造業,〒512-1205三重県四日市市平尾町2370-16,0593265262（059-326-5262）,10000（千円）,代表取締役社長／岩間　孝雄（イワマ タカオ）
株式会社加藤機械,5190001014570,一般機械器具製造業,〒512-8061三重県四日市市広永町222-3,0593646688（059-364-6688）,10000（千円）,加藤　剛（カトウ ツヨシ）
活水プラント株式会社,5190001014587,一般機械器具製造業,〒512-1204三重県四日市市赤水町4-7,0593270600（059-327-0600）,48200（千円）,飯田　克己（イイダ カツミ）
カネソウ株式会社,5190001014604,金属製品製造業,〒510-8101三重県三重郡朝日町縄生81,0593773232（059-377-3232）,1820000（千円）,代表取締役社長／近藤　健治（コンドウ ケンジ）
カネト製網株式会社,5190001014612,"繊維工業（衣服,その他の繊維製品を除く）",〒510-8027三重県四日市市茂福2275,0593650910（059-365-0910）,10000（千円）,渡部　栄治（ワタナベ エイジ）
サトウ精機株式会社,5190001015008,一般機械器具製造業,〒512-1103三重県四日市市西山町7677-18,0593282588（059-328-2588）,10000（千円）,佐藤　則禎（サトウ ノリヨシ）
正和製菓株式会社,5190001015172,食料品・飼料・飲料製造業,〒510-0951三重県四日市市小古曽東2-4-61,0593455100（059-345-5100）,43500（千円）,代表取締役社長／笠井　英毅（カサイ ヒデキ）
株式会社スタジオノア,5190001015247,窯業・土石製品製造業,〒510-0804三重県四日市市万古町2-17,0593316994（059-331-6994）,10000（千円）,安藤　友一（アンドウ ユウイチ）
チヨダグリーンセラ株式会社,5190001015560,窯業・土石製品製造業,〒510-8121三重県三重郡川越町高松928,0593635555（059-363-5555）,20000（千円）,柴田　明郎（シバタ アキオ）
株式会社東海テクノ,5190001015635,一般機械器具製造業,〒510-0064三重県四日市市新正4-1-1,0593378747（059-337-8747）,1000（千円）,伊藤　香織（イトウ カオリ）
東洋化工機株式会社,5190001015684,金属製品製造業,〒510-0863三重県四日市市塩浜894,0593454151（059-345-4151）,60000（千円）,代表取締役社長／二井　悠介（ニイ ユウスケ）
トーヨーニツト株式会社,5190001015692,衣服・その他の繊維製品製造業,〒510-0833三重県四日市市中川原4-1-15,0593592160（059-359-2160）,92000（千円）,代表取締役社長／藤本　浩三（フジモト コウゾウ）
株式会社なが餅笹井屋,5190001015775,食料品・飼料・飲料製造業,〒510-0081三重県四日市市北町5-13,0593518800（059-351-8800）,10000（千円）,笹井　利浩（ササイ トシヒロ）
株式会社服部,5190001015940,金属製品製造業,〒510-0103三重県四日市市楠町北五味塚311-1,0593975585（059-397-5585）,10000（千円）,服部　俊一（ハツトリ トシカズ）
株式会社ファインマシナリ三重,5190001016030,一般機械器具製造業,〒512-8061三重県四日市市広永町1381-1,0593652721（059-365-2721）,20000（千円）,浅野　武雄（アサノ タケオ）
福西鋳物株式会社,5190001016047,"鉄鋼業,非鉄金属製造業",〒510-0001三重県四日市市八田3-5-33,0593642631（059-364-2631）,30000（千円）,代表取締役社長／中森　英行（ナカモリ ヒデユキ）
藤安食品工業株式会社,5190001016096,食料品・飼料・飲料製造業,〒510-8005三重県四日市市富双2-1-7,0593640248（059-364-0248）,15000（千円）,伊藤　安博（イトウ ヤスヒロ）
北泗技研工業株式会社,5190001016195,輸送用機械器具製造業,〒510-8124三重県三重郡川越町南福崎901-5,0593646311（059-364-6311）,10000（千円）,柳川　重博（ヤナガワ シゲヒロ）
前野段ボール株式会社,5190001016237,パルプ・紙・紙加工品製造業,〒510-0018三重県四日市市白須賀1-15-10,0593313211（059-331-3211）,41000（千円）,代表取締役社長／前野　修（マエノ オサム）
三重電線工業株式会社,5190001016419,"鉄鋼業,非鉄金属製造業",〒510-0941三重県四日市市東日野2-7-27,0593212111（059-321-2111）,10000（千円）,坂下　隆生（サカシタ タカオ）
三重物流機器株式会社,5190001016435,一般機械器具製造業,〒510-0845三重県四日市市海山道町2-3,0593463220（059-346-3220）,10000（千円）,古澤　幸（フルサワ サチ）
水谷製函株式会社,5190001016468,木材・木製品製造業（家具を除く）,〒510-0007三重県四日市市別名5-4-37,0593316550（059-331-6550）,27000（千円）,代表取締役社長／水谷　鐐一（ミズタニ リヨウイチ）
株式会社明伸製作所,5190001016550,一般機械器具製造業,〒510-0946三重県四日市市小林町3026-10,0593212139（059-321-2139）,10000（千円）,團野　盛一（ダンノ モリイチ）
森寺工機株式会社,5190001016600,金属製品製造業,〒510-0013三重県四日市市富士町1-147,0593314073（059-331-4073）,10000（千円）,代表取締役社長／森寺　浩一（モリデラ ヒロカズ）
株式会社四日市シーリング,5190001016708,出版・印刷・同関連産業,〒510-0013三重県四日市市富士町1-147,0593300275（059-330-0275）,10000（千円）,水谷　真司（ミズタニ シンジ）
株式会社ロンビック,5190001016798,その他の製造業,〒510-0851三重県四日市市塩浜町1-69,0593468231（059-346-8231）,300000（千円）,代表取締役社長／藤田　勝民（フジタ マサヒト）
渡部プラント工業株式会社,5190001016823,一般機械器具製造業,〒512-8061三重県四日市市広永町1336-1,0593648275（059-364-8275）,10000（千円）,渡部　明（ワタベ アキラ）
イノウエ株式会社,5190001016889,窯業・土石製品製造業,〒510-0942三重県四日市市東日野町43-1,0593214600（059-321-4600）,10000（千円）,井上　幸次（イノウエ コウジ）
株式会社スズガミネ,5190001017417,食料品・飼料・飲料製造業,〒510-1311三重県三重郡菰野町永井1754,0593962211（059-396-2211）,10000（千円）,前川　常八（マエカワ ツネヤ）
博愛印刷株式会社,5190001017466,出版・印刷・同関連産業,〒510-1233三重県三重郡菰野町菰野1341,0593941151（059-394-1151）,10000（千円）,辻　活人（ツジ カツヒト）
名金産業株式会社,5190001017516,輸送用機械器具製造業,〒510-1251三重県三重郡菰野町千草4992-6,0593947880（059-394-7880）,10000（千円）,内海　徹（ウツミ トオル）
株式会社タイセイ・アクト,5190001017755,電気機械器具製造業,〒510-0805三重県四日市市東阿倉川824-1,0593256608（059-325-6608）,3000（千円）,川村　泰司（カワムラ ヒロシ）
株式会社中部樹脂工業,5190001017879,金属製品製造業,〒510-0958三重県四日市市小古曽2-1-3,0593496111（059-349-6111）,10000（千円）,服部　英機（ハツトリ ヒデキ）
株式会社ＯＡＳＥＳ,5190001018340,輸送用機械器具製造業,〒510-0865三重県四日市市小浜町11-4,0593673533（059-367-3533）,12200（千円）,前田　辰之（マエダ タツユキ）
ユニテック株式会社,5190001018893,衣服・その他の繊維製品製造業,〒515-2602三重県津市白山町二本木707,0592626616（059-262-6616）,5000（千円）,植野　哲司（ウエノ テツジ）
寺前エンジニアリング株式会社,5190001019314,金属製品製造業,〒513-0836三重県鈴鹿市国府町266-3,0593705510（059-370-5510）,5000（千円）,寺前　裕光（テラマエ ヒロミツ）
テラレゾナンス株式会社,5190001019388,その他の製造業,〒519-0166三重県亀山市布気町649-13,0595973500（0595-97-3500）,5000（千円）,上田　友子（ウエダ トモコ）
株式会社山田精工,5190001019470,輸送用機械器具製造業,〒511-0411三重県いなべ市北勢町京ヶ野新田103-15,0594723531（0594-72-3531）,3000（千円）,前田　力（マエダ チカラ）
株式会社藍科総合開発,5190001019958,電気機械器具製造業,〒514-0101三重県津市白塚町4133-8,0592724020（059-272-4020）,3000（千円）,鈴木　立波（スズキ タツナミ）
株式会社ボンタイム,5190001020635,食料品・飼料・飲料製造業,〒515-2104三重県松阪市小舟江町146-1,0598563328（0598-56-3328）,3000（千円）,橋本　好正（ハシモト ヨシマサ）
株式会社アイホウ,5190001020726,その他の製造業,〒517-0501三重県志摩市阿児町鵜方3373-37,0599657758（0599-65-7758）,5000（千円）,杉浦　麻紀（スギウラ マキ）
株式会社エス・アイ・シー,5190001020775,その他の製造業,〒515-2101三重県松阪市星合町125-2,0598311860（0598-31-1860）,3500（千円）,阪田　邦雄（サカタ クニオ）
メディカル・ファッション株式会社,5190001020817,衣服・その他の繊維製品製造業,〒515-1204三重県松阪市小片野町1558,0598621310（0598-62-1310）,1000（千円）,青井　みどり（アオイ ミドリ）
森永技研工業株式会社,5190001020899,電気機械器具製造業,〒519-0416三重県度会郡玉城町下田辺680,0596580001（0596-58-0001）,3000（千円）,永野　光春（ナガノ ミツハル）
株式会社半泥子廣永窯,5190001020949,窯業・土石製品製造業,〒514-0028三重県津市東丸之内33-1,0592217120（059-221-7120）,10000（千円）,村山　暁（ムラヤマ サトル）
