会社名,法人番号,業種,住所,電話番号,資本金,代表氏名
有限会社ウエノテック,7190002011251,一般機械器具製造業,〒517-0403三重県志摩市浜島町迫子2595-5,0599521676（0599-52-1676）,3000（千円）,上野　和広（ウエノ カズヒロ）
有限会社久政,7190002011334,食料品・飼料・飲料製造業,〒517-0603三重県志摩市大王町波切1000-2,0599724141（0599-72-4141）,3000（千円）,橋爪　政吉（ハシヅメ マサヨシ）
有限会社小林真珠商会,7190002011359,その他の製造業,〒517-0704三重県志摩市志摩町越賀1681-1,0599850354（0599-85-0354）,3000（千円）,小林　弥一郎（コバヤシ ヤイチロウ）
有限会社サンエイ,7190002011400,食料品・飼料・飲料製造業,〒517-0703三重県志摩市志摩町和具642-2,0599850370（0599-85-0370）,3000（千円）,廣　亜輝（ヒロ アキ）
有限会社藤野製作所,7190002012332,その他の製造業,〒518-0027三重県伊賀市西山70-1,0595242958（0595-24-2958）,5000（千円）,藤野　隆夫（フジノ タカオ）
有限会社トランザクション,7190002012605,一般機械器具製造業,〒518-1403三重県伊賀市炊村大平2519-8,0595469025（0595-46-9025）,3000（千円）,横田　定美（ヨコタ サダミ）
有限会社宮田製作所,7190002012704,一般機械器具製造業,〒519-1406三重県伊賀市小杉1578,0595454912（0595-45-4912）,3000（千円）,宮田　千代（ミヤタ チヨ）
有限会社川口紙工,7190002012811,パルプ・紙・紙加工品製造業,〒518-0021三重県伊賀市諏訪481-1,0595243185（0595-24-3185）,3000（千円）,川口　裕二（カワグチ ユウジ）
有限会社ウメザワ,7190002012919,木材・木製品製造業（家具を除く）,〒518-0733三重県名張市大屋戸334,0595630082（0595-63-0082）,5000（千円）,梅澤　比呂之（ウメザワ ヒロシ）
有限会社エム・オー・シー,7190002013231,輸送用機械器具製造業,〒518-0755三重県名張市緑が丘中87,0595643882（0595-64-3882）,3000（千円）,森澤　壮一（モリサワ ソウイチ）
有限会社かいだ,7190002013735,食料品・飼料・飲料製造業,〒515-0025三重県松阪市和屋町312-1,0598286078（0598-28-6078）,3000（千円）,渡邉　宗房（ワタナベ ムネフサ）
有限会社黒部製缶,7190002013801,金属製品製造業,〒515-0063三重県松阪市大黒田町257-1,0598211010（0598-21-1010）,5000（千円）,黒部　美巳（クロベ ヨシミ）
松阪金属有限会社,7190002014477,金属製品製造業,〒515-2133三重県松阪市松ケ島町619,0598515312（0598-51-5312）,10000（千円）,松本　太津也（マツモト タツヤ）
松阪シエル工業有限会社,7190002014485,窯業・土石製品製造業,〒515-0039三重県松阪市清生町594,0598512229（0598-51-2229）,3000（千円）,安田　信吾（ヤスダ シンゴ）
有限会社山下化工,7190002014634,その他の製造業,〒515-2112三重県松阪市曽原町2504,0598569797（0598-56-9797）,3000（千円）,山下　廣彰（ヤマシタ ヒロアキ）
有限会社山端鋏製作所,7190002014642,金属製品製造業,〒515-0812三重県松阪市船江町448-21,0598214383（0598-21-4383）,3000（千円）,山端　公喜（ヤマバタ コウキ）
有限会社吉帝食品,7190002014667,食料品・飼料・飲料製造業,〒515-0205三重県松阪市豊原町857-1,0598286585（0598-28-6585）,3000（千円）,濱崎　喜康（ハマザキ ヨシヤス）
ＯＯＴＯスチール有限会社,7190002015665,"鉄鋼業,非鉄金属製造業",〒515-0001三重県松阪市大口町608,0598510475（0598-51-0475）,3000（千円）,取締役社長／長谷川　昌司（ハセガワ マサシ）
有限会社大創生コン,7190002015715,窯業・土石製品製造業,〒519-2429三重県多気郡大台町高奈948-1,0598832723（0598-83-2723）,3000（千円）,大森　正信（オオモリ マサノブ）
フミ印刷工業有限会社,7190002015731,ゴム製品製造業,〒519-2404三重県多気郡大台町佐原339,0598821212（0598-82-1212）,3000（千円）,上野　廣己（ウエノ ヒロミ）
有限会社大原木材,7190002015764,木材・木製品製造業（家具を除く）,〒519-2518三重県多気郡大台町大井456-2,0598772321（0598-77-2321）,10000（千円）,大原　一晃（オオハラ カズアキ）
有限会社梅田林業,7190002015780,木材・木製品製造業（家具を除く）,〒519-2731三重県度会郡大紀町野原250,0598850076（0598-85-0076）,3000（千円）,梅田　喜文（ウメダ ヨシフミ）
有限会社奥村金属工業所,7190002015789,一般機械器具製造業,〒519-2704三重県度会郡大紀町阿曽1422,0598862621（0598-86-2621）,3000（千円）,奥村　崇（オクムラ タカシ）
有限会社二色電子,7190002015847,電気機械器具製造業,〒519-2911三重県度会郡大紀町錦695,0598732348（0598-73-2348）,3000（千円）,中谷　恭平（ナカタニ キヨウヘイ）
有限会社阪本電機,7190002016614,電気機械器具製造業,〒511-0825三重県桑名市上野763,0594231040（0594-23-1040）,5000（千円）,阪本　岩美（サカモト イワミ）
有限会社城福鋳造所,7190002016696,"鉄鋼業,非鉄金属製造業",〒511-0938三重県桑名市友村302,0594311781（0594-31-1781）,7000（千円）,伊藤　清文（イトウ キヨフミ）
有限会社新和精密,7190002016721,"鉄鋼業,非鉄金属製造業",〒511-0862三重県桑名市播磨792,0594223429（0594-22-3429）,3000（千円）,水谷　京司（ミズタニ キヨウジ）
有限会社世古製作所,7190002016746,一般機械器具製造業,〒511-0912三重県桑名市星川949-2,0594313607（0594-31-3607）,3000（千円）,世古　重二（セコ シゲジ）
七和産業有限会社,7190002016936,"繊維工業（衣服,その他の繊維製品を除く）",〒511-0942三重県桑名市森忠682-4,0594312321（0594-31-2321）,3000（千円）,加藤　力（カトウ チカラ）
有限会社水谷研磨,7190002017232,金属製品製造業,〒511-0841三重県桑名市小貝須1949-1,0594212379（0594-21-2379）,3000（千円）,水谷　善光（ミズタニ ヨシミツ）
有限会社森精工,7190002017265,一般機械器具製造業,〒511-0839三重県桑名市安永1751,0594222358（0594-22-2358）,3000（千円）,森　武義（モリ タケヨシ）
有限会社伊藤昇製作所,7190002017397,輸送用機械器具製造業,〒511-0102三重県桑名市多度町香取16-1,0594482254（0594-48-2254）,5000（千円）,伊藤　信行（イトウ ノブユキ）
有限会社光陽鋳造所,7190002017414,"鉄鋼業,非鉄金属製造業",〒511-0102三重県桑名市多度町香取新切649,0594483180（0594-48-3180）,3000（千円）,水谷　孝（ミズタニ タカシ）
中央精工有限会社,7190002017629,輸送用機械器具製造業,〒498-0815三重県桑名郡木曽岬町白鷺598-47,0567684130（0567-68-4130）,3000（千円）,樽谷　行雄（タルタニ ユキオ）
有限会社金光鉄工所,7190002017868,"鉄鋼業,非鉄金属製造業",〒511-0212三重県いなべ市員弁町平古220-1,0594745582（0594-74-5582）,3000（千円）,金光　成九（カネミツ セイク）
有限会社東建,7190002018016,窯業・土石製品製造業,〒511-0275三重県いなべ市大安町鍋坂上川原2222-1,0594781851（0594-78-1851）,3000（千円）,水谷　真由美（ミズタニ マユミ）
有限会社ヤマセ砂利,7190002018057,窯業・土石製品製造業,〒511-0215三重県いなべ市員弁町東一色28-2,0594770864（0594-77-0864）,3000（千円）,三崎　孝雄（ミサキ タカオ）
有限会社ゼンツー,7190002018107,金属製品製造業,〒511-0433三重県いなべ市北勢町中山104-6,0594723076（0594-72-3076）,5000（千円）,前田　文良（マエダ フミヨシ）
有限会社美濃部製作所,7190002018164,一般機械器具製造業,〒511-0431三重県いなべ市北勢町別名232,0594820002（0594-82-0002）,3000（千円）,美濃部　昌克（ミノベ マサカツ）
マルカメリヤス有限会社,7190002018222,衣服・その他の繊維製品製造業,〒511-0517三重県いなべ市藤原町大貝戸672,0594463623（0594-46-3623）,3000（千円）,林　正男（ハヤシ マサオ）
加桜電子工業有限会社,7190002018899,電気機械器具製造業,〒511-0511三重県いなべ市藤原町市場448-1,0594468052（0594-46-8052）,5000（千円）,谷口　憲行（タニグチ ノリユキ）
有限会社アオイ,7190002018932,その他の製造業,〒510-0956三重県四日市市貝家町25,0593213886（059-321-3886）,3000（千円）,畔柳　康司（クロヤナギ ヤスジ）
朝明水産有限会社,7190002019022,食料品・飼料・飲料製造業,〒510-8121三重県三重郡川越町高松54,0593650127（059-365-0127）,5000（千円）,樋口　嘉明（ヒグチ ヨシアキ）
有限会社朝日モデル,7190002019055,その他の製造業,〒510-0007三重県四日市市別名6-4-14,0593304111（059-330-4111）,3000（千円）,加納　弘樹（カノウ ヒロキ）
有限会社荒木國一商店,7190002019096,食料品・飼料・飲料製造業,〒510-8124三重県三重郡川越町南福崎1291-1,0593611111（059-361-1111）,10000（千円）,荒木　進（アラキ ススム）
有限会社石川畳店,7190002019162,その他の製造業,〒510-0082三重県四日市市中部13-7,0593525657（059-352-5657）,3000（千円）,石川　勝彦（イシカワ カツヒコ）
株式会社岡本機械,7190002019591,一般機械器具製造業,〒510-8031三重県四日市市川北3-5-16,0593653510（059-365-3510）,3000（千円）,岡本　久浩（オカモト ヒサヒロ）
有限会社小澤メリヤス産業,7190002019617,"繊維工業（衣服,その他の繊維製品を除く）",〒510-8114三重県三重郡川越町亀崎新田11-7,0593648865（059-364-8865）,5000（千円）,小澤　克也（オザワ カツヤ）
有限会社尾平精機,7190002019641,一般機械器具製造業,〒512-0922三重県四日市市曽井町83-1,0593267015（059-326-7015）,5000（千円）,牛島　賢二（ウシジマ ケンジ）
有限会社幸和,7190002020112,一般機械器具製造業,〒510-0834三重県四日市市ときわ4-7-23,0593518393（059-351-8393）,3000（千円）,香山　幸則（カヤマ ユキノリ）
有限会社ツルカメ鉄工所,7190002021085,金属製品製造業,〒510-0885三重県四日市市日永2-6-5,0593452010（059-345-2010）,3000（千円）,筒井　俊夫（ツツイ トシオ）
豊田撚糸有限会社,7190002021275,"繊維工業（衣服,その他の繊維製品を除く）",〒510-8122三重県三重郡川越町豊田1107,0593652527（059-365-2527）,3000（千円）,早川　佳代子（ハヤカワ カヨコ）
有限会社平尾製陶,7190002021671,窯業・土石製品製造業,〒512-1205三重県四日市市平尾町3713,0593260135（059-326-0135）,5000（千円）,舘　芳郎（タチ ヨシオ）
北勢印刷有限会社,7190002021894,出版・印刷・同関連産業,〒512-0921三重県四日市市尾平町3087-2,0593313704（059-331-3704）,3000（千円）,川北　輝夫（カワキタ テルオ）
有限会社丸彦,7190002022125,食料品・飼料・飲料製造業,〒510-0873三重県四日市市貝塚町280-6,0593472368（059-347-2368）,5000（千円）,今村　敏彦（イマムラ トシヒコ）
有限会社村上時雨店,7190002022331,食料品・飼料・飲料製造業,〒510-0045三重県四日市市蔵町2-2,0593522818（059-352-2818）,3000（千円）,村上　邦子（ムラカミ クニコ）
有限会社山庄,7190002022521,化学工業,〒510-0881三重県四日市市六呂見458-1,0593485090（059-348-5090）,6000（千円）,奥田　恵理子（オクダ エリコ）
有限会社米川工機,7190002022694,一般機械器具製造業,〒512-1115三重県四日市市堂ケ山町1142,0593282280（059-328-2280）,3000（千円）,米川　利己（ヨネカワ トシミ）
有限会社門脇鉄工所,7190002023701,一般機械器具製造業,〒510-1326三重県三重郡菰野町杉谷2365-66,0593964041（059-396-4041）,5000（千円）,門脇　久美子（カドワキ クミコ）
有限会社山源,7190002024311,衣服・その他の繊維製品製造業,〒510-0863三重県四日市市塩浜4559-2,0593453413（059-345-3413）,5000（千円）,今村　隆司（イマムラ タカシ）
合資会社中野商店,7190003000617,食料品・飼料・飲料製造業,〒519-5713三重県南牟婁郡紀宝町成川629,0735222139（0735-22-2139）,"",中野　勝美（ナカノ カツミ）
合資会社加藤木型製作所,7190003001350,その他の製造業,〒511-0862三重県桑名市播磨2468,0594221245（0594-22-1245）,"",加藤　榮一（カトウ エイイチ）
グリーンエネルギー合同会社,7190003002035,電気機械器具製造業,〒518-0701三重県名張市鴻之台1番町35-2,0595642545（0595-64-2545）,53000（千円）,東　謙治（ヒガシ ケンジ）
合同会社味工房わたらい,7190003002209,食料品・飼料・飲料製造業,〒516-1238三重県度会郡度会町中之郷1157-5,0596640644（0596-64-0644）,150（千円）,縄手　和子（ナワテ カズコ）
農事組合法人ファクター,7190005003881,食料品・飼料・飲料製造業,〒519-3205三重県北牟婁郡紀北町長島1714-1,0597473226（0597-47-3226）,10000（千円）,垣内　善通（カキウチ ヨシミチ）
伊賀プレカット協同組合,7190005006224,木材・木製品製造業（家具を除く）,〒518-0734三重県名張市黒田下川原1421-1,0595630161（0595-63-0161）,67550（千円）,辻本　林義（ツジモト シゲヨシ）
三重県木造住宅協同組合,7190005006554,木材・木製品製造業（家具を除く）,〒515-0088三重県松阪市木の郷町14,0598201079（0598-20-1079）,93950（千円）,森下　隆生（モリシタ タカオ）
農事組合法人百姓工房伊賀の大地,7190005010044,食料品・飼料・飲料製造業,〒519-1711三重県伊賀市島ヶ原15085-1,0595593711（0595-59-3711）,2000（千円）,松森　芳子（マツモリ ヨシコ）
旭電器工業株式会社,8190001000048,電気機械器具製造業,〒514-0101三重県津市白塚町2856,0592332000（059-233-2000）,80000（千円）,代表取締役社長／橋本　幸司（ハシモト コウジ）
共立印刷株式会社,8190001000279,出版・印刷・同関連産業,〒514-2313三重県津市安濃町今徳901,0592684111（059-268-4111）,10000（千円）,高畑　知典（タカハタ トモノリ）
株式会社ヒラマツ,8190001000907,金属製品製造業,〒514-0303三重県津市雲出長常町1349-93,0592647131（059-264-7131）,30000（千円）,代表取締役社長／平松　洋一郎（ヒラマツ ヨウイチロウ）
魚見建材工業株式会社,8190001001269,電気機械器具製造業,〒514-1256三重県津市中村町656-1,0592521110（059-252-1110）,10000（千円）,魚見　尚（ウオミ ヒサシ）
株式会社遠藤製作所,8190001001277,金属製品製造業,〒514-1138三重県津市戸木町5141-2,0592552695（059-255-2695）,20000（千円）,代表取締役社長／遠藤　祐司（エンドウ ユウジ）
中部化成工業株式会社,8190001001343,その他の製造業,〒514-1138三重県津市戸木町5141-16,0592566888（059-256-6888）,30000（千円）,池田　力弥（イケダ リキヤ）
三重河西株式会社,8190001001392,輸送用機械器具製造業,〒514-1255三重県津市庄田町2202-23,0592553080（059-255-3080）,490500（千円）,代表取締役社長／折茂　元弘（オリモ モトヒロ）
株式会社チカザワ,8190001001434,金属製品製造業,〒514-2206三重県津市芸濃町小野平245-1,0592653515（059-265-3515）,10000（千円）,近澤　真一（チカザワ シンイチ）
ハタ製菓株式会社,8190001001475,食料品・飼料・飲料製造業,〒515-2522三重県津市一志町波瀬2192-3,0592947019（059-294-7019）,10000（千円）,畠　敏晃（ハタ トシアキ）
今村酒造株式会社,8190001001491,食料品・飼料・飲料製造業,〒514-0311三重県津市香良洲町263,0592923311（059-292-3311）,10000（千円）,今村　健児（イマムラ ケンジ）
株式会社安芸砂利,8190001001558,窯業・土石製品製造業,〒514-2322三重県津市安濃町戸島北川原2510,0592684100（059-268-4100）,15000（千円）,内田　寿久（ウチダ トシヒサ）
カツラ工業株式会社,8190001001566,ゴム製品製造業,〒514-2327三重県津市安濃町安部232-1,0592682897（059-268-2897）,10000（千円）,齊藤　喜洋（サイトウ ヨシヒロ）
株式会社後久鉄工,8190001001574,一般機械器具製造業,〒514-2302三重県津市安濃町安濃2316,0592681975（059-268-1975）,10000（千円）,代表取締役社長／後久　行輝（ゴキユウ ユキテル）
株式会社ヤマキ,8190001001616,食料品・飼料・飲料製造業,〒510-0307三重県津市河芸町影重3007,0592450547（059-245-0547）,10000（千円）,山野　京子（ヤマノ キヨウコ）
株式会社リアリティ,8190001001772,化学工業,〒514-1118三重県津市久居新町3006,0592546066（059-254-6066）,20000（千円）,岡本　幸秀（オカモト ユキヒデ）
株式会社ダイヒ,8190001003018,電気機械器具製造業,〒514-0008三重県津市上浜町1-245,0592222131（059-222-2131）,50000（千円）,代表取締役社長／中務　進（ナカツカサ ススム）
株式会社プレサイズＡＩ,8190001003199,一般機械器具製造業,〒514-0823三重県津市半田705-5,0592212334（059-221-2334）,10000（千円）,市野　泰祐（イチノ ヤスヒロ）
株式会社サン工業,8190001003397,窯業・土石製品製造業,〒519-0165三重県亀山市野村4-2-11,0595826521（0595-82-6521）,10000（千円）,山本　達雄（ヤマモト タツオ）
白金製函株式会社,8190001003422,木材・木製品製造業（家具を除く）,〒519-1106三重県亀山市関町会下1363-4,0595961331（0595-96-1331）,40000（千円）,代表取締役社長／近藤　泰規（コンドウ ヤスノリ）
野登製材株式会社,8190001003471,木材・木製品製造業（家具を除く）,〒519-0222三重県亀山市両尾町2290,0595850235（0595-85-0235）,20000（千円）,尾山　晴正（オヤマ ハルマサ）
株式会社アオキクリエイト,8190001003570,一般機械器具製造業,〒514-1252三重県津市稲葉町460-3,0592542555（059-254-2555）,5000（千円）,青木　健二（アオキ ケンジ）
株式会社アオキエンジニア,8190001003694,一般機械器具製造業,〒514-1252三重県津市稲葉町460-5,0592542555（059-254-2555）,10000（千円）,青木　健二（アオキ ケンジ）
糸川屋製菓株式会社,8190001004172,食料品・飼料・飲料製造業,〒519-4325三重県熊野市有馬町5410,0597892014（0597-89-2014）,10000（千円）,糸川　佳男（イトガワ ヨシオ）
紀州紙精選株式会社,8190001004296,パルプ・紙・紙加工品製造業,〒519-5701三重県南牟婁郡紀宝町鵜殿182,0735330033（0735-33-0033）,10000（千円）,内山　公男（ウチヤマ キミオ）
株式会社ワダマツ,8190001004362,食料品・飼料・飲料製造業,〒519-5202三重県南牟婁郡御浜町志原939-19,0597930022（05979-3-0022）,10000（千円）,和田　健一郎（ワダ ケンイチロウ）
三紀産業株式会社,8190001004412,食料品・飼料・飲料製造業,〒519-3672三重県尾鷲市矢浜岡崎町261-1,0597224320（0597-22-4320）,30000（千円）,仲本　捷男（ナカモト カツオ）
株式会社楠製材,8190001004692,木材・木製品製造業（家具を除く）,〒519-3671三重県尾鷲市矢浜4-3-15,0597221473（0597-22-1473）,10（千円）,楠　英敏（クス ヒデトシ）
アサヒ化工株式会社,8190001004775,その他の製造業,〒513-0836三重県鈴鹿市国府町7679-1,0593700038（059-370-0038）,10000（千円）,諸岡　純（モロオカ ジユン）
株式会社協立製作所,8190001004932,その他の製造業,〒513-0852三重県鈴鹿市末広西8-1,0593831768（059-383-1768）,18000（千円）,代表取締役社長／豊田　秀行（トヨダ ヒデユキ）
株式会社三甲,8190001005039,木材・木製品製造業（家具を除く）,〒513-0826三重県鈴鹿市住吉3-12-24,0593702919（059-370-2919）,10000（千円）,伊藤　尚洋（イトウ タカヒロ）
島栄型紙株式会社,8190001005047,"繊維工業（衣服,その他の繊維製品を除く）",〒510-0254三重県鈴鹿市寺家7-9-25,0593860111（059-386-0111）,10000（千円）,島村　準三（シマムラ ジユンゾウ）
鈴鹿綜合工業株式会社,8190001005096,輸送用機械器具製造業,〒510-0261三重県鈴鹿市御薗町3600-25,0593722173（059-372-2173）,11000（千円）,代表取締役社長／伊藤　慎二（イトウ シンジ）
中部製罐株式会社,8190001005195,金属製品製造業,〒513-0031三重県鈴鹿市一ノ宮町三反長992,0593835111（059-383-5111）,25000（千円）,齋藤　邦一（サイトウ クニカズ）
成尾サツシ工業株式会社,8190001005261,金属製品製造業,〒513-0816三重県鈴鹿市南玉垣町5865,0593826411（059-382-6411）,10000（千円）,成尾　隆治（ナルオ タカハル）
早川印刷株式会社,8190001005294,出版・印刷・同関連産業,〒513-0806三重県鈴鹿市算所3-16-30,0593786616（059-378-6616）,10000（千円）,早川　安雄（ハヤカワ ヤスオ）
フィルテック株式会社,8190001005336,その他の製造業,〒513-0827三重県鈴鹿市大池3-1-43,0593753132（059-375-3132）,10000（千円）,澤　秀信（サワ ヒデノブ）
株式会社ヤブタ製作所,8190001005476,ゴム製品製造業,〒513-0021三重県鈴鹿市甲斐町1240,0593836464（059-383-6464）,10000（千円）,薮田　徳文（ヤブタ ノリフミ）
株式会社ヨシザワ,8190001005484,その他の製造業,〒513-0803三重県鈴鹿市三日市町1823-1,0593823323（059-382-3323）,80000（千円）,代表取締役社長／吉澤　茂（ヨシザワ シゲル）
株式会社池田産業,8190001005583,一般機械器具製造業,〒513-0826三重県鈴鹿市住吉5-1-16,0593706253（059-370-6253）,29000（千円）,池田　正博（イケダ マサヒロ）
株式会社アイペック,8190001005914,電気機械器具製造業,〒519-0323三重県鈴鹿市伊船町2014-7,0593716270（059-371-6270）,3000（千円）,伊藤　英昭（イトウ ヒデアキ）
株式会社ＮＩＣＥ,8190001006292,輸送用機械器具製造業,〒510-0257三重県鈴鹿市東磯山1-1-3,0593513007（059-351-3007）,1000（千円）,岡田　純一（オカダ ジユンイチ）
株式会社伊勢萬,8190001006490,食料品・飼料・飲料製造業,〒519-0501三重県伊勢市小俣町明野576-13,0596374195（0596-37-4195）,61800（千円）,代表取締役社長／浜田　吉司（ハマダ ヨシジ）
株式会社エテック,8190001006516,電気機械器具製造業,〒516-0005三重県伊勢市竹ケ鼻町373,0596310088（0596-31-0088）,20000（千円）,西川　哲（ニシカワ サトシ）
キクカワエンタープライズ株式会社,8190001006573,一般機械器具製造業,〒516-0021三重県伊勢市朝熊町3477-36,0596212120（0596-21-2120）,660000（千円）,代表取締役社長／菊川　厚（キクカワ アツシ）
北村物産株式会社,8190001006581,食料品・飼料・飲料製造業,〒515-0509三重県伊勢市東大淀町187,0596372133（0596-37-2133）,10000（千円）,北村　傳裕（キタムラ タダヒロ）
神都印刷株式会社,8190001006714,出版・印刷・同関連産業,〒516-0037三重県伊勢市岩渕1-15-4,0596282230（0596-28-2230）,10000（千円）,奥村　正明（オクムラ マサアキ）
株式会社千種鉄工所,8190001006805,金属製品製造業,〒519-0503三重県伊勢市小俣町元町1602-1,0596223020（0596-22-3020）,10000（千円）,千種　勲（チクサ イサオ）
株式会社ハヤシ食品,8190001006929,食料品・飼料・飲料製造業,〒519-0503三重県伊勢市小俣町元町1834,0596220653（0596-22-0653）,10000（千円）,林　脩（ハヤシ シユウ）
辻井工業株式会社,8190001007183,一般機械器具製造業,〒516-0003三重県伊勢市下野町600-12,0596362211（0596-36-2211）,10000（千円）,代表取締役社長／辻井　祐司（ツジイ ユウジ）
株式会社ワンダーランド三重,8190001007514,一般機械器具製造業,〒516-1102三重県伊勢市佐八町2278-19,0596390800（0596-39-0800）,10000（千円）,土田　久一（ツチダ ヒサカズ）
株式会社ギコー,8190001007646,輸送用機械器具製造業,〒516-2105三重県度会郡度会町平生666-1,0596624400（0596-62-4400）,10000（千円）,川上　義徳（カワカミ ヨシノリ）
オオシマフードサービス株式会社,8190001007720,食料品・飼料・飲料製造業,〒516-0017三重県伊勢市神久6-730-6,0596204545（0596-20-4545）,3000（千円）,大島　誠鎭（オオシマ セイジ）
エムケイ金澤クリエイト株式会社,8190001008405,その他の製造業,〒518-0818三重県伊賀市荒木1184-7,0595244078（0595-24-4078）,10000（千円）,金澤　準（カナザワ ジユン）
