会社名,法人番号,業種,住所,電話番号,資本金,代表氏名
壽印刷工業株式会社,1190001000327,出版・印刷・同関連産業,〒514-2313三重県津市安濃町今徳1349,0592683538（059-268-3538）,20000（千円）,村山　満（ムラヤマ ミツル）
日硝フアイバー株式会社,1190001000814,窯業・土石製品製造業,〒514-0817三重県津市高茶屋小森町4902日本板硝子内,0592381153（059-238-1153）,45000（千円）,川口　哲（カワグチ サトル）
株式会社ハイパーツ三重,1190001000847,金属製品製造業,〒514-1138三重県津市戸木町赤部5081-4,0592545666（059-254-5666）,20000（千円）,鈴木　克已（スズキ カツミ）
松澤精工株式会社,1190001000995,一般機械器具製造業,〒514-0819三重県津市高茶屋6-8-19,0592342434（059-234-2434）,15000（千円）,松澤　健二（マツザワ ケンジ）
みえぎょれん販売株式会社,1190001001135,食料品・飼料・飲料製造業,〒516-0021三重県伊勢市朝熊町3477-32,0596637101（0596-63-7101）,60000（千円）,代表取締役社長／中村　香雪（ナカムラ カセツ）
村田化学工業株式会社,1190001001168,その他の製造業,〒514-0125三重県津市大里窪田町911,0592324569（059-232-4569）,10000（千円）,村田　義明（ムラタ ヨシアキ）
株式会社リバ技研,1190001001234,窯業・土石製品製造業,〒514-0817三重県津市高茶屋小森町2866-1,0592351110（059-235-1110）,10000（千円）,山本　敬明（ヤマモト ヨシアキ）
三立化工株式会社,1190001001325,窯業・土石製品製造業,〒514-1253三重県津市久居一色町151-1,0592521011（059-252-1011）,10000（千円）,代表取締役社長／八幡　伸行（ヤワタ ノブユキ）
佐藤化成株式会社,1190001001424,その他の製造業,〒514-2208三重県津市芸濃町忍田900,0592654520（059-265-4520）,10000（千円）,佐藤　朗（サトウ アキラ）
ダイソウ工業株式会社,1190001001432,金属製品製造業,〒514-2213三重県津市芸濃町北神山1470-3,0592655700（059-265-5700）,10000（千円）,森下　文博（モリシタ フミヒロ）
株式会社小川本家,1190001001507,食料品・飼料・飲料製造業,〒510-0306三重県津市河芸町一色1425,0592450013（059-245-0013）,10000（千円）,小川　増人（オガワ マスヒト）
松島酒造株式会社,1190001001597,食料品・飼料・飲料製造業,〒514-2316三重県津市安濃町南神山191,0592680869（059-268-0869）,10000（千円）,松島　徹（マツシマ トオル）
株式会社三重義肢製作所,1190001003040,精密機械・医療機械器具製造業,〒514-0817三重県津市高茶屋小森町野田1756-5,0592343171（059-234-3171）,10000（千円）,日々野　弘之（ヒビノ ヒロユキ）
株式会社アシベ工芸,1190001003321,化学工業,〒519-0211三重県亀山市川崎町2332,0595850251（0595-85-0251）,20000（千円）,新庄　哲三（シンジヨウ テツゾウ）
株式会社ハイテック,1190001003478,一般機械器具製造業,〒519-1106三重県亀山市関町会下1265-22,0595960490（0595-96-0490）,10000（千円）,平子　秀人（ヒラコ ヒデト）
株式会社ファーストモールディング,1190001003486,輸送用機械器具製造業,〒519-0143三重県亀山市安知本町1858-15,0595830133（0595-83-0133）,10000（千円）,安藤　元師（アンドウ モトシ）
三重製氷冷蔵株式会社,1190001003503,食料品・飼料・飲料製造業,〒519-0212三重県亀山市能褒野町4-7,0595851421（0595-85-1421）,10000（千円）,佐野　良徳（サノ ヨシノリ）
株式会社テイク,1190001003651,金属製品製造業,〒514-2208三重県津市芸濃町忍田575,0592653849（059-265-3849）,3000（千円）,鬼頭　孝夫（キトウ タカオ）
株式会社オージャス,1190001004022,その他の製造業,〒514-0304三重県津市雲出本郷町1379-1,0592345555（059-234-5555）,9700（千円）,菅原　広之（スガワラ ヒロユキ）
熊野精工株式会社,1190001004187,その他の製造業,〒519-4325三重県熊野市有馬町1491-1,0597892741（0597-89-2741）,10000（千円）,代表取締役専務／桧作　羊次（ヒツクリ ヨウジ）
榎本石材株式会社,1190001004377,窯業・土石製品製造業,〒519-3921三重県尾鷲市賀田町547-3,0597273013（0597-27-3013）,15000（千円）,榎本　和也（エノモト カズヤ）
株式会社マーシー,1190001004451,食料品・飼料・飲料製造業,〒519-3672三重県尾鷲市矢浜岡崎町1979-32,0597229110（0597-22-9110）,10000（千円）,三鬼　直也（ミキ ナオヤ）
海産まる葉株式会社,1190001004501,食料品・飼料・飲料製造業,〒519-3204三重県北牟婁郡紀北町東長島46-24,0597470700（0597-47-0700）,25000（千円）,東　十三夫（ヒガシ トミオ）
株式会社ヤナギダ・テクノ,1190001004534,その他の製造業,〒519-3204三重県北牟婁郡紀北町東長島2291,0597470490（0597-47-0490）,10000（千円）,柳田　篤男（ヤナギダ アツオ）
株式会社ハヤミ,1190001004591,食料品・飼料・飲料製造業,〒519-3601三重県尾鷲市南浦2553-2,0597229210（0597-22-9210）,500（千円）,速水　正弘（ハヤミ マサヒロ）
株式会社エーエム開発モデル製作所,1190001004856,その他の製造業,〒510-0261三重県鈴鹿市御薗町3600-31,0593720860（059-372-0860）,12000（千円）,代表取締役社長／宮崎　満里子（ミヤザキ マリコ）
株式会社エヌ・エス,1190001004872,輸送用機械器具製造業,〒513-0826三重県鈴鹿市住吉1-13-10,0593787515（059-378-7515）,20000（千円）,代表取締役社長／野間　正治（ノマ シヨウジ）
株式会社大杉型紙工業,1190001004880,パルプ・紙・紙加工品製造業,〒510-0243三重県鈴鹿市白子3-8-6,0593860271（059-386-0271）,10000（千円）,大杉　昭二（オオスギ シヨウジ）
株式会社カネショウ中島水産,1190001004914,食料品・飼料・飲料製造業,〒510-0243三重県鈴鹿市白子1-6281-A2,0593860488（059-386-0488）,10000（千円）,中島　豊（ナカシマ ユタカ）
清水清三郎商店株式会社,1190001005045,食料品・飼料・飲料製造業,〒510-0225三重県鈴鹿市若松東3-9-33,0593850011（059-385-0011）,16800（千円）,清水　慎一郎（シミズ シンイチロウ）
株式会社ツーワン,1190001005210,ゴム製品製造業,〒513-0032三重県鈴鹿市池田町1228,0593836070（059-383-6070）,50000（千円）,前田　吉弘（マエダ ヨシヒロ）
株式会社トピア,1190001005227,金属製品製造業,〒513-0031三重県鈴鹿市一ノ宮町1477-1,0593837322（059-383-7322）,86000（千円）,代表取締役社長／佐々木　英樹（ササキ ヒデキ）
ＡＧＦ鈴鹿株式会社,1190001005350,食料品・飼料・飲料製造業,〒513-0816三重県鈴鹿市南玉垣町6410,0593823181（059-382-3181）,23500（千円）,代表取締役社長／松林　正雄（マツバヤシ マサオ）
株式会社メイキング田中,1190001005458,精密機械・医療機械器具製造業,〒513-0032三重県鈴鹿市池田町1242,0593827337（059-382-7337）,29700（千円）,田中　哲矢（タナカ テツヤ）
株式会社ワールド,1190001005516,電気機械器具製造業,〒513-0848三重県鈴鹿市平田本町2-22-6,0593788484（059-378-8484）,10000（千円）,北濱　晃一（キタハマ コウイチ）
株式会社サンテック,1190001005565,一般機械器具製造業,〒513-0825三重県鈴鹿市住吉町6810-2,0593706650（059-370-6650）,10000（千円）,立石　和夫（タテイシ カズオ）
株式会社スズカ,1190001006035,一般機械器具製造業,〒513-0006三重県鈴鹿市和泉町787-2,0593735343（059-373-5343）,1000（千円）,箱守　勲夫（ハコモリ イサオ）
株式会社ＭＩＣ,1190001006051,一般機械器具製造業,〒513-0826三重県鈴鹿市住吉5-6-7,0593586437（059-358-6437）,8000（千円）,若林　学（ワカバヤシ マナブ）
株式会社赤福,1190001006381,食料品・飼料・飲料製造業,〒516-0021三重県伊勢市朝熊町2015,0596222154（0596-22-2154）,77000（千円）,代表取締役社長／濱田　勝子（ハマダ マサルコ）
株式会社アイエヌティー技研,1190001006398,電気機械器具製造業,〒516-0804三重県伊勢市御薗町長屋2226,0596283227（0596-28-3227）,10000（千円）,石原　博（イシハラ ヒロシ）
林鋼材株式会社,1190001006919,"鉄鋼業,非鉄金属製造業",〒516-0002三重県伊勢市馬瀬町1097,0596360165（0596-36-0165）,10000（千円）,林　吉三（ハヤシ ヨシゾウ）
美和金属株式会社,1190001007058,金属製品製造業,〒519-0506三重県伊勢市小俣町湯田96-1,0596223069（0596-22-3069）,10000（千円）,代表取締役社長／和氣　英雄（ワケ ヒデオ）
楠精器株式会社,1190001007355,金属製品製造業,〒517-0045三重県鳥羽市船津町榎谷1371-15,0599253591（0599-25-3591）,10000（千円）,代表取締役社長／小林　一裕（コバヤシ カズヒロ）
株式会社ブランカ,1190001007413,食料品・飼料・飲料製造業,〒517-0011三重県鳥羽市鳥羽3-15-3,0599255999（0599-25-5999）,10000（千円）,石井　あき（イシイ アキ）
株式会社Ａ－ＬＩＮＥ,1190001007941,食料品・飼料・飲料製造業,〒516-0051三重県伊勢市上地町4198,0596656130（0596-65-6130）,1000（千円）,濱口　元和（ハマグチ モトカズ）
南勢船舶工業株式会社,1190001008056,電気機械器具製造業,〒517-0404三重県志摩市浜島町浜島1150-5,0599530107（0599-53-0107）,10000（千円）,小市　則彦（コイチ ノリヒコ）
宏洋配管機器株式会社,1190001008469,金属製品製造業,〒519-1701三重県伊賀市島ヶ原12608,0595592883（0595-59-2883）,10000（千円）,山本　圭一（ヤマモト ケイイチ）
センユー化学工業株式会社,1190001008519,その他の製造業,〒518-1146三重県伊賀市湯屋谷236-1,0595390133（0595-39-0133）,10000（千円）,鈴川　雅春（スズカワ マサハル）
中部アド株式会社,1190001008551,その他の製造業,〒518-0825三重県伊賀市小田町1396-43,0595241531（0595-24-1531）,10000（千円）,田中　穣（タナカ ジヨウ）
株式会社古川鉄工所,1190001008642,一般機械器具製造業,〒518-0032三重県伊賀市朝屋555,0595231345（0595-23-1345）,10000（千円）,古川　哲也（フルカワ テツヤ）
株式会社安永,1190001008733,輸送用機械器具製造業,〒518-0834三重県伊賀市緑ケ丘中町3860,0595242111（0595-24-2111）,2142256（千円）,代表取締役社長／安永　暁俊（ヤスナガ アキトシ）
西村木材工業株式会社,1190001009062,木材・木製品製造業（家具を除く）,〒518-0206三重県伊賀市下川原640-4,0595520328（0595-52-0328）,10000（千円）,西村　寛純（ニシムラ ヒロズミ）
株式会社冨士産業社,1190001009070,衣服・その他の繊維製品製造業,〒518-0226三重県伊賀市阿保1417-3,0595520326（0595-52-0326）,10000（千円）,藤室　孝行（フジムロ タカユキ）
株式会社カワネ工作所,1190001009153,金属製品製造業,〒518-1323三重県伊賀市石川279-45,0595441601（0595-44-1601）,3000（千円）,川根　康久（カワネ ヤスヒサ）
キンセイ化学工業株式会社,1190001009327,化学工業,〒518-0737三重県名張市安部田3949,0595625884（0595-62-5884）,10000（千円）,滝川　和良（タキガワ カズノブ）
東亜ゴム工業株式会社,1190001009418,ゴム製品製造業,〒518-0609三重県名張市西田原413-1,0595657980（0595-65-7980）,19000（千円）,平山　朝美（ヒラヤマ アサミ）
広島工業株式会社,1190001009483,"鉄鋼業,非鉄金属製造業",〒518-0752三重県名張市蔵持町原出522-43,0595642038（0595-64-2038）,15000（千円）,橋川　輝明（ハシカワ テルアキ）
伊勢醤油本舗株式会社,1190001010111,食料品・飼料・飲料製造業,〒516-0025三重県伊勢市宇治中之切町52,0598503008（0598-50-3008）,20000（千円）,三林　憲忠（ミツバヤシ ノリタダ）
株式会社オクムラ,1190001010144,輸送用機械器具製造業,〒515-0831三重県松阪市岡本町218-1,0598211210（0598-21-1210）,10000（千円）,中川　文男（ナカガワ フミオ）
株式会社夕刊三重新聞社,1190001010689,出版・印刷・同関連産業,〒515-0821三重県松阪市外五曲町15,0598216113（0598-21-6113）,10000（千円）,山下　至（ヤマシタ イタル）
ヤマニカートン株式会社,1190001010870,パルプ・紙・紙加工品製造業,〒515-0331三重県多気郡明和町佐田925,0596521411（0596-52-1411）,20000（千円）,代表取締役／村瀬　元一郎（ムラセ ゲンイチロウ）
株式会社サンカ機工,1190001010945,一般機械器具製造業,〒515-0021三重県松阪市古井町551-1,0598503232（0598-50-3232）,10000（千円）,代表取締役社長／花崎　義明（ハナサキ ヨシアキ）
伊勢フーズ株式会社,1190001011010,食料品・飼料・飲料製造業,〒515-2132三重県松阪市松崎浦町舟入752,0598505777（0598-50-5777）,10000（千円）,山崎　将義（ヤマザキ マサヨシ）
株式会社テクノ・バンダリー,1190001011043,電気機械器具製造業,〒515-0103三重県松阪市西黒部町712-6,0598539196（0598-53-9196）,3000（千円）,丸谷　新治（マルヤ シンジ）
株式会社タケカワダイヤツール,1190001011051,一般機械器具製造業,〒515-0834三重県松阪市岡山町32,0598631231（0598-63-1231）,30000（千円）,竹川　博子（タケカワ ヒロコ）
樋口木材株式会社,1190001011134,木材・木製品製造業（家具を除く）,〒515-1303三重県松阪市飯南町下仁柿945,0598322046（0598-32-2046）,20000（千円）,樋口　俊行（ヒグチ トシユキ）
ＪＵＫＩ金属株式会社,1190001011175,"鉄鋼業,非鉄金属製造業",〒519-2400三重県多気郡大台町上三瀬425,0598821355（0598-82-1355）,250000（千円）,代表取締役社長／中村　茂（ナカムラ シゲル）
株式会社宮川林業,1190001011191,金属製品製造業,〒519-2404三重県多気郡大台町佐原157-6,0598821129（0598-82-1129）,10000（千円）,板羽　英治（イタバ エイジ）
株式会社ハイテック,1190001011266,一般機械器具製造業,〒515-0021三重県松阪市古井町555,0598530290（0598-53-0290）,10000（千円）,川口　直純（カワグチ ナオズミ）
株式会社ナカコー,1190001011506,電気機械器具製造業,〒515-1501三重県松阪市飯高町下滝野1423-2,0598468008（0598-46-8008）,1000（千円）,中林　幸郎（ナカバヤシ ユキオ）
株式会社バイオシリカ研究所,1190001011695,化学工業,〒515-0077三重県松阪市茶与町2-4,"",10000（千円）,川村　弘一（カワムラ コウイチ）
松阪メタル株式会社,1190001011720,金属製品製造業,〒515-0833三重県松阪市西野町2682,0598580003（0598-58-0003）,50000（千円）,代表取締役社長／中川　祐（ナカガワ ユウ）
コウヨウ株式会社,1190001011753,木材・木製品製造業（家具を除く）,〒515-0041三重県松阪市上川町2739-63,0598282441（0598-28-2441）,10000（千円）,瀬古　和彦（セコ カズヒコ）
株式会社アベテツク,1190001012009,一般機械器具製造業,〒511-0844三重県桑名市福岡町473-16,0594220618（0594-22-0618）,10000（千円）,代表取締役社長／阿部　展久（アベ ノブヒサ）
太田鋳造株式会社,1190001012082,"鉄鋼業,非鉄金属製造業",〒511-0838三重県桑名市和泉397,0594225353（0594-22-5353）,20000（千円）,代表取締役社長／太田　裕二（オオタ ユウジ）
株式会社斎藤金型製作所,1190001012215,一般機械器具製造業,〒511-0118三重県桑名市多度町御衣野天ノ子4417-3,0594492822（0594-49-2822）,23000（千円）,代表取締役社長／齊藤　清司（サイトウ キヨシ）
株式会社星都,1190001012322,その他の製造業,〒511-0842三重県桑名市立田町84,0594233033（0594-23-3033）,10000（千円）,星野　浩次（ホシノ ヒロツグ）
株式会社桑立工業,1190001012339,一般機械器具製造業,〒511-0836三重県桑名市江場正金縄411-1,0594228560（0594-22-8560）,10000（千円）,諸戸　裕二（モロト ユウジ）
大洋産業株式会社,1190001012363,"鉄鋼業,非鉄金属製造業",〒511-0839三重県桑名市安永拾壱区割1833-1,0594226792（0594-22-6792）,16000（千円）,代表取締役社長／坂本　昌広（サカモト マサヒロ）
穂積工業株式会社,1190001012561,一般機械器具製造業,〒511-0838三重県桑名市和泉231,0594221847（0594-22-1847）,10000（千円）,笠井　雅俊（カサイ マサトシ）
三重発条株式会社,1190001012603,金属製品製造業,〒511-0811三重県桑名市東方2809,0594224092（0594-22-4092）,10000（千円）,西脇　茂弘（ニシワキ シゲヒロ）
株式会社吉田,1190001012702,金属製品製造業,〒511-0845三重県桑名市福地156-3,0594213452（0594-21-3452）,10000（千円）,吉田　清信（ヨシダ キヨノブ）
株式会社ショルティ,1190001012735,衣服・その他の繊維製品製造業,〒511-0106三重県桑名市多度町多度1085,0594876156（0594-87-6156）,10000（千円）,小西　進（コニシ ススム）
株式会社東和鋳造所,1190001012743,一般機械器具製造業,〒511-0123三重県桑名市多度町北猪飼松本1188-1,0594483370（0594-48-3370）,10000（千円）,伊藤　てい子（イトウ テイコ）
ミホクインダストリ株式会社,1190001012818,金属製品製造業,〒511-1113三重県桑名市長島町押付70-7,0594421100（0594-42-1100）,10000（千円）,清水　啓史（シミズ ヨシフミ）
シイノケミカル株式会社,1190001012842,その他の製造業,〒498-0802三重県桑名郡木曽岬町見入335,0567671195（0567-67-1195）,10000（千円）,椎野　元彦（シイノ ハルヒコ）
株式会社マルイ鉄工,1190001012859,金属製品製造業,〒498-0814三重県桑名郡木曽岬町三崎552-2,0567684066（0567-68-4066）,10000（千円）,伊藤　卓男（イトウ タカオ）
北貝進工業株式会社,1190001012925,金属製品製造業,〒511-0242三重県員弁郡東員町六把野新田901,0594768328（0594-76-8328）,10000（千円）,佐藤　貴典（サトウ タカノリ）
株式会社三電機,1190001013007,金属製品製造業,〒511-0273三重県いなべ市大安町平塚八幡1175,0594784431（0594-78-4431）,10200（千円）,佐藤　裕（サトウ ヒロシ）
宮木工業株式会社,1190001013122,家具・装備品製造業,〒511-0506三重県いなべ市藤原町長尾301,0594462062（0594-46-2062）,10000（千円）,宮木　宏紀（ミヤキ ヒロキ）
株式会社吉田製作所,1190001013205,金属製品製造業,〒511-0845三重県桑名市福地156-3,0594213452（0594-21-3452）,10000（千円）,吉田　清信（ヨシダ キヨノブ）
株式会社ＮＴＮ三重製作所,1190001013337,一般機械器具製造業,〒511-0118三重県桑名市多度町御衣野3601-25,0594486711（0594-48-6711）,3000000（千円）,代表取締役社長／柳田　幸弘（ヤナギダ ユキヒロ）
株式会社松岡慶熹鋳造,1190001013345,"鉄鋼業,非鉄金属製造業",〒511-0839三重県桑名市安永533,0594223269（0594-22-3269）,10000（千円）,松岡　慶基（マツオカ ヨシキ）
株式会社堀田電装,1190001013717,一般機械器具製造業,〒511-0432三重県いなべ市北勢町東村312,0594725815（0594-72-5815）,3000（千円）,堀田　好則（ホツタ ヨシノリ）
中部産業株式会社,1190001013915,金属製品製造業,〒511-0102三重県桑名市多度町香取608,0594485310（0594-48-5310）,300（千円）,星山　智恵（ホシヤマ チエ）
株式会社サンテック,1190001014079,一般機械器具製造業,〒513-0825三重県鈴鹿市住吉町6810-2,0593706650（059-370-6650）,10000（千円）,立石　和夫（タテイシ カズオ）
井口製茶株式会社,1190001014260,食料品・飼料・飲料製造業,〒510-0034三重県四日市市滝川町12-9,0593315258（059-331-5258）,35000（千円）,井口　信之（イグチ ノブユキ）
五十鈴電業株式会社,1190001014277,電気機械器具製造業,〒510-8037三重県四日市市垂坂町98-2,0593319395（059-331-9395）,10000（千円）,代表取締役社長／黒坂　靖男（クロサカ ヤスオ）
株式会社内山製作所,1190001014401,金属製品製造業,〒510-0013三重県四日市市富士町8-8,0593316533（059-331-6533）,15000（千円）,柏木　孝則（カシワギ タカノリ）
株式会社エムイーピーコム四日市,1190001014467,その他の製造業,〒510-0871三重県四日市市川尻町1000,0593457555（059-345-7555）,300000（千円）,中田　道生（ナカタ ミチオ）
株式会社片岡製菓,1190001014574,食料品・飼料・飲料製造業,〒510-8121三重県三重郡川越町高松402,0593653732（059-365-3732）,10000（千円）,片岡　昇治（カタオカ シヨウジ）
株式会社草薙製作所,1190001014723,一般機械器具製造業,〒512-8064三重県四日市市伊坂町1633-10,0593632022（059-363-2022）,10000（千円）,草薙　剛（クサナギ タケシ）
呉山コルク工業株式会社,1190001014764,その他の製造業,〒510-0103三重県四日市市楠町北五味塚1972-127,0593972067（059-397-2067）,50000（千円）,呉山　世振（クレヤマ セジン）
株式会社ゴールド,1190001014814,衣服・その他の繊維製品製造業,〒512-1212三重県四日市市智積町288-1,0593266644（059-326-6644）,10000（千円）,水谷　弘海（ミズタニ ヒロミ）
坂口エイペック株式会社,1190001014888,金属製品製造業,〒510-0103三重県四日市市楠町北五味塚1439-1,0593973232（059-397-3232）,10000（千円）,坂口　晃則（サカグチ アキノリ）
株式会社後藤製作所,1190001014905,金属製品製造業,〒510-8103三重県三重郡朝日町柿122,0593772143（059-377-2143）,10000（千円）,後藤　久幸（ゴトウ ヒサユキ）
駒田研磨株式会社,1190001014938,金属製品製造業,〒510-8124三重県三重郡川越町南福崎82-1,0593653608（059-365-3608）,10000（千円）,駒田　一（コマダ ハジメ）
株式会社シンコー,1190001015102,窯業・土石製品製造業,〒510-0032三重県四日市市京町4-3,0593312727（059-331-2727）,30000（千円）,代表取締役社長／鈴木　規子（スズキ ノリコ）
株式会社成美電機,1190001015275,電気機械器具製造業,〒510-0802三重県四日市市三ツ谷町16-16,0593314234（059-331-4234）,10000（千円）,生川　浩一（ナルカワ コウイチ）
株式会社高橋鉄工所,1190001015449,一般機械器具製造業,〒510-8001三重県四日市市天カ須賀4-1-24,0593652551（059-365-2551）,10000（千円）,高橋　隆司（タカハシ タカシ）
カネカ中部スチロール株式会社,1190001015688,その他の製造業,〒510-0971三重県四日市市南小松町2681,0593282100（059-328-2100）,32400（千円）,青木　利廣（アオキ トシヒロ）
富山工業株式会社,1190001015721,金属製品製造業,〒510-0951三重県四日市市小古曽東2-5-46,0593461618（059-346-1618）,10000（千円）,代表取締役社長／富山　春樹（トミヤマ ハルキ）
畠山印刷株式会社,1190001015936,出版・印刷・同関連産業,〒510-0071三重県四日市市西浦2-13-20,0593512711（059-351-2711）,10000（千円）,畠山　純綱（ハタケヤマ スミツナ）
藤田ブロック工業株式会社,1190001016083,窯業・土石製品製造業,〒510-0874三重県四日市市河原田町1924,0593462392（059-346-2392）,12000（千円）,藤田　直人（フジタ ナオト）
株式会社藤政製陶所,1190001016091,窯業・土石製品製造業,〒510-0805三重県四日市市東阿倉川441,0593313980（059-331-3980）,10000（千円）,藤井　敬三（フジイ ケイゾウ）
平和コンクリート工業株式会社,1190001016141,窯業・土石製品製造業,〒510-0102三重県四日市市楠町吉崎1,0593973171（059-397-3171）,48000（千円）,代表取締役社長／南川　洋士雄（ミナミカワ ヨシオ）
三重化糧株式会社,1190001016380,食料品・飼料・飲料製造業,〒510-8121三重県三重郡川越町高松615,0593652231（059-365-2231）,84000（千円）,代表取締役社長／渡邉　滋（ワタナベ シゲル）
株式会社ミツル製作所,1190001016505,一般機械器具製造業,〒510-0104三重県四日市市楠町南五味塚653,0593973454（059-397-3454）,10000（千円）,坂倉　晴夫（サカクラ ハルオ）
株式会社山武食品,1190001016645,食料品・飼料・飲料製造業,〒510-8121三重県三重郡川越町高松138,0593646800（059-364-6800）,20000（千円）,代表取締役社長／大和田　勝子（オオワダ カツコ）
株式会社四日市菱光,1190001016744,窯業・土石製品製造業,〒510-0875三重県四日市市大治田3-5-40,0593451305（059-345-1305）,10000（千円）,中澤　秀之（ナカザワ ヒデユキ）
