会社名,法人番号,業種,住所,電話番号,資本金,代表氏名
三栄林産株式会社,3190001003410,木材・木製品製造業（家具を除く）,〒519-1127三重県亀山市加太中在家8032-1,0595980114（0595-98-0114）,10000（千円）,坂　英哉（サカ ヒデヤ）
村山キャンドル株式会社,3190001003518,化学工業,〒519-0166三重県亀山市布気町480-9,0595823218（0595-82-3218）,10000（千円）,村山　太郎（ムラヤマ タロウ）
尾鷲物産株式会社,3190001004391,食料品・飼料・飲料製造業,〒519-3612三重県尾鷲市林町1-33,0597222323（0597-22-2323）,65000（千円）,代表取締役社長／小野　博行（オノ ヒロユキ）
田中木材工業株式会社,3190001004433,木材・木製品製造業（家具を除く）,〒519-3614三重県尾鷲市南陽町6-4,0597220861（0597-22-0861）,10000（千円）,田中　聰臣（タナカ サトオミ）
佐太屋株式会社,3190001004508,食料品・飼料・飲料製造業,〒519-3204三重県北牟婁郡紀北町東長島2646-3,0597475050（0597-47-5050）,10000（千円）,東　道教（ヒガシ ミチノリ）
株式会社Ｉ．ｅｓｔ,3190001004689,電気機械器具製造業,〒514-2313三重県津市安濃町今徳807-2,0592685544（059-268-5544）,5000（千円）,岩出　充功（イワデ ミチノリ）
株式会社アキラック,3190001004722,金属製品製造業,〒519-0134三重県亀山市中庄町715-1,0595968571（0595-96-8571）,3000（千円）,豊田　祥（トヨダ アキラ）
ウエストレーシングカーズ株式会社,3190001004846,輸送用機械器具製造業,〒513-0825三重県鈴鹿市住吉町5769-8,0593790939（059-379-0939）,10000（千円）,川北　弘毅（カワキタ ヒロキ）
株式会社オコシ型紙商店,3190001004879,"繊維工業（衣服,その他の繊維製品を除く）",〒510-0234三重県鈴鹿市江島本町27-25,0593860229（059-386-0229）,10000（千円）,起　正明（オコシ マサアキ）
サンレイ工業株式会社,3190001005035,輸送用機械器具製造業,〒513-0824三重県鈴鹿市道伯町1890-3,0593781604（059-378-1604）,10000（千円）,藤田　薫（フジタ カオル）
清水金属株式会社,3190001005051,一般機械器具製造業,〒510-0233三重県鈴鹿市東江島町27-15,0593881234（059-388-1234）,10000（千円）,清水　鑛治（シミズ コウジ）
すずかプラスチック株式会社,3190001005126,その他の製造業,〒510-0227三重県鈴鹿市南若松町718,"",10000（千円）,伊藤　邦彦（イトウ クニヒコ）
株式会社高井工業所,3190001005183,輸送用機械器具製造業,〒510-0204三重県鈴鹿市稲生西3-2-35,0593861349（059-386-1349）,10000（千円）,高井　正三（タカイ シヨウゾウ）
東海釀造株式会社,3190001005241,食料品・飼料・飲料製造業,〒513-0815三重県鈴鹿市西玉垣町1454,0593820001（059-382-0001）,10000（千円）,儀賀　君子（ギカ キミコ）
株式会社マルタシェルサービス,3190001005398,窯業・土石製品製造業,〒513-0031三重県鈴鹿市一ノ宮町1156-1,0593841181（059-384-1181）,10000（千円）,代表取締役社長／田代　孝之（タシロ タカユキ）
株式会社マザキナ,3190001005811,金属製品製造業,〒513-0836三重県鈴鹿市国府町1098-4,0593792727（059-379-2727）,10000（千円）,代表取締役社長／眞境名　由昌（マジキナ ヨシマサ）
株式会社早川精機,3190001005852,一般機械器具製造業,〒513-0823三重県鈴鹿市道伯3-9-19,0593781575（059-378-1575）,3000（千円）,早川　忠一（ハヤカワ チユウイチ）
株式会社バトルファクトリー,3190001005943,輸送用機械器具製造業,〒513-0824三重県鈴鹿市道伯町2147-47,0593700851（059-370-0851）,3000（千円）,永友　正（ナガトモ タダシ）
株式会社辻プロテック工業,3190001006149,金属製品製造業,〒519-0272三重県鈴鹿市東庄内町3905,0593713133（059-371-3133）,10000（千円）,代表取締役社長／辻　昌実（ツジ マサミ）
アルファ電子株式会社,3190001006396,その他の製造業,〒515-0507三重県伊勢市村松町4098-1,0596377300（0596-37-7300）,10000（千円）,代表取締役社長／岡崎　芳隆（オカザキ ヨシタカ）
株式会社アイエスイー,3190001006405,電気機械器具製造業,〒516-0802三重県伊勢市御薗町新開80大西ビル301号,0596363805（0596-36-3805）,10000（千円）,高橋　勲（タカハシ イサオ）
伊勢ガクブチ株式会社,3190001006446,家具・装備品製造業,〒516-0051三重県伊勢市上地町2691-43,0596222789（0596-22-2789）,10000（千円）,代表取締役社長／角谷　英之（カドヤ ヒデユキ）
平本樹脂工業株式会社,3190001006495,その他の製造業,〒519-0505三重県伊勢市小俣町本町270,0596222128（0596-22-2128）,10000（千円）,平本　敬雄（ヒラモト ノリオ）
株式会社浦九,3190001006504,食料品・飼料・飲料製造業,〒519-0506三重県伊勢市小俣町湯田198-1,0596281234（0596-28-1234）,10000（千円）,浦田　穰（ウラタ ユタカ）
高洋電機株式会社,3190001006636,一般機械器具製造業,〒519-0412三重県度会郡玉城町中楽639-1,0596582121（0596-58-2121）,50000（千円）,高祖　昭夫（コウソ アキオ）
虎屋ういろ株式会社,3190001006826,食料品・飼料・飲料製造業,〒516-0072三重県伊勢市宮後2-2-8,0596235005（0596-23-5005）,30000（千円）,代表取締役社長／吉高　亨（ヨシタカ トオル）
ナカガワインテリア産業株式会社,3190001006834,衣服・その他の繊維製品製造業,〒519-0504三重県伊勢市小俣町宮前3,0596255723（0596-25-5723）,10000（千円）,代表取締役社長／中川　健（ナカガワ タケシ）
株式会社メディックス,3190001006933,電気機械器具製造業,〒516-0001三重県伊勢市大湊町1125-57,0596311188（0596-31-1188）,10000（千円）,橋本　敏男（ハシモト トシオ）
株式会社松井鉄工所,3190001006990,輸送用機械器具製造業,〒516-0005三重県伊勢市竹ケ鼻町70,0596362222（0596-36-2222）,90000（千円）,代表取締役社長／松井　敏文（マツイ トシフミ）
株式会社宮忠,3190001007048,家具・装備品製造業,〒516-0036三重県伊勢市岡本1-2-38,0596240128（0596-24-0128）,10000（千円）,川西　治正（カワニシ ハルマサ）
株式会社大阪シェル,3190001007345,一般機械器具製造業,〒517-0042三重県鳥羽市松尾町990,0599265672（0599-26-5672）,70000（千円）,榎本　卓嗣（エノモト タクジ）
株式会社ミヤハマワークス,3190001007428,一般機械器具製造業,〒517-0021三重県鳥羽市安楽島町194-23,0599255085（0599-25-5085）,20000（千円）,宮濱　克行（ミヤハマ カツユキ）
株式会社ゴーリキアイランド,3190001007568,家具・装備品製造業,〒516-0021三重県伊勢市朝熊町3477-35,0596211155（0596-21-1155）,3000（千円）,強力　海（ゴウリキ カイ）
株式会社濱田カンパニー,3190001007584,パルプ・紙・紙加工品製造業,〒519-0501三重県伊勢市小俣町明野576-16,0596380811（0596-38-0811）,3340（千円）,濱田　典保（ハマダ ノリヤス）
株式会社ホーペック,3190001007626,その他の製造業,〒519-0501三重県伊勢市小俣町明野296-2,0596377101（0596-37-7101）,10000（千円）,代表取締役社長／濱口　隼人（ハマグチ ハヤト）
株式会社かくなか,3190001007980,食料品・飼料・飲料製造業,〒517-0507三重県志摩市阿児町安乗1265,0599474111（0599-47-4111）,10000（千円）,迫間　泰清（ハザマ ヤスキヨ）
エステートケミカル株式会社,3190001008401,化学工業,〒518-0131三重県伊賀市ゆめが丘7-6-16,0595215555（0595-21-5555）,45500（千円）,代表取締役社長／鴻池　直弘（コウノイケ ナオヒロ）
廣嶋建材株式会社,3190001008624,窯業・土石製品製造業,〒518-0013三重県伊賀市東条婦之鳥208-1,0595213936（0595-21-3936）,10000（千円）,廣嶋　伸二（ヒロシマ シンジ）
株式会社福井酒造場,3190001008640,食料品・飼料・飲料製造業,〒518-0105三重県伊賀市比自岐595,0595370026（0595-37-0026）,10000（千円）,福井　寿仁（フクイ トシヒト）
株式会社モリタ,3190001008731,金属製品製造業,〒518-0001三重県伊賀市佐那具町金神塚1700-2,0595218751（0595-21-8751）,50000（千円）,代表取締役社長／音頭　宏紀（オンドウ ヒロノリ）
上野キヤノンマテリアル株式会社,3190001008814,化学工業,〒518-0022三重県伊賀市三田東大町410-7,0595243111（0595-24-3111）,80000（千円）,代表取締役社長／田中　誠（タナカ マコト）
モリテックプロダクトサポート株式会社,3190001008822,輸送用機械器具製造業,〒518-1403三重県伊賀市炊村大平2330-2,0595471103（0595-47-1103）,10000（千円）,松下　善紀（マツシタ ヨシノリ）
株式会社福岡醤油店,3190001008847,食料品・飼料・飲料製造業,〒519-1711三重県伊賀市島ヶ原1330,0595593121（0595-59-3121）,10000（千円）,川向　啓造（カワムカイ ケイゾウ）
藤澤建機株式会社,3190001008954,金属製品製造業,〒519-1412三重県伊賀市下柘植697,0595453280（0595-45-3280）,50000（千円）,代表取締役社長／藤澤　久文（フジサワ ヒサフミ）
株式会社伊賀産業,3190001008970,その他の製造業,〒518-1301三重県伊賀市西湯舟2346,0595431066（0595-43-1066）,10000（千円）,澤村　健司（サワムラ ケンジ）
塚脇紙工株式会社,3190001008987,パルプ・紙・紙加工品製造業,〒518-1325三重県伊賀市丸柱1379,0595441104（0595-44-1104）,10000（千円）,塚脇　兼光（ツカワキ カネミツ）
株式会社エス・ディー・アイ,3190001009267,金属製品製造業,〒518-0034三重県伊賀市大内中切1969,0595217778（0595-21-7778）,3000（千円）,丸林　浩（マルバヤシ ヒロシ）
株式会社森嶋食品工業所,3190001009531,食料品・飼料・飲料製造業,〒518-0467三重県名張市赤目町相楽10,0595631067（0595-63-1067）,10000（千円）,森嶋　茂弘（モリシマ シゲヒロ）
恒徳化成工業株式会社,3190001009572,その他の製造業,〒518-0411三重県名張市滝之原3549-1,0595685036（0595-68-5036）,10000（千円）,森山　勝弘（モリヤマ カツヒロ）
株式会社ファインデンタル,3190001009647,精密機械・医療機械器具製造業,〒518-0602三重県名張市東田原2743,0595656000（0595-65-6000）,17000（千円）,岡本　一男（オカモト カズオ）
日合通信電線株式会社,3190001009928,"鉄鋼業,非鉄金属製造業",〒518-0855三重県伊賀市上野万町2175-1,0595247531（0595-24-7531）,20000（千円）,代表取締役社長／細川　周作（ホソカワ シユウサク）
株式会社一志工業所,3190001009977,輸送用機械器具製造業,〒515-2501三重県津市一志町庄村708-1,0592931331（059-293-1331）,5000（千円）,片山　幹生（カタヤマ ミキオ）
五和産業株式会社,3190001010101,精密機械・医療機械器具製造業,〒515-0841三重県松阪市曲町西沖874,0598235322（0598-23-5322）,10000（千円）,高瀬　俊英（タカセ トシヒデ）
株式会社オオコーチ,3190001010134,木材・木製品製造業（家具を除く）,〒515-0063三重県松阪市大黒田町472,0598261551（0598-26-1551）,90000（千円）,代表取締役社長／黄瀬　稔（キセ ミノル）
第一電子株式会社,3190001010324,一般機械器具製造業,〒515-0005三重県松阪市鎌田町1139,0598212018（0598-21-2018）,10000（千円）,小濱　利雄（コハマ トシオ）
松阪興産株式会社,3190001010555,窯業・土石製品製造業,〒515-0005三重県松阪市鎌田町253-5,0598510211（0598-51-0211）,100000（千円）,代表取締役社長／中川　治（ナカガワ オサム）
株式会社ＮＴＮ三雲製作所,3190001010761,一般機械器具製造業,〒515-2109三重県松阪市小野江町750-1,0598563311（0598-56-3311）,450000（千円）,矢野　彰彦（ヤノ アキヒコ）
株式会社マルハ昆布,3190001010852,食料品・飼料・飲料製造業,〒515-0302三重県多気郡明和町大淀2698,0596552155（0596-55-2155）,10000（千円）,堀出　明広（ホリデ アキヒロ）
丸一化成工業株式会社,3190001010902,ゴム製品製造業,〒519-2212三重県多気郡多気町色太947-9,0598492205（0598-49-2205）,10000（千円）,大西　雅伸（オオニシ マサノブ）
株式会社サンブライトロン,3190001011017,電気機械器具製造業,〒515-0001三重県松阪市大口町381-2,0598503050（0598-50-3050）,10000（千円）,野田　政仁（ノダ マサヒト）
株式会社上田ゴム工業,3190001011446,ゴム製品製造業,〒515-0052三重県松阪市山室町1162-1,0598295622（0598-29-5622）,3000（千円）,上田　智之（ウエダ トモユキ）
株式会社イイテック,3190001011479,その他の製造業,〒515-1304三重県松阪市飯南町上仁柿1641,0598327080（0598-32-7080）,3000（千円）,長谷川　哲（ハセガワ トオル）
茶来まつさか株式会社,3190001011520,食料品・飼料・飲料製造業,〒515-1411三重県松阪市飯南町粥見3860-2,0598322201（0598-32-2201）,3000（千円）,中村　吉勝（ナカムラ ヨシカツ）
株式会社ＭＦＴ,3190001011611,窯業・土石製品製造業,〒515-0352三重県多気郡明和町八木戸1011,0596558515（0596-55-8515）,3000（千円）,西山　裕司（ニシヤマ ヒロシ）
株式会社阪内木材,3190001011859,木材・木製品製造業（家具を除く）,〒515-1107三重県松阪市阪内町492,0598360443（0598-36-0443）,8000（千円）,前川　和哉（マエガワ カズヤ）
井村屋株式会社,3190001011891,食料品・飼料・飲料製造業,〒514-0819三重県津市高茶屋7-1-1,0592342131（059-234-2131）,100000（千円）,代表取締役社長／前山　健（マエヤマ タケシ）
株式会社エッチ・エム・イー,3190001012064,金属製品製造業,〒511-0854三重県桑名市蓮花寺惣作425-1,0594217850（0594-21-7850）,10000（千円）,服部　一彌（ハツトリ カズヤ）
株式会社加藤鉄工所,3190001012106,一般機械器具製造業,〒511-0851三重県桑名市西別所253,0594214588（0594-21-4588）,10000（千円）,加藤　陽一（カトウ ヨウイチ）
桑名工業株式会社,3190001012163,窯業・土石製品製造業,〒511-0001三重県桑名市上之輪新田335,0594220332（0594-22-0332）,10000（千円）,杉山　保（スギヤマ タモツ）
ゴトーケミカル株式会社,3190001012205,その他の製造業,〒511-0836三重県桑名市江場787,0594225681（0594-22-5681）,10000（千円）,代表取締役社長／後藤　弘樹（ゴトウ ヒロキ）
サンコー・トーカイ株式会社,3190001012254,金属製品製造業,〒511-0946三重県桑名市五反田1954-1,0594325555（0594-32-5555）,10000（千円）,種村　一弘（タネムラ カズヒロ）
中央石油化学工業株式会社,3190001012386,化学工業,〒511-0943三重県桑名市森忠1810-3,0594311788（0594-31-1788）,10000（千円）,近藤　好英（コンドウ タカヒデ）
ヤマモリ株式会社,3190001012691,食料品・飼料・飲料製造業,〒511-0867三重県桑名市陽だまりの丘6-103,0594333860（0594-33-3860）,435000（千円）,代表取締役社長／三林　憲忠（ミツバヤシ ノリタダ）
株式会社山盛堂本舗,3190001012733,食料品・飼料・飲料製造業,〒511-0102三重県桑名市多度町香取488-1,0594482612（0594-48-2612）,40000（千円）,益山　繁春（マスヤマ シゲハル）
多度電装株式会社,3190001012741,電気機械器具製造業,〒511-0117三重県桑名市多度町下野代974,0594482665（0594-48-2665）,10000（千円）,代表取締役社長／高井　博文（タカイ ヒロフミ）
株式会社ヨウダイ,3190001012824,金属製品製造業,〒511-1113三重県桑名市長島町押付453,0594422114（0594-42-2114）,10000（千円）,菊地　久（キクチ ヒサシ）
三重重工業株式会社,3190001012931,金属製品製造業,〒511-0251三重県員弁郡東員町山田北前塚3710,0594767511（0594-76-7511）,95000（千円）,代表取締役社長／窪　道徳（クボ ミチノリ）
株式会社奥岡工業所,3190001012956,金属製品製造業,〒511-0201三重県いなべ市員弁町市之原894,0594742114（0594-74-2114）,10000（千円）,奥岡　敦史（オクオカ アツシ）
株式会社サンコーパッケージング,3190001013005,パルプ・紙・紙加工品製造業,〒511-0274三重県いなべ市大安町大井田2160-7,0594770959（0594-77-0959）,10000（千円）,伊藤　嘉章（イトウ ヨシアキ）
株式会社メイリン,3190001013038,出版・印刷・同関連産業,〒511-0283三重県いなべ市大安町南金井1697-3,0594771865（0594-77-1865）,10000（千円）,箕浦　靖夫（ミノウラ ヤスオ）
北勢レミコン株式会社,3190001013087,窯業・土石製品製造業,〒511-0428三重県いなべ市北勢町阿下喜3436,0594727470（0594-72-7470）,20000（千円）,出口　克也（デグチ カツヤ）
株式会社三工製作所,3190001013104,電気機械器具製造業,〒511-0504三重県いなべ市藤原町川合725,0594463461（0594-46-3461）,10000（千円）,三輪　和弘（ミワ カズヒロ）
株式会社岡ポリエチレン製袋所,3190001013285,その他の製造業,〒511-0077三重県桑名市末広町19,0594230296（0594-23-0296）,10000（千円）,柳川　雅代（ヤナガワ マサヨ）
株式会社木下,3190001013351,"鉄鋼業,非鉄金属製造業",〒511-0839三重県桑名市安永970-2,0594214088（0594-21-4088）,10000（千円）,木下　和夫（キノシタ カズオ）
株式会社伊藤英男鉄工所,3190001013483,一般機械器具製造業,〒511-0912三重県桑名市星川2350,0594315158（0594-31-5158）,5000（千円）,代表取締役社長／伊藤　國和（イトウ クニカズ）
冨松マシンツール株式会社,3190001013797,一般機械器具製造業,〒511-0254三重県員弁郡東員町中上413,0594860606（0594-86-0606）,10000（千円）,冨松　健二（トミマツ ケンジ）
朝明精工株式会社,3190001014184,一般機械器具製造業,〒510-8122三重県三重郡川越町豊田1042-3,0593643131（059-364-3131）,48000（千円）,代表取締役社長／廣田　正雄（ヒロタ マサオ）
株式会社アゼックス,3190001014192,化学工業,〒510-0961三重県四日市市波木町1097-38,0593217000（059-321-7000）,10000（千円）,加藤　真彦（カトウ マサヒコ）
内田鍛工株式会社,3190001014399,電気機械器具製造業,〒512-8062三重県四日市市黄金町58,0593631213（059-363-1213）,99000（千円）,代表取締役社長／内田　洋一郎（ウチダ ヨウイチロウ）
小川調味料株式会社,3190001014523,食料品・飼料・飲料製造業,〒512-0911三重県四日市市生桑町545,0593322111（059-332-2111）,20000（千円）,小川　敏夫（オガワ トシオ）
株式会社グレーズフジサワ,3190001014738,窯業・土石製品製造業,〒512-0913三重県四日市市西坂部町2501-2,0593328923（059-332-8923）,10000（千円）,藤沢　正宏（フジサワ マサヒロ）
軽金属押出開発株式会社,3190001014770,"鉄鋼業,非鉄金属製造業",〒510-0951三重県四日市市小古曽東2-2-2,0593454228（059-345-4228）,980000（千円）,代表取締役社長／畑中　孝一（ハタナカ コウイチ）
株式会社サイトウ工研,3190001014853,一般機械器具製造業,〒512-1113三重県四日市市鹿間町1100,0593281818（059-328-1818）,32000（千円）,代表取締役社長／齊藤　浩一（サイトウ コウイチ）
スズカファイン株式会社,3190001015240,化学工業,〒510-0101三重県四日市市楠町小倉1058-4,0593976111（059-397-6111）,412340（千円）,代表取締役社長／福井　正郎（フクイ マサオ）
太陽化学株式会社,3190001015397,食料品・飼料・飲料製造業,〒512-1111三重県四日市市山田町800,0593400800（059-340-0800）,7730621（千円）,代表取締役社長／山崎　長宏（ヤマザキ ナガヒロ）
日陶ジルコン工業株式会社,3190001015851,化学工業,〒510-0008三重県四日市市南いかるが町6-3,0593315231（059-331-5231）,10000（千円）,代表取締役社長／林　朋治（ハヤシ トモハル）
日本テクノ環境株式会社,3190001015892,一般機械器具製造業,〒512-8064三重県四日市市伊坂町1636-9,0593636767（059-363-6767）,10000（千円）,藤谷　祐太郎（フジタニ ユウタロウ）
ヒロセタオル株式会社,3190001016016,"繊維工業（衣服,その他の繊維製品を除く）",〒510-8021三重県四日市市松寺3-2-26,0593653191（059-365-3191）,10000（千円）,廣瀬　浩之（ヒロセ ヒロユキ）
平松産業株式会社,3190001016024,パルプ・紙・紙加工品製造業,〒510-0863三重県四日市市塩浜2823-1,0593452341（059-345-2341）,10000（千円）,平松　俊範（ヒラマツ トシノリ）
株式会社三重富士,3190001016429,電気機械器具製造業,〒510-0013三重県四日市市富士町1-27,0593301616（059-330-1616）,40000（千円）,代表取締役社長／柴崎　達雄（シバサキ タツオ）
株式会社いとめん本店,3190001017179,食料品・飼料・飲料製造業,〒510-0832三重県四日市市伊倉2-9-7,0593515388（059-351-5388）,10000（千円）,江口　充男（エグチ ミツオ）
東和レミコン株式会社,3190001017294,窯業・土石製品製造業,〒512-0906三重県四日市市山之一色町1528-1,0593363851（059-336-3851）,20000（千円）,山口　国輝（ヤマグチ クニテル）
株式会社東洋テックス,3190001017451,木材・木製品製造業（家具を除く）,〒510-1326三重県三重郡菰野町杉谷2286,0593961511（059-396-1511）,98000（千円）,代表取締役社長／服部　俊樹（ハツトリ トシキ）
株式会社テクノクリエート,3190001017815,その他の製造業,〒512-8061三重県四日市市広永町蓮池29-1,0593658711（059-365-8711）,6000（千円）,左口　仁（サグチ ヒトシ）
リョウテック株式会社,3190001019415,一般機械器具製造業,〒511-0002三重県桑名市福島753-2,0594229500（0594-22-9500）,10000（千円）,水谷　紀夫（ミズタニ ノリオ）
株式会社伊松,3190001019431,輸送用機械器具製造業,〒515-0102三重県松阪市松名瀬町584,0598591181（0598-59-1181）,1000（千円）,中川　将克（ナカガワ マサカツ）
株式会社吉川製作所,3190001019563,電気機械器具製造業,〒518-0809三重県伊賀市西明寺2787-1,0595213205（0595-21-3205）,10000（千円）,吉川　重信（ヨシカワ シゲノブ）
株式会社なかよし,3190001019794,その他の製造業,〒515-0315三重県多気郡明和町蓑村1168,0596525281（0596-52-5281）,8000（千円）,代表取締役社長／林　雅哉（ハヤシ マサヤ）
株式会社橋本屋徳兵衛,3190001019860,食料品・飼料・飲料製造業,〒515-2133三重県松阪市松ケ島町219,0598515010（0598-51-5010）,5000（千円）,前田　正志（マエダ マサシ）
株式会社伊賀の里モクモク手づくりファーム,3190001019877,食料品・飼料・飲料製造業,〒518-1301三重県伊賀市西湯舟3609,0595430909（0595-43-0909）,38000（千円）,代表取締役社長／松尾　尚之（マツオ ナオユキ）
松阪フーズ株式会社,3190001019935,食料品・飼料・飲料製造業,〒519-2157三重県多気郡多気町五佐奈640,0598372396（0598-37-2396）,500（千円）,村田　幸一（ムラタ ユキカズ）
エムティーＴＥＣ株式会社,3190001020892,その他の製造業,〒518-1146三重県伊賀市湯屋谷344,0595517387（0595-51-7387）,150（千円）,谷本　整史（タニモト タダシ）
株式会社勇伸,3190001021932,金属製品製造業,〒515-2334三重県松阪市嬉野黒野町1236-2,0598421737（0598-42-1737）,1000（千円）,水谷　伸也（ミズタニ シンヤ）
株式会社スズカベース,3190001022220,一般機械器具製造業,〒513-0006三重県鈴鹿市和泉町787-2,0593735343（059-373-5343）,1000（千円）,箱守　勲夫（ハコモリ イサオ）
其原工業株式会社,3190001023160,金属製品製造業,〒511-0426三重県いなべ市北勢町其原759,0594727783（0594-72-7783）,3000（千円）,瀬木　重治（セギ シゲハル）
松阪ハム株式会社,3190001024423,食料品・飼料・飲料製造業,〒514-0131三重県津市あのつ台1-6-5,0592361186（059-236-1186）,100000（千円）,西井　克昌（ニシイ カツマサ）
株式会社ナカムラ,3190001026171,窯業・土石製品製造業,〒512-8044三重県四日市市中村町2293-8,0593630222（059-363-0222）,10000（千円）,福原　啓（フクハラ サトル）
彩登有限会社,3190002000349,その他の製造業,〒514-0101三重県津市白塚町1732,0592313977（059-231-3977）,3000（千円）,豊田　知代（トヨダ トモヨ）
