会社名,法人番号,業種,住所,電話番号,資本金,代表氏名
有限会社鈴木紙器,3480002010541,パルプ・紙・紙加工品製造業,〒772-0032徳島県鳴門市大津町吉永451,0886851284（088-685-1284）,5000（千円）,鈴木　義則（スズキ ヨシノリ）
有限会社林縫製所,3480002010665,衣服・その他の繊維製品製造業,〒772-0001徳島県鳴門市撫養町黒崎清水72,0886853367（088-685-3367）,3000（千円）,林　喜一（ハヤシ キイチ）
有限会社吉田清一郎商店,3480002010995,食料品・飼料・飲料製造業,〒772-0021徳島県鳴門市里浦町里浦坂田410-1,0886862039（088-686-2039）,3000（千円）,吉田　誠（ヨシダ マコト）
有限会社島製作所,3480002011176,一般機械器具製造業,〒771-0213徳島県板野郡松茂町豊久豊久開拓500-7,0886996366（088-699-6366）,30000（千円）,島　勝美（シマ カツミ）
有限会社ティ・エムセッケイ,3480002011234,一般機械器具製造業,〒771-1230徳島県板野郡藍住町富吉中新田23-4,0886928004（088-692-8004）,9000（千円）,田村　秀樹（タムラ ヒデキ）
ハロンニット有限会社,3480002011655,衣服・その他の繊維製品製造業,〒771-1201徳島県板野郡藍住町奥野乾130-6,0886923227（088-692-3227）,3000（千円）,高橋　博文（タカハシ ヒロフミ）
有限会社浜口製作所,3480002011903,"鉄鋼業,非鉄金属製造業",〒771-1320徳島県板野郡上板町神宅芝生44,0886942393（088-694-2393）,3000（千円）,濱口　裕史（ハマグチ ヒロフミ）
有限会社浅木木材産業,3480002012653,木材・木製品製造業（家具を除く）,〒779-1106徳島県阿南市羽ノ浦町岩脇姥ケ原82-5,0884442431（0884-44-2431）,5000（千円）,浅木　芳孝（アサキ ヨシタカ）
有限会社白浜食糧工業所,3480002013123,食料品・飼料・飲料製造業,〒774-0005徳島県阿南市向原町天羽畭58-1,0884220077（0884-22-0077）,10000（千円）,白浜　昇（シラハマ ノボル）
有限会社鳳凰機械工業,3480002013627,金属製品製造業,〒779-1510徳島県阿南市新野町藤谷11-1,0884216510（0884-21-6510）,15000（千円）,代表取締役社長／横手　久典（ヨコテ ヒサノリ）
有限会社橋口生コン,3480002014253,窯業・土石製品製造業,〒779-2305徳島県海部郡美波町奥河内弁財天7-5,0884771177（0884-77-1177）,7000（千円）,橋口　資生（ハシグチ モトオ）
あづまや製菓有限会社,3480002014526,食料品・飼料・飲料製造業,〒779-4101徳島県美馬郡つるぎ町貞光町40,0883622105（0883-62-2105）,3000（千円）,永井　忠重（ナガイ タダシゲ）
有限会社北室白扇,3480002014674,食料品・飼料・飲料製造業,〒779-4401徳島県美馬郡つるぎ町半田松生108-5,0883643234（0883-64-3234）,5000（千円）,北室　サキ（キタムロ サキ）
有限会社木下木材商店,3480002014682,木材・木製品製造業（家具を除く）,〒779-3620徳島県美馬市脇町別所3513-4,0883538606（0883-53-8606）,5000（千円）,木下　尊生（キノシタ タカオ）
有限会社竹田製粉製麺工場,3480002014831,食料品・飼料・飲料製造業,〒779-4401徳島県美馬郡つるぎ町半田天皇144-1,0883642020（0883-64-2020）,15000（千円）,代表取締役社長／竹田　厚美（タケダ アツミ）
有限会社ふじ,3480002015012,食料品・飼料・飲料製造業,〒779-4401徳島県美馬郡つるぎ町半田中薮149-1,0883642371（0883-64-2371）,3000（千円）,藤　光（フジ ヒカル）
有限会社小川食品,3480002015409,食料品・飼料・飲料製造業,〒779-5161徳島県三好市池田町中西ナガタ57-1,0883740957（0883-74-0957）,5000（千円）,小川　達久（オガワ タツヒサ）
協業組合徳島印刷センター,3480005000655,出版・印刷・同関連産業,〒770-8056徳島県徳島市問屋町165,0886250135（088-625-0135）,20000（千円）,代表理事／多田　哲也（タダ テツヤ）
徳島県廃プラスチック処理協同組合,3480005004177,その他の製造業,〒774-0048徳島県阿南市中大野町南傍示441-1,0884231739（0884-23-1739）,10000（千円）,葉狩　浩（ハガリ ヒロシ）
池田印刷株式会社,4480001000187,出版・印刷・同関連産業,〒770-0923徳島県徳島市大道1-45-1,0886229158（088-622-9158）,11200（千円）,池田　浩（イケダ ヒロシ）
株式会社高砂家具,4480001000996,家具・装備品製造業,〒770-0873徳島県徳島市東沖洲1-3-4,0886646010（088-664-6010）,10000（千円）,戸川　裕之（トガワ ヒロユキ）
株式会社たにがわ,4480001001045,食料品・飼料・飲料製造業,〒779-3120徳島県徳島市国府町南岩延790,0886421811（088-642-1811）,10000（千円）,谷川　裕明（タニガワ ヒロアキ）
株式会社島本家具工芸,4480001001128,家具・装備品製造業,〒770-0873徳島県徳島市東沖洲1-5-8,0886646006（088-664-6006）,10000（千円）,島本　康宏（シマモト ヤスヒロ）
船場化成株式会社,4480001001268,その他の製造業,〒779-3123徳島県徳島市国府町観音寺梨子ノ木666-1,0886421414（088-642-1414）,50000（千円）,美馬　直秀（ミマ ナオヒデ）
株式会社寺内製作所,4480001001350,一般機械器具製造業,〒770-0062徳島県徳島市不動東町5-741-2,0886310011（088-631-0011）,10000（千円）,寺内　靖之（テラウチ ノブユキ）
日進精工株式会社,4480001001672,一般機械器具製造業,〒770-0053徳島県徳島市南島田町4-64,0886316534（088-631-6534）,10000（千円）,吉岡　正司（ヨシオカ シヨウジ）
株式会社東洋バルブ製造所,4480001001796,一般機械器具製造業,〒779-0104徳島県板野郡板野町吹田西山2-2-1,0886722111（088-672-2111）,10000（千円）,代表取締役社長／井内　啓二（イノウチ ケイジ）
株式会社布川製作所,4480001001994,家具・装備品製造業,〒770-0873徳島県徳島市東沖洲2-5,0886646300（088-664-6300）,140000（千円）,代表取締役社長／布川　毅（フカワ ツヨシ）
株式会社藤川製作所,4480001002027,その他の製造業,〒770-0064徳島県徳島市不動西町1-654,0886310256（088-631-0256）,10000（千円）,藤川　正也（フジカワ マサヤ）
株式会社松浦機械製作所,4480001002282,一般機械器具製造業,〒770-0004徳島県徳島市南田宮2-5-62,0886321056（088-632-1056）,20000（千円）,松浦　良彦（マツウラ ヨシヒコ）
株式会社丸福味噌本舗,4480001002290,食料品・飼料・飲料製造業,〒770-0064徳島県徳島市不動西町4-2170,0886310207（088-631-0207）,10000（千円）,福永　徳（フクナガ メグミ）
マルヨシ食品株式会社,4480001002324,食料品・飼料・飲料製造業,〒771-1154徳島県徳島市応神町東貞方貞光251-1,0886410475（088-641-0475）,10000（千円）,廣永　正志（ヒロナガ マサシ）
山清金属株式会社,4480001002407,金属製品製造業,〒770-0064徳島県徳島市不動西町1-379-1,0886316096（088-631-6096）,10000（千円）,代表取締役社長／山下　昭（ヤマシタ アキラ）
みの電子パーツ株式会社,4480001002472,電気機械器具製造業,〒770-0804徳島県徳島市中吉野町2-18-2,0886555958（088-655-5958）,10000（千円）,見野　幸一（ミノ コウイチ）
丸井産業株式会社,4480001002596,食料品・飼料・飲料製造業,〒779-3222徳島県名西郡石井町高川原天神337-3,0886742503（088-674-2503）,10000（千円）,井内　運久（イウチ カズヒサ）
株式会社井河鉄工所,4480001003355,一般機械器具製造業,〒773-0009徳島県小松島市芝生町内開38,0885320989（0885-32-0989）,20000（千円）,代表取締役社長／井河　輝美（イカワ テルミ）
エヌ・アンド・イー株式会社,4480001003363,パルプ・紙・紙加工品製造業,〒773-0020徳島県小松島市和田津開町北395-6日本製紙小松島工場内,0885371153（0885-37-1153）,3750000（千円）,代表取締役社長／渡邉　峰男（ワタナベ ミネオ）
正幸食品株式会社,4480001003438,食料品・飼料・飲料製造業,〒773-0014徳島県小松島市江田町敷地前120-1,0886694266（088-669-4266）,10000（千円）,雑賀　正彦（サイカ マサヒコ）
株式会社國光精機,4480001003735,一般機械器具製造業,〒770-0053徳島県徳島市南島田町3-8-6,0886317317（088-631-7317）,10000（千円）,石田　政良（イシダ マサヨシ）
阿波スピンドル株式会社,4480001004428,一般機械器具製造業,〒779-3402徳島県吉野川市山川町天神80,0883424121（0883-42-4121）,48000（千円）,代表取締役社長／木村　雅彦（キムラ マサヒコ）
河野産業株式会社,4480001004460,食料品・飼料・飲料製造業,〒776-0001徳島県吉野川市鴨島町牛島1259-1,0883241269（0883-24-1269）,10000（千円）,代表取締役社長／河野　晴美（カワノ ハルミ）
株式会社清和エレクトロニクス,4480001004493,その他の製造業,〒779-3407徳島県吉野川市山川町麦原340-1,0883422301（0883-42-2301）,10000（千円）,松村　秀生（マツムラ ヒデオ）
多田印刷株式会社,4480001004502,出版・印刷・同関連産業,〒776-0010徳島県吉野川市鴨島町鴨島657-10,0883242595（0883-24-2595）,12000（千円）,多田　徹（タダ トオル）
日本フネン株式会社,4480001004519,金属製品製造業,〒779-3307徳島県吉野川市川島町三ツ島新田179-1,0883254660（0883-25-4660）,314000（千円）,代表取締役社長／久米　徳男（クメ トクオ）
マルフク食品工業株式会社,4480001004551,食料品・飼料・飲料製造業,〒776-0014徳島県吉野川市鴨島町知恵島1436,0883242575（0883-24-2575）,10000（千円）,麻植　利治（オエ トシハル）
株式会社ヨコタコーポレーション,4480001004568,一般機械器具製造業,〒779-3306徳島県吉野川市川島町学辻4-2,0883252121（0883-25-2121）,72600（千円）,代表取締役社長／横田　賢二（ヨコタ ケンジ）
徳島ガーデンクリエイト株式会社,4480001004766,木材・木製品製造業（家具を除く）,〒779-3305徳島県吉野川市川島町児島長池114-1,0883256033（0883-25-6033）,30000（千円）,代表取締役社長／森藤　泰仁（モリトウ ヤスヒト）
四国油脂株式会社,4480001005005,食料品・飼料・飲料製造業,〒772-0017徳島県鳴門市撫養町立岩五枚82,0886852204（088-685-2204）,37000（千円）,代表取締役社長／東戸　憲一（ヒガシド ケンイチ）
ナルト繊維株式会社,4480001005112,衣服・その他の繊維製品製造業,〒771-0360徳島県鳴門市瀬戸町明神丸山11-3,0886882277（088-688-2277）,10000（千円）,伊勢　弘明（イセ ヒロアキ）
株式会社なると,4480001005178,食料品・飼料・飲料製造業,〒772-0021徳島県鳴門市里浦町里浦坂田410-1,0886862039（088-686-2039）,1000（千円）,吉田　誠（ヨシダ マコト）
美津菱足袋株式会社,4480001005186,衣服・その他の繊維製品製造業,〒772-0003徳島県鳴門市撫養町南浜浜田8-2,0886863996（088-686-3996）,45000（千円）,尾崎　行重（オザキ ユキシゲ）
株式会社石飛製作所,4480001005236,金属製品製造業,〒771-0214徳島県板野郡松茂町満穂満穂開拓115-2,0886995633（088-699-5633）,10000（千円）,石飛　博樹（イシトビ ヒロキ）
犬伏製薬株式会社,4480001005392,化学工業,〒771-1220徳島県板野郡藍住町東中富東傍示64-6,0886922302（088-692-2302）,10000（千円）,犬伏　壮一郎（イヌブシ ソウイチロウ）
徳真電機工業株式会社,4480001005450,電気機械器具製造業,〒771-1232徳島県板野郡藍住町富吉穂実95-4,0886925588（088-692-5588）,96000（千円）,代表取締役社長／村上　泰彦（ムラカミ ヤスヒコ）
東邦アート株式会社,4480001005566,出版・印刷・同関連産業,〒771-1320徳島県板野郡上板町神宅宮ノ前53-1,0886946220（088-694-6220）,10000（千円）,三谷　郁彦（ミタニ フミヒコ）
株式会社メディングＰＡＣＫ,4480001005640,出版・印刷・同関連産業,〒771-1202徳島県板野郡藍住町奥野東中須122-1,0886925111（088-692-5111）,10000（千円）,代表取締役社長／玉村　和哲（タマムラ カズノリ）
株式会社アイシコー,4480001005756,出版・印刷・同関連産業,〒771-1231徳島県板野郡藍住町富吉豊吉21,0886927573（088-692-7573）,10000（千円）,徳元　克行（トクモト カツユキ）
株式会社アトリエココロ,4480001005830,精密機械・医療機械器具製造業,〒772-0012徳島県鳴門市撫養町小桑島前組143マリビル2階,0886831575（088-683-1575）,13100（千円）,渡邊　恭二（ワタナベ キヨウジ）
株式会社ルックス電子,4480001006250,電気機械器具製造業,〒771-1702徳島県阿波市阿波町安政89-4,0883355353（0883-35-5353）,10000（千円）,北原　秀普（キタハラ ヒデユキ）
株式会社とり信,4480001006399,食料品・飼料・飲料製造業,〒773-0006徳島県小松島市横須町5-3,0885350375（0885-35-0375）,12000（千円）,代表取締役社長／大西　義信（オオニシ ヨシノブ）
株式会社アグリフーズ,4480001006589,食料品・飼料・飲料製造業,〒771-5203徳島県那賀郡那賀町和食郷南川333,0884622546（0884-62-2546）,10000（千円）,中野　義人（ナカノ ヨシヒト）
株式会社シンサン,4480001006705,木材・木製品製造業（家具を除く）,〒779-1106徳島県阿南市羽ノ浦町岩脇原平156-2,0884442043（0884-44-2043）,20000（千円）,代表取締役社長／新田　勝（ニツタ マサル）
株式会社シャイネックス,4480001006713,窯業・土石製品製造業,〒774-0022徳島県阿南市大潟町210-53,0884270596（0884-27-0596）,50000（千円）,濱垣　龍介（ハマガキ リユウスケ）
玉置製材株式会社,4480001006746,木材・木製品製造業（家具を除く）,〒779-1245徳島県阿南市那賀川町中島1557,0884421180（0884-42-1180）,20000（千円）,代表取締役社長／玉置　裕二（タマキ ユウジ）
丸井産業株式会社,4480001007249,一般機械器具製造業,〒779-1123徳島県阿南市那賀川町手島榎瀬31-1,0884420183（0884-42-0183）,20000（千円）,坪井　正一（ツボイ シヨウイチ）
大倉昆布株式会社,4480001007281,食料品・飼料・飲料製造業,〒779-3600徳島県美馬市脇町川原町4733-1,0883520105（0883-52-0105）,10000（千円）,藤川　剛（フジカワ ツヨシ）
北岡プレコン株式会社,4480001007298,窯業・土石製品製造業,〒771-2104徳島県美馬市美馬町明神原59,0883632281（0883-63-2281）,10000（千円）,代表取締役社長／北岡　秀二（キタオカ シユウジ）
徳島大島被服株式会社,4480001007554,衣服・その他の繊維製品製造業,〒778-0002徳島県三好市池田町マチ2150-1,0883720855（0883-72-0855）,10000（千円）,大島　康弘（オオシマ ヤスヒロ）
美吉野産業株式会社,4480001007595,"繊維工業（衣服,その他の繊維製品を除く）",〒771-2501徳島県三好郡東みよし町昼間1327-1,0883792161（0883-79-2161）,10000（千円）,代表取締役社長／西尾　大生（ニシオ ヒロオ）
株式会社ガレノス,4480001007942,食料品・飼料・飲料製造業,〒771-0132徳島県徳島市川内町平石夷野224-30,0886662550（088-666-2550）,30000（千円）,代表取締役社長／柴山　満男（シバヤマ ミツオ）
株式会社大和縫製,4480001008065,衣服・その他の繊維製品製造業,〒773-0025徳島県小松島市和田島町遠見47-5,0885382664（0885-38-2664）,5000（千円）,大和　貴司（ヤマト タカシ）
ＢＸ朝日建材株式会社,4480001008387,金属製品製造業,〒779-4101徳島県美馬郡つるぎ町貞光江ノ脇230-1,0883551081（0883-55-1081）,90000（千円）,代表取締役社長／森本　準一（モリモト ジユンイチ）
有限会社イシモトプリント,4480002000070,出版・印刷・同関連産業,〒770-0047徳島県徳島市名東町3-342-1,0886312442（088-631-2442）,3000（千円）,石元　孝憲（イシモト タカノリ）
有限会社岩谷,4480002000731,衣服・その他の繊維製品製造業,〒779-3105徳島県徳島市国府町東高輪66,0886423308（088-642-3308）,6000（千円）,岩谷　智也（イワタニ トモヤ）
有限会社金勢堂印刷,4480002000970,出版・印刷・同関連産業,〒771-0142徳島県徳島市川内町沖島230,0886650856（088-665-0856）,5000（千円）,廣瀬　忠司（ヒロセ タダシ）
有限会社アイコントラクト,4480002001416,家具・装備品製造業,〒770-0864徳島県徳島市大和町2-1-13,0886528472（088-652-8472）,30000（千円）,郡　統一（コオリ ムネカズ）
有限会社杉九商店,4480002002166,衣服・その他の繊維製品製造業,〒770-8056徳島県徳島市問屋町168,0886224230（088-622-4230）,3000（千円）,杉本　嘉彦（スギモト ヨシヒコ）
デジタル・テクノ有限会社,4480002002876,電気機械器具製造業,〒771-0142徳島県徳島市川内町沖島480-8,0886371223（088-637-1223）,4950（千円）,樋本　芳雄（ヒノモト ヨシオ）
富永ジョイナー有限会社,4480002003288,家具・装備品製造業,〒770-0868徳島県徳島市福島1-2-27,0886526323（088-652-6323）,5000（千円）,富永　啓司（トミナガ ケイジ）
有限会社フラワーショップ慶,4480002003932,その他の製造業,〒770-0903徳島県徳島市西大工町1-13,0886536012（088-653-6012）,3000（千円）,米川　慶子（ヨネカワ ケイコ）
有限会社松下鉄工所,4480002004484,輸送用機械器具製造業,〒779-3116徳島県徳島市国府町池尻173-1,0886426530（088-642-6530）,3000（千円）,松下　秀雄（マツシタ ヒデオ）
有限会社丸仏宮崎商店,4480002004674,家具・装備品製造業,〒770-0861徳島県徳島市住吉3-11-17,0886534733（088-653-4733）,10000（千円）,宮崎　優（ミヤザキ マサル）
丸繁銘木有限会社,4480002004781,木材・木製品製造業（家具を除く）,〒770-8001徳島県徳島市津田海岸町7-58,0886622820（088-662-2820）,5000（千円）,渡部　泰行（ワタナベ ヤスユキ）
有限会社橋本製菓,4480002005648,食料品・飼料・飲料製造業,〒779-3225徳島県名西郡石井町高川原桜間310-1,0886741621（088-674-1621）,3000（千円）,橋本　健司（ハシモト ケンジ）
有限会社原田庭石,4480002005929,窯業・土石製品製造業,〒771-3311徳島県名西郡神山町神領本野間146-3,0886761315（088-676-1315）,3000（千円）,原田　順一（ハラダ ジユンイチ）
有限会社ウェイテック,4480002006191,その他の製造業,〒779-3114徳島県徳島市国府町桜間登々路13-10,0886421049（088-642-1049）,3000（千円）,田村　英雄（タムラ ヒデオ）
有限会社井内製帽,4480002007529,衣服・その他の繊維製品製造業,〒773-0007徳島県小松島市金磯町9-17,0885323768（0885-32-3768）,3000（千円）,井内　祐史（イノウチ トシフミ）
有限会社オー・プレシジョン,4480002007611,一般機械器具製造業,〒771-4303徳島県勝浦郡勝浦町生名神ノ木23-1,0885442310（0885-44-2310）,6000（千円）,大西　康夫（オオニシ ヤスオ）
有限会社佐藤宇一郎商店,4480002007743,食料品・飼料・飲料製造業,〒773-0010徳島県小松島市日開野町加々三松25-2,0885320178（0885-32-0178）,10000（千円）,佐藤　博子（サトウ ヒロコ）
有限会社丸福製材所,4480002008147,木材・木製品製造業（家具を除く）,〒771-4300徳島県勝浦郡勝浦町棚野西久保18-1,0885422057（0885-42-2057）,3000（千円）,堺　徹（サカイ トオル）
有限会社三ツ星鉄工所,4480002008163,一般機械器具製造業,〒773-0007徳島県小松島市金磯町8-118,0885320657（0885-32-0657）,10000（千円）,岡島　弘岳（オカジマ ヒロタケ）
秋田木工有限会社,4480002008601,木材・木製品製造業（家具を除く）,〒773-0023徳島県小松島市坂野町黒地15-7,0885370680（0885-37-0680）,3000（千円）,秋田　昇（アキタ ノボル）
三幸林業有限会社,4480002009129,木材・木製品製造業（家具を除く）,〒779-3402徳島県吉野川市山川町天神91,0883425535（0883-42-5535）,4800（千円）,後藤　次郎（ゴトウ ジロウ）
有限会社広工業,4480002009335,木材・木製品製造業（家具を除く）,〒776-0031徳島県吉野川市鴨島町敷地793-14,0883240632（0883-24-0632）,3000（千円）,佐藤　高広（サトウ タカヒロ）
ヤナギダニ包装有限会社,4480002009467,その他の製造業,〒779-3402徳島県吉野川市山川町忌部202-4,0883422307（0883-42-2307）,3000（千円）,柳谷　啓二（ヤナギダニ ケイジ）
有限会社エクシマ,4480002010053,衣服・その他の繊維製品製造業,〒776-0004徳島県吉野川市鴨島町中島265-9,0883261206（0883-26-1206）,3000（千円）,野木　功（ノギ イサオ）
有限会社東條文明堂,4480002011885,食料品・飼料・飲料製造業,〒771-1320徳島県板野郡上板町神宅宮ノ北10,0886943661（088-694-3661）,10000（千円）,木内　千春（キノウチ チハル）
有限会社加川テクノサービス,4480002011968,一般機械器具製造業,〒771-1345徳島県板野郡上板町上六條53,0886943316（088-694-3316）,5000（千円）,加川　速水（カガワ ハヤミ）
有限会社一福,4480002012173,金属製品製造業,〒771-0202徳島県板野郡北島町太郎八須新開1-9,0886972750（088-697-2750）,3000（千円）,福井　正彦（フクイ マサヒコ）
有限会社ミヤシン,4480002012280,家具・装備品製造業,〒771-1210徳島県板野郡藍住町徳命小塚43-1,0886924190（088-692-4190）,15000（千円）,宮崎　雅信（ミヤザキ マサノブ）
有限会社浅木産業,4480002012652,木材・木製品製造業（家具を除く）,〒779-1233徳島県阿南市那賀川町大京原289-3,0884421525（0884-42-1525）,7000（千円）,浅木　恵次（アサキ ケイジ）
有限会社大坂製作所,4480002012768,家具・装備品製造業,〒779-1245徳島県阿南市那賀川町中島728-2,0884420478（0884-42-0478）,8000（千円）,大坂　忠計（オオサカ タダカズ）
有限会社岸火工品製造所,4480002012909,その他の製造業,〒779-1510徳島県阿南市新野町林148-1,0884363644（0884-36-3644）,10000（千円）,岸　良治（キシ リヨウジ）
野田産業有限会社,4480002014252,木材・木製品製造業（家具を除く）,〒779-2305徳島県海部郡美波町奥河内弁才天75-1,0884771215（0884-77-1215）,3000（千円）,野田　稔雄（ノダ トシオ）
柿本画軸有限会社,4480002014285,木材・木製品製造業（家具を除く）,〒779-2108徳島県海部郡美波町木岐687,0884780151（0884-78-0151）,3000（千円）,柿本　健児（カキモト ケンジ）
有限会社前野印刷,4480002014467,出版・印刷・同関連産業,〒775-0203徳島県海部郡海陽町大里杉谷8-6,0884730171（0884-73-0171）,3000（千円）,前野　拓司（マエノ タクジ）
有限会社亀吉製麺,4480002014657,食料品・飼料・飲料製造業,〒779-4401徳島県美馬郡つるぎ町半田松生257,0883643219（0883-64-3219）,3000（千円）,亀井　直樹（カメイ ナオキ）
有限会社松浦,4480002015250,ゴム製品製造業,〒779-3741徳島県美馬市脇町曽江名340-6,0883530286（0883-53-0286）,3000（千円）,松浦　美紀子（マツウラ ミキコ）
有限会社大谷製材所,4480002015399,木材・木製品製造業（家具を除く）,〒779-5301徳島県三好市山城町大和川898-1,0883861181（0883-86-1181）,3000（千円）,中岡　昌美（ナカオカ マサミ）
オンダン農業協同組合,4480005004845,食料品・飼料・飲料製造業,〒775-0310徳島県海部郡海陽町大井大谷11,0884733534（0884-73-3534）,20000（千円）,代表理事組合長／丸本　敦（マルモト アツシ）
つるぎ木材加工協同組合,4480005005835,木材・木製品製造業（家具を除く）,〒779-4103徳島県美馬郡つるぎ町貞光江ノ脇210-8,0883624836（0883-62-4836）,1000（千円）,伊庭　雅俊（イバ マサトシ）
株式会社阿波友禅工場,5480001000095,"繊維工業（衣服,その他の繊維製品を除く）",〒771-1154徳島県徳島市応神町東貞方西川渕81-1,0886413181（088-641-3181）,10000（千円）,香川　文孝（カガワ フミタカ）
株式会社赤澤,5480001000145,家具・装備品製造業,〒770-0868徳島県徳島市福島1-10-62,0886229206（088-622-9206）,48000（千円）,赤澤　正行（アカザワ マサユキ）
株式会社イシダ測機,5480001000203,出版・印刷・同関連産業,〒770-0853徳島県徳島市中徳島町2-82,0886250720（088-625-0720）,10000（千円）,石田　英明（イシダ ヒデアキ）
