会社名,法人番号,業種,住所,電話番号,資本金,代表氏名
有限会社大城鐵工,4360002008935,一般機械器具製造業,〒901-0314沖縄県糸満市座波1125,0989943721（098-994-3721）,3000（千円）,大城　健榮（オオシロ ケンエイ）
有限会社沖縄ケータリングサービス,4360002009000,食料品・飼料・飲料製造業,〒901-0152沖縄県那覇市小禄1-8-1田原ハイツツー1階,0988520051（098-852-0051）,3000（千円）,村田　通孝（ムラタ ミチタカ）
有限会社南成生コン工業,4360002009272,窯業・土石製品製造業,〒901-0362沖縄県糸満市真栄里794,0989923922（098-992-3922）,39300（千円）,屋宜　宣光（ヤギ センコウ）
有限会社沖縄宣美,4360002010437,その他の製造業,〒901-1117沖縄県島尻郡南風原町新川171,0988898488（098-889-8488）,8500（千円）,玉城　哲次（タマキ テツジ）
有限会社友愛ミート,4360002010692,食料品・飼料・飲料製造業,〒901-1203沖縄県南城市大里字大城1927,0989433038（098-943-3038）,10000（千円）,宮城　直（ミヤギ ナオシ）
赤道印刷有限会社,4360002012929,出版・印刷・同関連産業,〒904-2244沖縄県うるま市江洲289-1,0989733383（098-973-3383）,5000（千円）,島袋　理（シマブクロ オサム）
有限会社つむぎ弁当,4360002013472,食料品・飼料・飲料製造業,〒904-2244沖縄県うるま市江洲363,0989734915（098-973-4915）,5000（千円）,名護　榮代（ナゴ ヒデヨ）
有限会社池間製氷,4360002013712,食料品・飼料・飲料製造業,〒904-1106沖縄県うるま市石川3150-1,0989643718（098-964-3718）,35000（千円）,池間　弘明（イケマ ヒロアキ）
有限会社大山コンクリート工業,4360002015403,窯業・土石製品製造業,〒901-2223沖縄県宜野湾市大山7-4-11,0988979146（098-897-9146）,49900（千円）,石川　真明（イシカワ サネアキ）
有限会社サンクラフト,4360002015766,その他の製造業,〒901-2131沖縄県浦添市牧港5-3-6,0988760234（098-876-0234）,5000（千円）,与座　千尋（ヨザ チヒロ）
有限会社比嘉酒造,4360002017481,食料品・飼料・飲料製造業,〒904-0324沖縄県中頭郡読谷村長浜1061,0989582205（098-958-2205）,22400（千円）,代表取締役／比嘉　兼作（ヒガ ケンサク）
有限会社石川種麹店,4360002019049,食料品・飼料・飲料製造業,〒904-0113沖縄県中頭郡北谷町宮城1-598,0989363072（098-936-3072）,3000（千円）,渡嘉敷　みどり（トカシキ ミドリ）
有限会社日南物産,4360002019684,食料品・飼料・飲料製造業,〒905-0011沖縄県名護市宮里1484-1,0980520975（0980-52-0975）,10000（千円）,比嘉　松榮（ヒガ シヨウエイ）
有限会社今帰仁酒造,4360002020758,食料品・飼料・飲料製造業,〒905-0401沖縄県国頭郡今帰仁村仲宗根500,0980562611（0980-56-2611）,5000（千円）,代表取締役社長／大城　洋介（オオシロ ヨウスケ）
農業生産法人有限会社オリエント沖縄,4360002020931,食料品・飼料・飲料製造業,〒905-0006沖縄県名護市宇茂佐1792-13,0980530358（0980-53-0358）,5000（千円）,玉城　毅（タマキ ツヨシ）
有限会社ＲＥＫＩＯ・ＧＯＲＥＳ,4360002021789,衣服・その他の繊維製品製造業,〒907-0022沖縄県石垣市大川256,0980821351（0980-82-1351）,3000（千円）,米盛　長正（ヨネモリ チヨウシヨウ）
合資会社バートン,4360003003175,食料品・飼料・飲料製造業,〒904-2225沖縄県うるま市字喜屋武174-1,0989739343（098-973-9343）,"",諸見里　睦子（モロミザト ムツコ）
合資会社中央製版印刷,4360003003596,出版・印刷・同関連産業,〒901-2201沖縄県宜野湾市新城1-7-5桃原アパート1階,0988927050（098-892-7050）,"",仲宗根　幸子（ナカソネ サチコ）
秀産業合資会社,4360003004306,窯業・土石製品製造業,〒904-2142沖縄県沖縄市登川2886,"","",嶺井　政秀（ミネイ マサヒデ）
合資会社津嘉山酒造所,4360003004553,食料品・飼料・飲料製造業,〒905-0017沖縄県名護市大中1-14-6,0980522070（0980-52-2070）,"",瑞慶村　實（ズケムラ ミノル）
金武町,5000020473146,食料品・飼料・飲料製造業,〒904-1200沖縄県国頭郡金武町金武4090-1,0989832552（098-983-2552）,9500（千円）,西村　雅睦（ニシムラ マサムツ）
株式会社メディコス・インターナショナル,5020001021889,食料品・飼料・飲料製造業,〒901-0362沖縄県糸満市真栄里2046-3,"",10000（千円）,阿部　哲也（アベ テツヤ）
株式会社アオバ沖縄,5360001000025,出版・印刷・同関連産業,〒901-0231沖縄県豊見城市我那覇217-2,0988522477（098-852-2477）,20000（千円）,中村　勝（ナカムラ マサル）
株式会社沖縄建設新聞,5360001000289,出版・印刷・同関連産業,〒900-0012沖縄県那覇市泊3-5-6,0988671290（098-867-1290）,46600（千円）,代表取締役社長／古謝　昇（コジヤ ノボル）
北大東製糖株式会社,5360001000784,食料品・飼料・飲料製造業,〒900-0002沖縄県那覇市曙3-17-134F,0988673297（098-867-3297）,76260（千円）,宮城　一也（ミヤギ カズヤ）
久米島製糖株式会社,5360001000834,食料品・飼料・飲料製造業,〒900-0033沖縄県那覇市久米2-2-10那覇商工会議所ビル4階,0988685757（098-868-5757）,152500（千円）,代表取締役社長／上江洲　智一（ウエズ トモカズ）
波照間製糖株式会社,5360001001782,食料品・飼料・飲料製造業,〒900-0031沖縄県那覇市若狭1-14-6,0988622737（098-862-2737）,21350（千円）,代表取締役社長／西村　憲（ニシムラ ケン）
株式会社ニチハン繊維,5360001001790,衣服・その他の繊維製品製造業,〒901-0306沖縄県糸満市西崎町4-21-7,0989943511（098-994-3511）,28975（千円）,大城　英幸（オオシロ エイコウ）
株式会社千草物産,5360001002541,食料品・飼料・飲料製造業,〒902-0074沖縄県那覇市仲井真246-1,0988323067（098-832-3067）,10000（千円）,赤嶺　茂昌（アカミネ シゲマサ）
株式会社ハンズ・コム,5360001002566,出版・印刷・同関連産業,〒900-0003沖縄県那覇市安謝1-3-10号HOPビル205号,0988669288（098-866-9288）,60000（千円）,金城　悟（キンジヨウ サトル）
株式会社名渡山鉄工,5360001004364,一般機械器具製造業,〒903-0103沖縄県中頭郡西原町小那覇541-1,0989467412（098-946-7412）,10000（千円）,名渡山　隆（ナドヤマ タカシ）
株式会社青い海,5360001005263,化学工業,〒901-0306沖縄県糸満市西崎町4-5-4,0989921140（098-992-1140）,80000（千円）,代表取締役社長／又吉　元栄（マタヨシ ゲンエイ）
沖繩製本株式会社,5360001006451,出版・印刷・同関連産業,〒901-1111沖縄県島尻郡南風原町兼城577沖縄印刷団地内,0988891356（098-889-1356）,30000（千円）,外間　政朝（ホカマ マサトモ）
株式会社与那覇食品,5360001006773,食料品・飼料・飲料製造業,〒903-0103沖縄県中頭郡西原町字小那覇1489-2,0989467267（098-946-7267）,6000（千円）,與那覇　秀勝（ヨナハ ヒデカツ）
株式会社トップラン,5360001007268,食料品・飼料・飲料製造業,〒904-2143沖縄県沖縄市知花4-32-3,0989342791（098-934-2791）,22000（千円）,東恩納　学（ヒガシオンナ マナブ）
コンボルト・ジャパン株式会社,5360001007524,金属製品製造業,〒904-2311沖縄県うるま市勝連南風原5192-21,0989290821（098-929-0821）,96000（千円）,代表取締役社長／島袋　修（シマブクロ オサム）
株式会社Ｅ－ＣＯＮ,5360001007532,窯業・土石製品製造業,〒904-2142沖縄県沖縄市登川3412-1,0989212177（098-921-2177）,49000（千円）,代表取締役社長／佐々木　英人（ササキ ヒデト）
株式会社積水化成品沖縄,5360001007607,その他の製造業,〒904-2205沖縄県うるま市栄野比1178-2,0989725085（098-972-5085）,30200（千円）,竹田　浩二（タケダ コウジ）
株式会社海邦商事,5360001007623,食料品・飼料・飲料製造業,〒904-2234沖縄県うるま市州崎8-19,0989382133（098-938-2133）,49000（千円）,セントローレント　真紀（セントロ-レント マキ）
大和コンクリート工業株式会社,5360001007689,窯業・土石製品製造業,〒904-2201沖縄県うるま市昆布1839-1,0989723535（098-972-3535）,40000（千円）,豊里　友彦（トヨサト トモヒコ）
株式会社キョウリツ,5360001007697,窯業・土石製品製造業,〒904-1111沖縄県うるま市石川東恩納1406-99,0989656323（098-965-6323）,46500（千円）,代表取締役社長／大城　保一（オオシロ ヤスカズ）
株式会社ＥＭ研究機構,5360001007771,食料品・飼料・飲料製造業,〒901-2311沖縄県中頭郡北中城村喜舎場1478ホテルコスタビスタ沖縄内,0989350202（098-935-0202）,90000（千円）,代表取締役会長／比嘉　新（ヒガ シン）
タイガー工業株式会社,5360001007862,金属製品製造業,〒904-2234沖縄県うるま市州崎12-11,0989821488（098-982-1488）,10000（千円）,代表取締役社長／島袋　太悟（シマブクロ ダイゴ）
株式会社丸昇物産,5360001008258,食料品・飼料・飲料製造業,〒901-0306沖縄県糸満市西崎町5-12-7,0988523070（098-852-3070）,10000（千円）,代表取締役社長／與那覇　昇（ヨナハ ノボル）
沖繩製線株式会社,5360001008547,"鉄鋼業,非鉄金属製造業",〒903-0103沖縄県中頭郡西原町小那覇1266,0989446616（098-944-6616）,79500（千円）,代表取締役社長／與那　好庸（ヨナ ヨシノブ）
株式会社尚生堂,5360001008860,出版・印刷・同関連産業,〒901-2114沖縄県浦添市安波茶1-6-3,0988762232（098-876-2232）,26500（千円）,與那覇　正春（ヨナハ マサハル）
拓南伸線株式会社,5360001008951,"鉄鋼業,非鉄金属製造業",〒901-2403沖縄県中頭郡中城村字伊舎堂312,0988952152（098-895-2152）,150000（千円）,代表取締役社長／古波津　昇（コハツ ノボル）
北部製糖株式会社,5360001009149,食料品・飼料・飲料製造業,〒901-2128沖縄県浦添市伊奈武瀬1-9-9,0988670501（098-867-0501）,380000（千円）,代表取締役社長／岸本　本成（キシモト ホンセイ）
株式会社沖縄黒糖,5360001009347,食料品・飼料・飲料製造業,〒904-0301沖縄県中頭郡読谷村座喜味2822-3,0989584005（098-958-4005）,26500（千円）,長濱　徳松（ナガハマ トクマツ）
エムアンドビー株式会社,5360001009462,食料品・飼料・飲料製造業,〒901-2131沖縄県浦添市牧港1-65-1,0988706100（098-870-6100）,30000（千円）,代表取締役社長／布施　康仁（フセ ヤスヒト）
株式会社パダーム,5360001009727,化学工業,〒901-2102沖縄県浦添市前田1-48-10,0989425054（098-942-5054）,10000（千円）,大城　るり子（オオシロ ルリコ）
ユイマールハウス株式会社,5360001010412,食料品・飼料・飲料製造業,〒904-0113沖縄県中頭郡北谷町宮城1-651,0989368116（098-936-8116）,6000（千円）,比嘉　大輔（ヒガ ダイスケ）
株式会社シーワン,5360001010874,食料品・飼料・飲料製造業,〒901-1204沖縄県南城市大里稲嶺1176-1,0988527766（098-852-7766）,20000（千円）,中島　善助（ナカシマ ゼンスケ）
株式会社エクセル,5360001011988,その他の製造業,〒901-2225沖縄県宜野湾市大謝名98-1-1階,0989639995（098-963-9995）,3000（千円）,高良　茂（タカラ シゲル）
石垣島製糖株式会社,5360001013035,食料品・飼料・飲料製造業,〒907-0021沖縄県石垣市名蔵243,0980823940（0980-82-3940）,262300（千円）,代表取締役社長／松林　豊（マツバヤシ ユタカ）
共立生コン工業株式会社,5360001013084,窯業・土石製品製造業,〒907-0003沖縄県石垣市平得522,0980823894（0980-82-3894）,45000（千円）,与那覇　ヨシ（ヨナハ ヨシ）
株式会社八重山ゲンキ乳業,5360001013191,食料品・飼料・飲料製造業,〒907-0004沖縄県石垣市登野城909,0980823452（0980-82-3452）,20000（千円）,代表取締役社長／新　賢次（アラ ケンジ）
株式会社創進,5360001013456,窯業・土石製品製造業,〒907-0003沖縄県石垣市平得741,0980821830（0980-82-1830）,29000（千円）,知念　敏治（チネン トシハル）
株式会社石垣島堆肥センター,5360001013522,食料品・飼料・飲料製造業,〒907-0003沖縄県石垣市平得1312-3,0980888586（0980-88-8586）,10000（千円）,当山　喜一郎（トウヤマ キイチロウ）
株式会社協栄生コン,5360001013745,窯業・土石製品製造業,〒906-0013沖縄県宮古島市平良下里3107-403,0980721381（0980-72-1381）,49800（千円）,仲間　盛仁（ナカマ セイジン）
株式会社パラダイスプラン,5360001013893,化学工業,〒906-0015沖縄県宮古島市平良久貝870-1,0980734140（0980-73-4140）,68000（千円）,代表取締役社長／西里　長治（ニシザト チヨウジ）
元気生活株式会社,5360001014108,食料品・飼料・飲料製造業,〒906-0012沖縄県宮古島市平良西里880-3,0980723885（0980-72-3885）,6100（千円）,砂川　栄（スナガワ サカエ）
株式会社たみくさ,5360001014339,食料品・飼料・飲料製造業,〒904-2301沖縄県うるま市与那城照間1860-1,0989788017（098-978-8017）,5000（千円）,玉榮　幸江（タマエ サチエ）
クリアノワール株式会社,5360001015270,化学工業,〒901-0156沖縄県那覇市田原1-5-1GALAXYONE210,0988944571（098-894-4571）,7000（千円）,兼本　慎子（カネモト ノリコ）
株式会社島藍農園,5360001015469,"繊維工業（衣服,その他の繊維製品を除く）",〒907-0013沖縄県石垣市浜崎町3-3-20コーラルベイ石垣島弐番館203号,"",500（千円）,大濱　豪（オオハマ ツヨシ）
有限会社天久加工所,5360002000255,その他の製造業,〒900-0036沖縄県那覇市西1-15-3,0988666251（098-866-6251）,10000（千円）,崎山　大輔（サキヤマ ダイスケ）
有限会社総合ウエス問屋ナガオカ,5360002002425,衣服・その他の繊維製品製造業,〒902-0065沖縄県那覇市壺屋2-15-11,0988543717（098-854-3717）,3000（千円）,長岡　稔（ナガオカ ミノル）
有限会社南風原印刷,5360002003489,出版・印刷・同関連産業,〒902-0073沖縄県那覇市上間571-1,0988341616（098-834-1616）,3000（千円）,島袋　哲也（シマブクロ テツヤ）
有限会社若葉印刷,5360002004891,出版・印刷・同関連産業,〒902-0073沖縄県那覇市上間372ヤビクビル1階,0988343429（098-834-3429）,20000（千円）,當間　行男（トウマ ユキオ）
有限会社わかまつどう製菓,5360002004900,食料品・飼料・飲料製造業,〒901-0201沖縄県豊見城市真玉橋244-1,0988562277（098-856-2277）,10000（千円）,下地　鉄夫（シモジ テツオ）
有限会社末広環境開発,5360002009148,食料品・飼料・飲料製造業,〒901-0344沖縄県糸満市伊原564-1,0989974132（098-997-4132）,9000（千円）,徳元　春雄（トクモト ハルオ）
有限会社祐食品,5360002009552,食料品・飼料・飲料製造業,〒901-0403沖縄県島尻郡八重瀬町世名城536-1,0989988575（098-998-8575）,3000（千円）,神谷　徳春（カミヤ トクハル）
有限会社マルト食品,5360002010683,食料品・飼料・飲料製造業,〒901-1202沖縄県南城市大里大城1927,0989456516（098-945-6516）,3000（千円）,岸本　勇（キシモト イサム）
有限会社曙印刷,5360002011244,出版・印刷・同関連産業,〒904-2172沖縄県沖縄市泡瀬4-31-15,0989387884（098-938-7884）,5000（千円）,當山　全英（トウヤマ ゼンエイ）
有限会社パレドーレ,5360002012250,食料品・飼料・飲料製造業,〒904-2153沖縄県沖縄市美里1-26-52,0989895217（098-989-5217）,3000（千円）,具志　弘清（グシ コウセイ）
有限会社名嘉眞製菓,5360002012985,食料品・飼料・飲料製造業,〒904-2201沖縄県うるま市字昆布1832-369,0989726010（098-972-6010）,3000（千円）,名嘉眞　光秀（ナカマ ミツヒデ）
有限会社新屋水産,5360002013018,食料品・飼料・飲料製造業,〒904-2314沖縄県うるま市勝連平敷屋4189,0989783107（098-978-3107）,3000（千円）,新屋　信雄（シンヤ ノブオ）
有限会社アクア,5360002014395,一般機械器具製造業,〒901-2104沖縄県浦添市当山2-8-1広栄ビルBー3,0988707755（098-870-7755）,3000（千円）,玉寄　和弘（タマヨセ カズヒロ）
有限会社沖縄化粧合板,5360002015195,木材・木製品製造業（家具を除く）,〒901-2134沖縄県浦添市港川412,0988775030（098-877-5030）,5000（千円）,代表取締役社長／友寄　隆幸（トモヨセ タカユキ）
有限会社みのり,5360002015591,食料品・飼料・飲料製造業,〒905-1311沖縄県国頭郡大宜味村字塩屋1810-1,0980441810（0980-44-1810）,15000（千円）,代表取締役社長／上原　浩司（ウエハラ コウジ）
有限会社尚コントリビューション,5360002016029,化学工業,〒901-2224沖縄県宜野湾市真志喜2-7-11メゾントータス102,0988979770（098-897-9770）,3000（千円）,菊池　信夫（キクチ ノブオ）
有限会社ヘイセイ工芸,5360002016937,家具・装備品製造業,〒901-2223沖縄県宜野湾市大山1-14-15,0988980877（098-898-0877）,4500（千円）,葛　徳英（カツラ ノリヒデ）
有限会社丸の内印刷,5360002017175,出版・印刷・同関連産業,〒904-0204沖縄県中頭郡嘉手納町水釜6-2-3,0989563316（098-956-3316）,3000（千円）,佐久本　嗣孝（サクモト ツグタカ）
有限会社宙吹ガラス工房虹,5360002017456,窯業・土石製品製造業,〒904-0301沖縄県中頭郡読谷村座喜味2748,0989586448（098-958-6448）,3000（千円）,稲嶺　盛吉（イナミネ セイキチ）
有限会社ユーズ,5360002018173,出版・印刷・同関連産業,〒901-2201沖縄県宜野湾市新城2-24-12,0988962004（098-896-2004）,8000（千円）,上江洲　剛（ウエズ ツヨシ）
有限会社渡具知,5360002019634,食料品・飼料・飲料製造業,〒905-0021沖縄県名護市東江2-8-43,0980540063（0980-54-0063）,4200（千円）,渡具知　豊（トグチ ユタカ）
有限会社比嘉砕石,5360002020195,窯業・土石製品製造業,〒904-0416沖縄県国頭郡恩納村山田2131,0989642848（098-964-2848）,10000（千円）,比嘉　福光（ヒガ フクミツ）
有限会社おっぱ乳業,5360002020311,食料品・飼料・飲料製造業,〒905-0415沖縄県国頭郡今帰仁村玉城763,0980565326（0980-56-5326）,10000（千円）,松　清嗣（マツ キヨシ）
有限会社豊見山食品,5360002021350,食料品・飼料・飲料製造業,〒907-0001沖縄県石垣市大浜1349-83,0980824148（0980-82-4148）,10000（千円）,豊見山　修司（トミヤマ シユウジ）
有限会社下地商事,5360002022407,食料品・飼料・飲料製造業,〒906-0011沖縄県宮古島市平良東仲宗根添1166-597,0980733749（0980-73-3749）,3000（千円）,下地　盛吉（シモジ セイキチ）
合資会社沖縄ウレタン,5360003000155,その他の製造業,〒903-0103沖縄県中頭郡西原町小那覇1487,0989467215（098-946-7215）,"",社長／古波津　清（コハツ キヨシ）
合資会社奥原硝子製造所,5360003000320,窯業・土石製品製造業,〒902-0076沖縄県那覇市与儀1-26-7,0988324346（098-832-4346）,"",宮城　和六（ミヤギ カズム）
合資会社富士電装,5360003003694,その他の製造業,〒901-2114沖縄県浦添市安波茶2-4-6-101号,0988774991（098-877-4991）,"",上原　武（ウエハラ タケシ）
合同会社油脂とーる,5360003007134,その他の製造業,〒901-2301沖縄県中頭郡北中城村島袋210,0989303907（098-930-3907）,300（千円）,西田　健次郎（ニシダ ケンジロウ）
一般社団法人伊良部堆肥センター,5360005003833,食料品・飼料・飲料製造業,〒906-0507沖縄県宮古島市伊良部佐和田910-23,0980784988（0980-78-4988）,"",與儀　勇英（ヨギ ユウエイ）
久米仙酒造株式会社,6360001002367,食料品・飼料・飲料製造業,〒902-0074沖縄県那覇市仲井真155,0988323133（098-832-3133）,50000（千円）,比嘉　洋一（ヒガ ヨウイチ）
株式会社石川酒造場,6360001004280,食料品・飼料・飲料製造業,〒903-0117沖縄県中頭郡西原町小那覇1438-1,0989453515（098-945-3515）,33500（千円）,代表取締役社長／仲松　政治（ナカマツ マサジ）
沖縄鋳鉄工業株式会社,6360001004306,"鉄鋼業,非鉄金属製造業",〒903-0103沖縄県中頭郡西原町小那覇958,0989455453（098-945-5453）,45000（千円）,代表取締役社長／眞志喜　実（マシキ ミノル）
西崎パッケージ株式会社,6360001005262,パルプ・紙・紙加工品製造業,〒901-0306沖縄県糸満市西崎町4-8-3,0989943031（098-994-3031）,25000（千円）,屋良　朝克（ヤラ トモカツ）
株式会社沖縄海星物産,6360001005709,食料品・飼料・飲料製造業,〒901-0306沖縄県糸満市西崎町4-13-5,0989940191（098-994-0191）,30000（千円）,代表取締役社長／狩俣　順市（カリマタ ジユンイチ）
株式会社久米島の久米仙,6360001006129,食料品・飼料・飲料製造業,〒901-3101沖縄県島尻郡久米島町宇江城2157,0989852276（098-985-2276）,11250（千円）,代表取締役社長／島袋　正也（シマブクロ マサヤ）
株式会社フジタカクリエイション,6360001007498,衣服・その他の繊維製品製造業,〒904-2234沖縄県うるま市州崎12-28,0989382323（098-938-2323）,30000（千円）,代表取締役社長／高里　豊吉（タカザト トヨキチ）
シュガーソルト垣乃花株式会社,6360001008075,食料品・飼料・飲料製造業,〒904-2234沖縄県うるま市州崎12-18,0989399688（098-939-9688）,42000（千円）,垣花　兼一（カキノハナ ケンイチ）
株式会社ブルーオーシャンズ,6360001008240,食料品・飼料・飲料製造業,〒905-1311沖縄県国頭郡大宜味村塩屋1306-71,0980442992（0980-44-2992）,37900（千円）,中田　裕久（ナカタ ヒロヒサ）
西表糖業株式会社,6360001008439,食料品・飼料・飲料製造業,〒901-2128沖縄県浦添市伊奈武瀬1-9-9,0988691260（098-869-1260）,45750（千円）,金城　一夫（キンジヨウ カズオ）
協栄生コンクリート株式会社,6360001009354,窯業・土石製品製造業,〒904-0303沖縄県中頭郡読谷村伊良皆700,0989583947（098-958-3947）,40000（千円）,代表取締役社長／宮城　清勝（ミヤギ キヨカツ）
株式会社たるたる亭沖縄,6360001010493,食料品・飼料・飲料製造業,〒901-2223沖縄県宜野湾市大山7-2-10サンエー本社内PCセンター2F,0988903305（098-890-3305）,6500（千円）,安里　律子（アサト リツコ）
農業生産法人株式会社アセローラフレッシュ,6360001012878,食料品・飼料・飲料製造業,〒905-0222沖縄県国頭郡本部町並里52-2,0980472505（0980-47-2505）,24000（千円）,並里　哲子（ナミサト テツコ）
第一生コンクリート株式会社,6360001013125,窯業・土石製品製造業,〒907-0022沖縄県石垣市大川1536,0980821021（0980-82-1021）,18800（千円）,高良　新章（タカラ シンシヨウ）
株式会社八重山毎日新聞,6360001013208,出版・印刷・同関連産業,〒907-0004沖縄県石垣市登野城614,0980820936（0980-82-0936）,98332（千円）,代表取締役社長／黒島　安隆（クロシマ ヤスタカ）
株式会社創進コンクリート,6360001013265,窯業・土石製品製造業,〒907-0003沖縄県石垣市平得741,0980821830（0980-82-1830）,29000（千円）,知念　敏治（チネン トシハル）
株式会社池間製氷,6360001013579,食料品・飼料・飲料製造業,〒907-0004沖縄県石垣市登野城588-3,0980825975（0980-82-5975）,9000（千円）,唐真　正樹（トウマ マサキ）
株式会社与那国水産加工,6360001013587,食料品・飼料・飲料製造業,〒907-1801沖縄県八重山郡与那国町与那国4022-1,0980872151（0980-87-2151）,13900（千円）,東郷　清龍（トウゴウ セイリユウ）
株式会社宮古毎日新聞社,6360001013819,出版・印刷・同関連産業,〒906-0012沖縄県宮古島市平良西里337,0980722343（0980-72-2343）,40500（千円）,平良　覚（タイラ サトル）
株式会社玉那覇酒造所,6360001014726,食料品・飼料・飲料製造業,〒907-0023沖縄県石垣市石垣47,0980823165（0980-82-3165）,9000（千円）,玉那覇　有一郎（タマナハ ユウイチロウ）
株式会社あうん堂,6360001015212,食料品・飼料・飲料製造業,〒900-0004沖縄県那覇市銘苅3-13-26,0988613730（098-861-3730）,200（千円）,福田　修（フクダ オサム）
