会社名,法人番号,業種,住所,電話番号,資本金,代表氏名
株式会社日本木箱,7410001008283,木材・木製品製造業（家具を除く）,〒014-0103秋田県大仙市高関上郷卯時田60,0187888009（0187-88-8009）,10000（千円）,五十嵐　建一（イガラシ ケンイチ）
インスペック株式会社,7410001008548,電気機械器具製造業,〒014-0341秋田県仙北市角館町雲然荒屋敷79-1,0187541888（0187-54-1888）,486343（千円）,代表取締役社長／菅原　雅史（スガワラ マサシ）
株式会社東北芝浦電子,7410001008556,電気機械器具製造業,〒014-1201秋田県仙北市田沢湖生保内下高野58-66,0187462888（0187-46-2888）,100000（千円）,代表取締役社長／能味　正志（ノウミ マサシ）
株式会社八柳,7410001008597,木材・木製品製造業（家具を除く）,〒014-0347秋田県仙北市角館町小勝田松ケ崎29-20,0187554344（0187-55-4344）,16000（千円）,八柳　良太郎（ヤツヤナギ リヨウタロウ）
秋田渥美工業株式会社,7410001008762,輸送用機械器具製造業,〒013-0811秋田県横手市安本下御所野1-11,0182331711（0182-33-1711）,40000（千円）,代表取締役社長／川口　夫美男（カワグチ フミオ）
株式会社ヴァルモード,7410001008886,衣服・その他の繊維製品製造業,〒013-0055秋田県横手市朝日が丘3-27-25,0182328677（0182-32-8677）,55550（千円）,代表取締役社長／ディーター・ハーベル（デイ-タ- ハ-ベル）
株式会社小沢製粉所,7410001008993,食料品・飼料・飲料製造業,〒013-0205秋田県横手市雄物川町今宿今宿51,0182222037（0182-22-2037）,10000（千円）,小澤　吉幸（コザワ ヨシユキ）
株式会社宮腰デジタルシステムズ,7410001009034,一般機械器具製造業,〒013-0443秋田県横手市大雄字高津野111,0182523854（0182-52-3854）,93000（千円）,代表取締役社長／宮腰　巖（ミヤコシ イワオ）
株式会社増田サントップ,7410001009216,衣服・その他の繊維製品製造業,〒019-0701秋田県横手市増田町増田伊勢堂南34,0182452461（0182-45-2461）,9000（千円）,平沢　邦朗（ヒラサワ クニオ）
株式会社ＢＭＪ,7410001009356,食料品・飼料・飲料製造業,〒019-2632秋田県秋田市河辺大張野水口沢79-2,0188811238（018-881-1238）,3000（千円）,加賀屋　雅紀（カガヤ マサキ）
株式会社鈴木たれ本舗,7410001009463,食料品・飼料・飲料製造業,〒017-0012秋田県大館市釈迦内山道上76-40,0186578479（0186-57-8479）,7000（千円）,鈴木　博（スズキ ヒロシ）
エスアイ製作所株式会社,7410001010041,ゴム製品製造業,〒016-0000秋田県能代市字塞ノ神60,0185892055（0185-89-2055）,3000（千円）,桐越　伸也（キリコシ シンヤ）
キャッスルファイブレザーアート株式会社,7410001010116,皮革・同製品・毛皮製造業,〒018-1744秋田県南秋田郡五城目町字神明前81-14,0188749498（018-874-9498）,1200（千円）,渡邉　益光（ワタナベ マスミツ）
株式会社こしゃる店篠田宝飾,7410001010561,その他の製造業,〒010-0001秋田県秋田市中通6-19-3,0188365486（018-836-5486）,3000（千円）,篠田　大祐（シノダ ダイスケ）
有限会社秋田工芸木工,7410002000297,木材・木製品製造業（家具を除く）,〒010-1612秋田県秋田市新屋豊町19-16,0188649640（018-864-9640）,3000（千円）,山形　純三（ヤマガタ ジユンゾウ）
有限会社秋田ゴム化成,7410002000339,その他の製造業,〒010-1423秋田県秋田市仁井田古川向362-7,0188397820（018-839-7820）,3000（千円）,嵯峨　誠（サガ マコト）
有限会社伊藤石材店,7410002000652,窯業・土石製品製造業,〒010-1417秋田県秋田市四ツ小屋古川敷66-1,0188398114（018-839-8114）,5000（千円）,伊藤　善次（イトウ ゼンジ）
有限会社フラックス,7410002003300,出版・印刷・同関連産業,〒010-0062秋田県秋田市牛島東7-11-5,0188340383（018-834-0383）,4000（千円）,佐藤　雅宏（サトウ マサヒロ）
有限会社堀井鉄工,7410002003432,金属製品製造業,〒010-1611秋田県秋田市新屋天秤野1-31,0188235976（018-823-5976）,3000（千円）,堀井　義人（ホリイ ヨシヒト）
有限会社ミカサ,7410002004307,その他の製造業,〒011-0909秋田県秋田市寺内児桜3-7-3,0188160516（018-816-0516）,3000（千円）,渡部　靖一（ワタナベ セイイチ）
有限会社佐藤徳太郎商店,7410002005619,食料品・飼料・飲料製造業,〒018-1401秋田県潟上市昭和大久保宮の前162-1,0188773224（018-877-3224）,9000（千円）,佐藤　進幸（サトウ シンコウ）
有限会社阿部畳店,7410002006526,その他の製造業,〒015-0075秋田県由利本荘市花畑町4-52,0184225040（0184-22-5040）,10000（千円）,阿部　昇（アベ ノボル）
有限会社サトーシート,7410002006682,衣服・その他の繊維製品製造業,〒015-0861秋田県由利本荘市御門225-1,0184232260（0184-23-2260）,3000（千円）,佐藤　薫（サトウ カオル）
有限会社マルイチしょうゆ・みそ醸造元,7410002006897,食料品・飼料・飲料製造業,〒015-0011秋田県由利本荘市石脇石脇11,0184220006（0184-22-0006）,5200（千円）,齊藤　久一郎（サイトウ キユウイチロウ）
有限会社アイミング,7410002007004,その他の製造業,〒018-0604秋田県由利本荘市西目町沼田新道下287-5,0184334286（0184-33-4286）,10000（千円）,齋藤　淳（サイトウ ジユン）
有限会社サミットファイブ,7410002007160,衣服・その他の繊維製品製造業,〒015-0202秋田県由利本荘市東由利蔵上ノ山29-10,0184693955（0184-69-3955）,5000（千円）,佐野　拓和（サノ タクカズ）
有限会社出羽印刷,7410002007342,出版・印刷・同関連産業,〒018-0158秋田県にかほ市象潟町字琴和喜33-5,0184433557（0184-43-3557）,5000（千円）,金　一二（コン カツジ）
有限会社阿部加工所,7410002007425,一般機械器具製造業,〒018-0411秋田県にかほ市院内脇田11,0184363214（0184-36-3214）,3000（千円）,阿部　房士（アベ フサシ）
有限会社けやき,7410002007508,電気機械器具製造業,〒015-0505秋田県由利本荘市鳥海町小川上根子31,0184592388（0184-59-2388）,3000（千円）,佐藤　嘉毅（サトウ ヨシタケ）
有限会社マルイチ,7410002007532,食料品・飼料・飲料製造業,〒015-0011秋田県由利本荘市石脇石脇11,0184220006（0184-22-0006）,5200（千円）,齊藤　久一郎（サイトウ キユウイチロウ）
有限会社根元泰蔵商店,7410002007912,家具・装備品製造業,〒012-0105秋田県湯沢市川連町下平城116,0183425500（0183-42-5500）,3000（千円）,代表取締役社長／根元　次郎（ネモト ジロウ）
有限会社飯沢縫製,7410002007929,衣服・その他の繊維製品製造業,〒012-1100秋田県雄勝郡羽後町字南西馬音内148-1,0183625035（0183-62-5035）,3000（千円）,伊藤　俊光（イトウ トシミツ）
有限会社田村縫製,7410002008646,衣服・その他の繊維製品製造業,〒017-0046秋田県大館市清水5-7-70,0186492187（0186-49-2187）,3000（千円）,田村　和雄（タムラ カズオ）
有限会社ナチュレ,7410002008935,衣服・その他の繊維製品製造業,〒018-3504秋田県大館市長坂坂地家後97-2,0186546852（0186-54-6852）,3000（千円）,篠原　宏（シノハラ ヒロシ）
有限会社プリントハウス,7410002009504,"繊維工業（衣服,その他の繊維製品を除く）",〒018-3454秋田県北秋田市脇神東陣場岱145-1,0186631130（0186-63-1130）,5000（千円）,小塚　嘉英（コヅカ ヨシヒデ）
有限会社八幡平フーズ,7410002009867,食料品・飼料・飲料製造業,〒018-5141秋田県鹿角市八幡平小山113-2,0186322256（0186-32-2256）,5700（千円）,畠山　大和（ハタケヤマ ヤマト）
有限会社菊地木工工業,7410002010189,家具・装備品製造業,〒016-0013秋田県能代市向能代トドメキ104-16,0185551235（0185-55-1235）,5000（千円）,菊地　彌彦（キクチ ヤスヒコ）
有限会社協和商会,7410002010206,木材・木製品製造業（家具を除く）,〒016-0111秋田県能代市字仁井田白山101,0185701240（0185-70-1240）,3000（千円）,田中　文男（タナカ フミオ）
有限会社能代中央食品,7410002010437,食料品・飼料・飲料製造業,〒016-0179秋田県能代市浅内浜浅内10,0185550841（0185-55-0841）,3000（千円）,山田　文雄（ヤマダ フミオ）
有限会社峰浜砕石,7410002010560,窯業・土石製品製造業,〒016-0014秋田県能代市落合砂田123-1,0185533332（0185-53-3332）,6500（千円）,平塚　正喜（ヒラツカ マサキ）
有限会社三浦石材工業,7410002010569,窯業・土石製品製造業,〒016-0891秋田県能代市西通町2-9,0185526476（0185-52-6476）,5000（千円）,三浦　正明（ミウラ マサアキ）
有限会社ウエスト製甲,7410002011245,皮革・同製品・毛皮製造業,〒014-0065秋田県大仙市下深井相布65,0187636940（0187-63-6940）,3000（千円）,西村　昇（ニシムラ ノボル）
有限会社県南工業,7410002011402,金属製品製造業,〒014-0207秋田県大仙市長野太田袋45-1,0187562573（0187-56-2573）,5000（千円）,佐藤　正司（サトウ シヨウジ）
有限会社中央空調工業,7410002011674,金属製品製造業,〒014-0073秋田県大仙市内小友北太田270-1,0187682573（0187-68-2573）,6000（千円）,辻　章孝（ツジ フミタカ）
有限会社田口石材,7410002012193,窯業・土石製品製造業,〒019-2112秋田県大仙市刈和野233-1,0187750229（0187-75-0229）,3000（千円）,田口　順一（タグチ ジユンイチ）
有限会社光エレクトロニクス,7410002012227,電気機械器具製造業,〒019-2202秋田県大仙市大沢郷宿笹摘台33-1,0187781931（0187-78-1931）,5000（千円）,三浦　龍久（ミウラ リユウキユウ）
有限会社エヌエッチ豊成,7410002012268,衣服・その他の繊維製品製造業,〒014-0711秋田県大仙市豊川上水無73-1,0187572357（0187-57-2357）,5000（千円）,高橋　寛（タカハシ ヒロシ）
株式会社門脇木材,7410002012490,木材・木製品製造業（家具を除く）,〒014-1113秋田県仙北市田沢湖卒田柴倉135,0187442942（0187-44-2942）,52500（千円）,代表取締役社長／門脇　桂孝（カドワキ ケイコウ）
有限会社鶴見縫製,7410002013134,衣服・その他の繊維製品製造業,〒013-0042秋田県横手市前郷東松原38-34,0182333669（0182-33-3669）,3000（千円）,高橋　重五郎（タカハシ ジユウゴロウ）
有限会社知喜プレスセンター,7410002013150,衣服・その他の繊維製品製造業,〒013-0001秋田県横手市杉沢中杉沢592-26,0182334802（0182-33-4802）,7000（千円）,相馬　誠知（ソウマ セイチ）
有限会社アルファー精機,7410002013365,金属製品製造業,〒013-0105秋田県横手市平鹿町浅舞大中島140,0182240856（0182-24-0856）,5000（千円）,伊藤　博（イトウ ヒロシ）
有限会社キョウリツ電子,7410002013563,電気機械器具製造業,〒013-0071秋田県横手市八幡十二柳242,0182357040（0182-35-7040）,5000（千円）,高橋　要（タカハシ カナメ）
有限会社十文字光学,7410002013786,窯業・土石製品製造業,〒019-0505秋田県横手市十文字町仁井田家西5-6,0182420367（0182-42-0367）,24000（千円）,大木　紀子（オオキ ノリコ）
有限会社高橋製作所,7410002013811,その他の製造業,〒019-0711秋田県横手市増田町荻袋鍋ヶ沢259,0182459171（0182-45-9171）,3000（千円）,高橋　良敏（タカハシ ヨシトシ）
有限会社モテック,7410002013860,電気機械器具製造業,〒019-0508秋田県横手市十文字町十五野新田富沢屋布上58-18,0182420861（0182-42-0861）,5000（千円）,持山　文嘉（モチヤマ フミヨシ）
合資会社佐藤製パン所,7410003001063,食料品・飼料・飲料製造業,〒012-0804秋田県湯沢市杉沢戸石崎112-5,0183732921（0183-73-2921）,"",佐藤　忠江（サトウ チユウエ）
合名会社西村醸造店,7410003001781,食料品・飼料・飲料製造業,〒016-0811秋田県能代市日吉町14-28,0185523341（0185-52-3341）,"",西村　佑一（ニシムラ ユウイチ）
農事組合法人おばこ食品,7410005004394,食料品・飼料・飲料製造業,〒019-2521秋田県大仙市協和稲沢釜ノ川沢32,0188942330（018-894-2330）,5000（千円）,鈴木　辰美（スズキ タツミ）
農事組合法人エコファーム,7410005004634,食料品・飼料・飲料製造業,〒019-2441秋田県大仙市協和小種鏡台2-1,0188962670（018-896-2670）,200（千円）,佐藤　誠（サトウ マコト）
秋木加工株式会社,8410001000017,木材・木製品製造業（家具を除く）,〒010-1601秋田県秋田市向浜1-8-2,0188237265（018-823-7265）,10000（千円）,佐藤　雅浩（サトウ マサヒロ）
新政酒造株式会社,8410001000157,食料品・飼料・飲料製造業,〒010-0921秋田県秋田市大町6-2-35,0188236407（018-823-6407）,15000（千円）,代表取締役社長／佐藤　祐輔（サトウ ユウスケ）
株式会社秋田魁新報社,8410001000330,出版・印刷・同関連産業,〒010-0956秋田県秋田市山王臨海町1-1,0188881800（018-888-1800）,180000（千円）,代表取締役社長／小笠原　直樹（オガサワラ ナオキ）
秋田酒類製造株式会社,8410001000388,食料品・飼料・飲料製造業,〒010-0934秋田県秋田市川元むつみ町4-12,0188647331（018-864-7331）,60000（千円）,代表取締役社長／平川　順一（ヒラカワ ジユンイチ）
秋田パネル株式会社,8410001000537,木材・木製品製造業（家具を除く）,〒010-1612秋田県秋田市新屋豊町8-59,0188637971（018-863-7971）,10000（千円）,代表取締役社長／渡辺　武博（ワタナベ タケヒロ）
株式会社工藤鉄工所,8410001001015,金属製品製造業,〒011-0903秋田県秋田市寺内油田3-5-5,0188451219（018-845-1219）,10000（千円）,工藤　裕（クドウ ユタカ）
株式会社中央サイン,8410001001717,その他の製造業,〒010-0804秋田県秋田市外旭川八幡田2-2-28,0188685151（018-868-5151）,10000（千円）,三浦　正人（ミウラ マサト）
東北通商株式会社,8410001001923,一般機械器具製造業,〒010-0062秋田県秋田市牛島東7-9-10,0188327055（018-832-7055）,10000（千円）,青木　聰（アオキ サトシ）
北斗製氷株式会社,8410001002319,食料品・飼料・飲料製造業,〒010-0875秋田県秋田市千秋明徳町1-21,0188323415（018-832-3415）,33750（千円）,鈴木　賢一郎（スズキ ケンイチロウ）
株式会社マツザワ,8410001002392,精密機械・医療機械器具製造業,〒019-2611秋田県秋田市河辺戸島七曲台120-19,0188824580（018-882-4580）,40000（千円）,安保　徹（アンボ トオル）
株式会社松原印刷社,8410001002401,出版・印刷・同関連産業,〒010-0951秋田県秋田市山王7-5-29,0188628760（018-862-8760）,10000（千円）,松原　巧（マツバラ コウ）
サンセイエンタープライズ株式会社,8410001002979,電気機械器具製造業,〒010-0065秋田県秋田市茨島2-6-23-2階,0188236717（018-823-6717）,10000（千円）,佐藤　金次（サトウ キンジ）
株式会社ワークス・アキタ,8410001003408,衣服・その他の繊維製品製造業,〒018-1606秋田県南秋田郡八郎潟町夜叉袋沖谷地173-1,0188753011（018-875-3011）,20000（千円）,鈴木　玲子（スズキ レイコ）
株式会社菅英佃煮本舗,8410001003449,食料品・飼料・飲料製造業,〒018-1402秋田県潟上市昭和乱橋古開119,0188772024（018-877-2024）,10000（千円）,菅原　英孝（スガワラ ヒデタカ）
株式会社秋田魁新報印刷,8410001003572,出版・印刷・同関連産業,〒010-1419秋田県秋田市御所野堤台1-2-1,0188896030（018-889-6030）,10000（千円）,代表取締役社長／佐川　博之（サガワ ヒロユキ）
株式会社宮城屋蒲鉾店,8410001003894,食料品・飼料・飲料製造業,〒010-0031秋田県秋田市楢山大元町11-5,0188330321（018-833-0321）,8500（千円）,後藤　繁雄（ゴトウ シゲオ）
男鹿寒風石工業株式会社,8410001004034,窯業・土石製品製造業,〒010-0342秋田県男鹿市脇本脇本上野115,0185253121（0185-25-3121）,30000（千円）,代表取締役社長／山内　信人（ヤマウチ マコト）
秋田誉酒造株式会社,8410001004711,食料品・飼料・飲料製造業,〒015-0875秋田県由利本荘市砂子下3,0184225231（0184-22-5231）,10000（千円）,代表取締役社長／猪股　春夫（イノマタ ハルオ）
株式会社本間印刷所,8410001004810,出版・印刷・同関連産業,〒015-0817秋田県由利本荘市中町10,0184221436（0184-22-1436）,10000（千円）,本間　正樹（ホンマ マサキ）
ＴＤＫ羽後株式会社,8410001005016,電気機械器具製造業,〒018-0731秋田県由利本荘市大内三川払川146-1,0184652197（0184-65-2197）,106000（千円）,林　隆司（ハヤシ リユウジ）
株式会社キサカタ製作所,8410001005098,一般機械器具製造業,〒018-0133秋田県にかほ市象潟町関西大坂1-52,0184433350（0184-43-3350）,15000（千円）,斎藤　成徳（サイトウ シゲヨシ）
ダイワ工業株式会社,8410001005131,一般機械器具製造業,〒018-0302秋田県にかほ市黒川平森58-4,0184382511（0184-38-2511）,80000（千円）,代表取締役社長／柿崎　清七（カキザキ セイシチ）
鳥海砕石株式会社,8410001005156,窯業・土石製品製造業,〒015-0721秋田県由利本荘市鳥海町上笹子砥沢101,0184592154（0184-59-2154）,26000（千円）,山科　優（ヤマシナ マサル）
矢島物産株式会社,8410001005239,食料品・飼料・飲料製造業,〒015-0411秋田県由利本荘市矢島町城内八森下532-2,0184562247（0184-56-2247）,10000（千円）,土田　典子（ツチダ ノリコ）
株式会社進プレ,8410001005313,金属製品製造業,〒018-0133秋田県にかほ市象潟町関西大坂1-54,0184433906（0184-43-3906）,12000（千円）,代表取締役社長／齋藤　幸安（サイトウ ユキヤス）
株式会社エムシューズ,8410001005453,皮革・同製品・毛皮製造業,〒012-0802秋田県湯沢市成沢上堤85,0183738680（0183-73-8680）,10000（千円）,三浦　眞護（ミウラ シンゴ）
株式会社奥山儀助商店,8410001005461,食料品・飼料・飲料製造業,〒012-0851秋田県湯沢市吹張1-2-40,0183725111（0183-72-5111）,10000（千円）,奥山　純一（オクヤマ ジユンイチ）
秋田電装株式会社,8410001005643,電気機械器具製造業,〒012-1121秋田県雄勝郡羽後町大久保柏原34,0183622129（0183-62-2129）,60000（千円）,代表取締役社長／柿崎　光夫（カキザキ ミツオ）
雄勝電子株式会社,8410001005684,電気機械器具製造業,〒019-0205秋田県湯沢市小野桐木田177-2,0183524016（0183-52-4016）,13000（千円）,高橋　輝雄（タカハシ テルオ）
秋田木毛セメント板株式会社,8410001005899,窯業・土石製品製造業,〒017-0012秋田県大館市釈迦内山神台64,0186485122（0186-48-5122）,10000（千円）,代表取締役社長／伊藤　修（イトウ オサム）
大館曲物曲輪工業株式会社,8410001005932,木材・木製品製造業（家具を除く）,〒017-0044秋田県大館市御成町4-6-9,0186421483（0186-42-1483）,10000（千円）,浅井　幸精（アサイ コウセイ）
株式会社シャルドン,8410001006030,衣服・その他の繊維製品製造業,〒017-0868秋田県大館市南神明町2-43,0186497127（0186-49-7127）,10000（千円）,田尻　和弥（タジリ カズヤ）
株式会社沓澤製材所,8410001006096,木材・木製品製造業（家具を除く）,〒017-0012秋田県大館市釈迦内街道上154,0186483141（0186-48-3141）,70000（千円）,代表取締役社長／沓澤　一英（クツザワ カズヒデ）
株式会社フレックス,8410001006121,家具・装備品製造業,〒017-0005秋田県大館市花岡町前田40-28,0186462161（0186-46-2161）,45000（千円）,代表取締役社長／野村　幸三郎（ノムラ コウザブロウ）
吉田木材株式会社,8410001006204,木材・木製品製造業（家具を除く）,〒018-3505秋田県大館市早口深沢岱5-43,0186542008（0186-54-2008）,10000（千円）,吉田　正之（ヨシダ マサユキ）
株式会社吉原鉄工,8410001006245,金属製品製造業,〒018-5731秋田県大館市比内町笹館沼田128-1,0186550601（0186-55-0601）,10000（千円）,代表取締役社長／吉原　秀吉（ヨシワラ ヒデヨシ）
秋田ウッド株式会社,8410001006286,木材・木製品製造業（家具を除く）,〒017-0002秋田県大館市白沢松原570,0186472230（0186-47-2230）,85000（千円）,代表取締役社長／佐藤　清忠（サトウ キヨタダ）
鹿角エヌ・シー・エル株式会社,8410001006294,電気機械器具製造業,〒018-5334秋田県鹿角市十和田毛馬内南陣場56,0186353911（0186-35-3911）,10000（千円）,高橋　建一（タカハシ ケンイチ）
九島木材株式会社,8410001006419,木材・木製品製造業（家具を除く）,〒018-3333秋田県北秋田市坊沢中柳生95,0186620137（0186-62-0137）,32000（千円）,荘　憲二（シヨウ ケンジ）
秋田青木精機株式会社,8410001006435,輸送用機械器具製造業,〒018-4231秋田県北秋田市上杉金沢417-2,0186784078（0186-78-4078）,89760（千円）,青木　良輔（アオキ リヨウスケ）
株式会社鷹巣ゴム工業,8410001006451,ゴム製品製造業,〒018-3454秋田県北秋田市脇神米ノ岱23-40,0186630271（0186-63-0271）,10000（千円）,宮野　慶子（ミヤノ ケイコ）
藤島林産株式会社,8410001006468,木材・木製品製造業（家具を除く）,〒018-3301秋田県北秋田市綴子田中下モ31,0186620390（0186-62-0390）,10000（千円）,代表取締役社長／藤島　眞砂子（フジシマ マサコ）
株式会社エドウイン小坂ジーンズ,8410001006492,衣服・その他の繊維製品製造業,〒017-0204秋田県鹿角郡小坂町荒谷三ツ森1,0186293725（0186-29-3725）,20000（千円）,大塚　丈二（オオツカ ジヨウジ）
株式会社アイカ,8410001006534,皮革・同製品・毛皮製造業,〒018-5141秋田県鹿角市八幡平中谷地31-2,0186323511（0186-32-3511）,10000（千円）,堀田　光政（ホツタ ミツマサ）
株式会社秋田北報社,8410001006872,出版・印刷・同関連産業,〒018-5701秋田県大館市比内町扇田中扇田25,0186550214（0186-55-0214）,300（千円）,斉藤　仁（サイトウ ヒトシ）
小坂製錬株式会社,8410001006930,"鉄鋼業,非鉄金属製造業",〒017-0202秋田県鹿角郡小坂町小坂鉱山尾樽部60-1,0186292710（0186-29-2710）,4700000（千円）,代表取締役社長／川口　純（カワグチ ジユン）
株式会社北羽新報社,8410001007243,出版・印刷・同関連産業,〒016-0891秋田県能代市西通町3-2,0185543150（0185-54-3150）,12000（千円）,代表取締役社長／山木　泰正（ヤマキ ヤスマサ）
株式会社安藤食品,8410001007367,食料品・飼料・飲料製造業,〒018-2303秋田県山本郡三種町森岳泉八日138,0185832165（0185-83-2165）,20000（千円）,安藤　賢蔵（アンドウ ケンゾウ）
株式会社県北パネル,8410001007425,木材・木製品製造業（家具を除く）,〒018-3101秋田県能代市二ツ井町麻生上ノ野9-4,0185732732（0185-73-2732）,10000（千円）,簾内　匡（スノウチ タダシ）
八峰白神自然食品株式会社,8410001007615,化学工業,〒018-2623秋田県山本郡八峰町八森字滝の間324-5,0185704755（0185-70-4755）,8600（千円）,鈴木　勇（スズキ イサム）
株式会社ＹＭＫ,8410001007771,一般機械器具製造業,〒018-0301秋田県にかほ市飛餅田13-2,0184746328（0184-74-6328）,3000（千円）,横山　正雄（ヨコヤマ マサオ）
株式会社タニタ秋田,8410001008010,精密機械・医療機械器具製造業,〒014-0113秋田県大仙市堀見内下田茂木添28-1,0187662122（0187-66-2122）,80000（千円）,田口　和美（タグチ カズミ）
福乃友酒造株式会社,8410001008051,食料品・飼料・飲料製造業,〒019-1701秋田県大仙市神宮寺本郷野82-6,0187724141（0187-72-4141）,36000（千円）,一星　雅彦（イチボシ マサヒコ）
株式会社北日本花火興業,8410001008126,その他の製造業,〒019-1701秋田県大仙市神宮寺下金葛320,0187722205（0187-72-2205）,20000（千円）,今野　義和（コンノ ヨシカズ）
秋田上日工業株式会社,8410001008233,輸送用機械器具製造業,〒014-0205秋田県大仙市鑓見内野中248-1,0187562411（0187-56-2411）,10000（千円）,大庭　誠芳（オオバ マサヨシ）
