会社名,法人番号,業種,住所,電話番号,資本金,代表氏名
株式会社品川合成製作所,1010701004082,その他の製造業,〒013-0106秋田県横手市平鹿町中吉田上藤根192,0182242181（0182-24-2181）,11000（千円）,代表取締役社長／佐藤　貴（サトウ タカシ）
新生グラビア株式会社,1150001006526,出版・印刷・同関連産業,〒016-0171秋田県能代市河戸川南西山18-5,0185545667（0185-54-5667）,20000（千円）,内山　明（ウチヤマ アキラ）
秋田カイハツ生コンクリート株式会社,1410001000213,窯業・土石製品製造業,〒011-0901秋田県秋田市寺内蛭根85-18,0188452169（018-845-2169）,25000（千円）,松渕　愼司（マツブチ シンジ）
株式会社秋田メタル,1410001000568,金属製品製造業,〒010-0038秋田県秋田市楢山城南新町33-21,0188351295（018-835-1295）,15000（千円）,渡部　昇（ワタナベ ノボル）
株式会社フロム・エー,1410001001087,出版・印刷・同関連産業,〒010-0061秋田県秋田市卸町3-5-5,0188643784（018-864-3784）,10000（千円）,五嶋　建二（ゴシマ ケンジ）
株式会社新和工芸,1410001001418,その他の製造業,〒011-0901秋田県秋田市寺内蛭根85-64,0188633721（018-863-3721）,10000（千円）,石塚　敏博（イシヅカ トシヒロ）
株式会社杉山寿山堂,1410001001434,食料品・飼料・飲料製造業,〒010-0941秋田県秋田市川尻町大川反233-199,0188235185（018-823-5185）,15000（千円）,藤井　明（フジイ アキラ）
株式会社田口フードサービス,1410001001665,食料品・飼料・飲料製造業,〒010-1633秋田県秋田市新屋鳥木町4-46,0188280178（018-828-0178）,30000（千円）,代表取締役社長／田口　明（タグチ アキラ）
株式会社東北機工,1410001001905,金属製品製造業,〒010-1601秋田県秋田市向浜1-5-17,0188637154（018-863-7154）,10000（千円）,長尾　征史（ナガオ マサフミ）
日本メッキ株式会社,1410001002077,金属製品製造業,〒011-0951秋田県秋田市土崎港相染町浜ナシ山123-3,0188454643（018-845-4643）,20000（千円）,伊藤　芳信（イトウ ヨシノブ）
株式会社増田鉄工場,1410001002382,一般機械器具製造業,〒010-0951秋田県秋田市山王6-11-3,0188236436（018-823-6436）,70000（千円）,代表取締役社長／雜賀　匠（サイカ タクミ）
ユーティーケー工業株式会社,1410001002614,金属製品製造業,〒019-2611秋田県秋田市河辺戸島七曲台120-18,0188823388（018-882-3388）,30000（千円）,代表取締役会長／土井　義昭（ドイ ヨシアキ）
井川機械工業株式会社,1410001003380,一般機械器具製造業,〒018-1523秋田県南秋田郡井川町坂本三嶽下168,0188742425（018-874-2425）,10000（千円）,小林　憲一郎（コバヤシ ケンイチロウ）
株式会社共同スチール,1410001003752,金属製品製造業,〒011-0951秋田県秋田市土崎港相染町浜ナシ山113-1,0188806808（018-880-6808）,2000（千円）,野村　伊佐夫（ノムラ イサオ）
株式会社秋田鋼機工業所,1410001003868,金属製品製造業,〒010-1601秋田県秋田市向浜1-5-13,0188627322（018-862-7322）,10000（千円）,高橋　健一（タカハシ ケンイチ）
株式会社モリセイ秋田工場,1410001004148,輸送用機械器具製造業,〒010-0431秋田県男鹿市払戸横長根54-5,0185463123（0185-46-3123）,60000（千円）,毛利　隆（モウリ タカシ）
由利カイハツ生コンクリート株式会社,1410001004949,窯業・土石製品製造業,〒015-0055秋田県由利本荘市土谷金山沢5-10,0184231063（0184-23-1063）,20000（千円）,代表取締役社長／金野　博（コンノ ヒロシ）
株式会社秋田マシナリー,1410001005088,金属製品製造業,〒018-0148秋田県にかほ市象潟町字下浜山9-20,0184432236（0184-43-2236）,10000（千円）,渋谷　市子（シブヤ イチコ）
日南工業株式会社,1410001005187,食料品・飼料・飲料製造業,〒018-0411秋田県にかほ市院内此木沢6,0184362111（0184-36-2111）,26500（千円）,代表取締役社長／細谷　広志（ホソヤ ヒロシ）
矢島通商株式会社,1410001005237,衣服・その他の繊維製品製造業,〒015-0412秋田県由利本荘市矢島町川辺道端45,0184562317（0184-56-2317）,10000（千円）,原　浩彰（ハラ ヒロアキ）
株式会社秋田ニューバイオファーム,1410001005261,食料品・飼料・飲料製造業,〒018-0604秋田県由利本荘市西目町沼田新道下490-5,0184334150（0184-33-4150）,80600（千円）,代表取締役社長／鈴木　幸夫（スズキ ユキオ）
株式会社システムインアート,1410001005311,一般機械器具製造業,〒018-0604秋田県由利本荘市西目町沼田新道下2-101,0184332845（0184-33-2845）,3000（千円）,田口　俊一（タグチ シユンイチ）
株式会社うえさか,1410001005609,家具・装備品製造業,〒012-0105秋田県湯沢市川連町高掵下7,0183422136（0183-42-2136）,20000（千円）,上坂　憲一郎（ウエサカ ケンイチロウ）
株式会社小町の国手づくり工房,1410001005848,食料品・飼料・飲料製造業,〒019-0321秋田県湯沢市秋ノ宮小渕ケ沢14,0183552969（0183-55-2969）,261900（千円）,高橋　チヱ子（タカハシ チエコ）
株式会社北鹿,1410001006136,食料品・飼料・飲料製造業,〒017-0043秋田県大館市有浦2-2-3,0186422101（0186-42-2101）,30000（千円）,代表取締役会長／小山　景一（コヤマ ケイイチ）
櫻庭木材株式会社,1410001006350,木材・木製品製造業（家具を除く）,〒018-4513秋田県北秋田市小又堂の下44-3,0186752031（0186-75-2031）,90000（千円）,代表取締役社長／後藤　則明（ゴトウ ノリアキ）
秋田扶桑精工株式会社,1410001006383,一般機械器具製造業,〒018-4231秋田県北秋田市上杉金沢178-710,0186784111（0186-78-4111）,30000（千円）,前田　順也（マエダ ジユンヤ）
株式会社佐藤材木店,1410001006425,木材・木製品製造業（家具を除く）,〒018-3333秋田県北秋田市坊沢深関街道下17,0186620718（0186-62-0718）,10000（千円）,佐藤　雅樹（サトウ マサキ）
秋田リサイクル・アンド・ファインパック株式会社,1410001006490,"鉄鋼業,非鉄金属製造業",〒017-0202秋田県鹿角郡小坂町小坂鉱山尾樽部76-1,0186292188（0186-29-2188）,40000（千円）,代表取締役／木村　鋭（キムラ エイ）
十和田カイハツ生コンクリート株式会社,1410001006631,窯業・土石製品製造業,〒018-5334秋田県鹿角市十和田毛馬内下土ケ久保19-7,0186352320（0186-35-2320）,15000（千円）,代表取締役社長／渡邊　初男（ワタナベ ハツオ）
株式会社ミートランド,1410001006672,食料品・飼料・飲料製造業,〒018-5141秋田県鹿角市八幡平外川原31-1,0186323010（0186-32-3010）,451200（千円）,代表取締役社長／山本　秀樹（ヤマモト ヒデキ）
米代産業株式会社,1410001006689,窯業・土石製品製造業,〒018-5337秋田県鹿角市十和田末広白根方65-1,0186353164（0186-35-3164）,10000（千円）,板橋　努（イタバシ ツトム）
アキタクロージング株式会社,1410001006697,衣服・その他の繊維製品製造業,〒018-5745秋田県大館市比内町片貝伊勢堂北94,0186552912（0186-55-2912）,30000（千円）,塩谷　良久（エンヤ ヨシヒサ）
株式会社カネイ溶接,1410001006929,金属製品製造業,〒018-5201秋田県鹿角市花輪上中島82,0186258234（0186-25-8234）,1000（千円）,門脇　早江子（カドワキ サエコ）
株式会社トワダソーラー,1410001006961,電気機械器具製造業,〒018-5331秋田県鹿角市十和田山根上ノ平1-3,0186352010（0186-35-2010）,150000（千円）,青山　文明（アオヤマ ノリアキ）
株式会社大潟印刷,1410001007043,出版・印刷・同関連産業,〒016-0806秋田県能代市清助町2-2,0185546633（0185-54-6633）,20000（千円）,代表取締役社長／大嶋　治（オオシマ オサム）
丸秋段ボール工業株式会社,1410001007258,パルプ・紙・紙加工品製造業,〒016-0121秋田県能代市鰄渕古川反55,0185582980（0185-58-2980）,10000（千円）,禿　卓味（カムロ タクミ）
株式会社グラノプト,1410001007530,電気機械器具製造業,〒016-0122秋田県能代市扇田扇渕4-4,0185701800（0185-70-1800）,150000（千円）,代表取締役社長／関和　秀幸（セキワ ヒデユキ）
秋田県南生コン株式会社,1410001007836,窯業・土石製品製造業,〒014-0001秋田県大仙市花館大戸下川原3-26,0187621397（0187-62-1397）,25000（千円）,佐々木　勇（ササキ イサム）
ナガイ白衣工業株式会社,1410001008033,衣服・その他の繊維製品製造業,〒019-1701秋田県大仙市神宮寺内大坪67,0187871155（0187-87-1155）,50000（千円）,代表取締役社長／澤登　一郎（サワノボリ イチロウ）
株式会社ミラドール,1410001008082,衣服・その他の繊維製品製造業,〒019-1701秋田県大仙市神宮寺宇留井谷地26-2,0187723923（0187-72-3923）,10000（千円）,高寺　一（タカテラ ハジメ）
株式会社秋田今野商店,1410001008173,食料品・飼料・飲料製造業,〒014-0000秋田県大仙市字刈和野248,0187751250（0187-75-1250）,36000（千円）,代表取締役社長／今野　宏（コンノ ヒロシ）
今泉ピーエスエム株式会社,1410001008181,金属製品製造業,〒019-2111秋田県大仙市土川刈布沢24-25,0187751350（0187-75-1350）,10000（千円）,今泉　寿生（イマイズミ トシオ）
株式会社ユーイーアイ,1410001008388,皮革・同製品・毛皮製造業,〒014-0067秋田県大仙市飯田大道端40-14,0187638027（0187-63-8027）,10000（千円）,加藤　タヱ（カトウ タエ）
株式会社谷口,1410001008537,金属製品製造業,〒014-1115秋田県仙北市田沢湖小松城廻99-5,0187544161（0187-54-4161）,10000（千円）,谷口　忠徳（タニグチ タダノリ）
阿櫻酒造株式会社,1410001008768,食料品・飼料・飲料製造業,〒013-0041秋田県横手市大沢西野67-2,0182320126（0182-32-0126）,60000（千円）,田中　文悟（タナカ ブンゴ）
株式会社京家,1410001008818,食料品・飼料・飲料製造業,〒013-0052秋田県横手市大屋寺内堀ノ内337-2,0182335918（0182-33-5918）,10000（千円）,藤井　武雄（フジイ タケオ）
株式会社トラストシール,1410001008875,出版・印刷・同関連産業,〒013-0351秋田県横手市大雄字田根森東103-5,0182523732（0182-52-3732）,20000（千円）,高橋　進（タカハシ ススム）
横手精工株式会社,1410001008941,電気機械器具製造業,〒013-0811秋田県横手市安本南御所野10-18,0182325211（0182-32-5211）,80000（千円）,代表取締役社長／佐々木　又英（ササキ マタヒデ）
株式会社美遊希,1410001009023,衣服・その他の繊維製品製造業,〒013-0561秋田県横手市大森町八沢木中房5-6,0182263232（0182-26-3232）,10000（千円）,佐々木　隆（ササキ タカシ）
株式会社サン・プレシジョン,1410001009114,一般機械器具製造業,〒013-0001秋田県横手市杉沢中杉沢535-3,0182328411（0182-32-8411）,10000（千円）,山本　承義（ヤマモト シゲヨシ）
株式会社ワシヤ木工,1410001009873,家具・装備品製造業,〒018-3103秋田県能代市二ツ井町荷上場中島115,0185733450（0185-73-3450）,14000（千円）,菊池　利彦（キクチ トシヒコ）
株式会社ナガクラ,1410001010138,衣服・その他の繊維製品製造業,〒019-0509秋田県横手市十文字町梨木沖野10-2,0182424335（0182-42-4335）,1000（千円）,長倉　稔一（ナガクラ トシカズ）
有限会社猪田石材店,1410002000699,窯業・土石製品製造業,〒010-0062秋田県秋田市牛島東1-10-32,0188336470（018-833-6470）,3000（千円）,猪田　博樹（イノタ ヒロキ）
有限会社ウサモト,1410002000757,食料品・飼料・飲料製造業,〒010-0001秋田県秋田市中通5-5-20,0188326982（018-832-6982）,3000（千円）,船木　保郎（フナキ ヤスロウ）
有限会社今野木工所,1410002001549,家具・装備品製造業,〒010-0035秋田県秋田市楢山城南町4-5,0188327933（018-832-7933）,3000（千円）,今野　敏範（コンノ トシノリ）
有限会社三皇シーリング,1410002001648,出版・印刷・同関連産業,〒010-0063秋田県秋田市牛島西3-5-11,0188647021（018-864-7021）,3000（千円）,柴田　忍（シバタ シノブ）
有限会社サトウ工芸,1410002001763,その他の製造業,〒010-1605秋田県秋田市新屋勝平町8-38,0188634222（018-863-4222）,3000（千円）,佐藤　信之（サトウ ノブユキ）
有限会社佐田商店,1410002001813,食料品・飼料・飲料製造業,〒011-0946秋田県秋田市土崎港中央1-1-1,0188450755（018-845-0755）,3000（千円）,代表取締役社長／佐田　博（サタ ヒロシ）
有限会社司アート,1410002002563,パルプ・紙・紙加工品製造業,〒010-1427秋田県秋田市仁井田新田1-3-36,0188395513（018-839-5513）,4000（千円）,庄司　十喜雄（シヨウジ トキオ）
有限会社村田屋,1410002003677,食料品・飼料・飲料製造業,〒010-0062秋田県秋田市牛島東5-9-28,0188322839（018-832-2839）,3000（千円）,円城寺　洋（エンジヨウジ ヒロシ）
有限会社矢沢ネオン工業,1410002003751,その他の製造業,〒010-0063秋田県秋田市牛島西1-1-47,0188344419（018-834-4419）,3000（千円）,矢沢　郁雄（ヤザワ イクオ）
有限会社エーシーピー,1410002005467,パルプ・紙・紙加工品製造業,〒010-0201秋田県潟上市天王棒沼台300-4,0188722400（018-872-2400）,3000（千円）,勘林　志津子（カンバヤシ シヅコ）
有限会社大原木工所,1410002005475,家具・装備品製造業,〒018-1502秋田県潟上市飯田川下虻川屋敷175,0188773413（018-877-3413）,3000（千円）,大原　貞之助（オオハラ テイノスケ）
有限会社横谷工業,1410002005946,金属製品製造業,〒018-1401秋田県潟上市昭和大久保小橋19,0188773935（018-877-3935）,3000（千円）,横谷　勉（ヨコヤ ツトム）
有限会社三和アルミ鋼建,1410002005970,金属製品製造業,〒011-0951秋田県秋田市土崎港相染町浜ナシ山17-5,0188463685（018-846-3685）,10（千円）,秋山　泰憲（アキヤマ ヤスノリ）
有限会社プレ・テック男鹿,1410002006457,金属製品製造業,〒010-0511秋田県男鹿市船川港船川海岸通り二号9-9,0185232346（0185-23-2346）,3000（千円）,渋谷　光郎（シブヤ ミツロウ）
有限会社美豊,1410002006944,一般機械器具製造業,〒015-0362秋田県由利本荘市東鮎川石垣52-19,0184328220（0184-32-8220）,3000（千円）,小松　正美（コマツ マサミ）
有限会社ケィイーシー,1410002007216,一般機械器具製造業,〒018-0103秋田県にかほ市象潟町字上狐森9-393,0184629510（0184-62-9510）,3000（千円）,熊谷　修（クマガイ オサム）
有限会社ＳＤＣアイテック,1410002007265,一般機械器具製造業,〒018-0311秋田県にかほ市金浦十二林106-6,0184384220（0184-38-4220）,3000（千円）,伊藤　知（イトウ サトリ）
有限会社工藤鉄工,1410002008404,金属製品製造業,〒017-0878秋田県大館市川口横岩岱35,0186494541（0186-49-4541）,3200（千円）,鬼川　光洋（キカワ コウヨウ）
有限会社西村鉄工所,1410002008701,金属製品製造業,〒017-0044秋田県大館市御成町4-1-3,0186490525（0186-49-0525）,10000（千円）,西村　隆吉（ニシムラ リユウキチ）
有限会社渡忠石材,1410002008767,窯業・土石製品製造業,〒017-0836秋田県大館市池内田中10,0186427628（0186-42-7628）,3000（千円）,渡部　忠孝（ワタナベ タダタカ）
有限会社菱高電機,1410002008882,電気機械器具製造業,〒017-0814秋田県大館市赤館町9-53,0186430668（0186-43-0668）,3000（千円）,小野崎　高（オノザキ タカシ）
有限会社秋田比内食品,1410002009162,食料品・飼料・飲料製造業,〒018-5712秋田県大館市比内町新館屋布79-1,0186552556（0186-55-2556）,3000（千円）,辻　與志博（ツジ ヨシヒロ）
有限会社斉藤木工,1410002009212,家具・装備品製造業,〒018-4401秋田県北秋田郡上小阿仁村沖田面小蒲野道下10,0186773631（0186-77-3631）,3000（千円）,齊藤　昭光（サイトウ アキミツ）
有限会社まつさか,1410002009294,食料品・飼料・飲料製造業,〒018-4301秋田県北秋田市米内沢長野岱102-1,"",4000（千円）,高嶋　昭夫（タカシマ アキオ）
有限会社石井石材店,1410002009633,窯業・土石製品製造業,〒018-5201秋田県鹿角市花輪下タ町59-4,0186233637（0186-23-3637）,3000（千円）,石井　久志（イシイ ヒサシ）
鹿角開発工業株式会社,1410002009674,窯業・土石製品製造業,〒018-5334秋田県鹿角市十和田毛馬内冷水22-1,0186353144（0186-35-3144）,3000（千円）,高橋　賢吾（タカハシ ケンゴ）
有限会社エムライト工業,1410002010145,金属製品製造業,〒016-0115秋田県能代市字悪戸58-1,0185701055（0185-70-1055）,3000（千円）,銭谷　正（ゼニヤ タダシ）
有限会社渡部製材所,1410002010640,木材・木製品製造業（家具を除く）,〒016-0837秋田県能代市字西赤沼1-1,0185524769（0185-52-4769）,5000（千円）,渡部　好則（ワタナベ ヨシノリ）
有限会社エス・テー・シー,1410002011267,一般機械器具製造業,〒014-0801秋田県大仙市戸地谷大和田234-1,0187626315（0187-62-6315）,4000（千円）,藤原　辰美（フジワラ タツミ）
有限会社佐藤印刷所,1410002011449,出版・印刷・同関連産業,〒014-0801秋田県大仙市戸地谷天ヶ沢204-1,0187622492（0187-62-2492）,3000（千円）,佐藤　英夫（サトウ ヒデオ）
有限会社勝栄,1410002011523,その他の製造業,〒019-1701秋田県大仙市神宮寺大浦58,0187723876（0187-72-3876）,3000（千円）,高橋　博（タカハシ ヒロシ）
有限会社高野木工所,1410002011639,家具・装備品製造業,〒014-0067秋田県大仙市飯田堰東216,0187620609（0187-62-0609）,3000（千円）,高野　稔（タカノ ミノル）
有限会社草薙電子製作所,1410002011845,金属製品製造業,〒019-1531秋田県仙北郡美郷町畑屋街道東201-1,0187842441（0187-84-2441）,12000（千円）,草薙　淳（クサナギ ジユン）
有限会社佐々木化工所,1410002012554,衣服・その他の繊維製品製造業,〒014-0302秋田県仙北市角館町白岩上西野245,0187551331（0187-55-1331）,8000（千円）,高橋　義敬（タカハシ ヨシタカ）
有限会社佐々木テント,1410002013040,衣服・その他の繊維製品製造業,〒013-0064秋田県横手市赤坂仁坂107-13,0182321025（0182-32-1025）,3000（千円）,佐々木　定己（ササキ サダミ）
有限会社モード石川,1410002013230,衣服・その他の繊維製品製造業,〒013-0046秋田県横手市神明町6-3,0182331225（0182-33-1225）,5000（千円）,石川　昇（イシカワ ノボル）
株式会社平鹿精機製作所,1410002013338,一般機械器具製造業,〒013-0106秋田県横手市平鹿町中吉田年子狐139-2,0182241547（0182-24-1547）,14000（千円）,代表取締役社長／佐藤　武光（サトウ タケミツ）
有限会社柏谷印刷,1410002013610,出版・印刷・同関連産業,〒013-0005秋田県横手市幸町2-14,0182321949（0182-32-1949）,3000（千円）,柏谷　博（カシワヤ ヒロシ）
合資会社宮田製菓,1410003000483,食料品・飼料・飲料製造業,〒010-0062秋田県秋田市牛島東5-6-2,0188334876（018-833-4876）,"",宮田　正一（ミヤタ シヨウイチ）
高茂合名会社,1410003001119,食料品・飼料・飲料製造業,〒012-0801秋田県湯沢市岩崎岩崎124,0183732902（0183-73-2902）,"",高橋　嘉彦（タカハシ ヨシヒコ）
合名会社石川商会,1410003001829,木材・木製品製造業（家具を除く）,〒018-2303秋田県山本郡三種町森岳二階堤頭31,0185833641（0185-83-3641）,"",石川　スミ（イシカワ スミ）
八千代酒造合名会社,1410003001944,食料品・飼料・飲料製造業,〒019-1404秋田県仙北郡美郷町六郷本道町60,0187841020（0187-84-1020）,"",後藤　堅太郎（ゴトウ ケンタロウ）
合資会社高梨製材所,1410003002091,木材・木製品製造業（家具を除く）,〒014-0805秋田県大仙市高梨田茂木65,0187630700（0187-63-0700）,"",竹内　靖浩（タケウチ ヤスヒロ）
株式会社フォレスト秋田,1410005001736,木材・木製品製造業（家具を除く）,〒010-0511秋田県男鹿市船川港船川海岸通り1号12-10,0185245580（0185-24-5580）,12000（千円）,門脇　桂孝（カドワキ ケイコウ）
農事組合法人十和田果汁生産組合,1410005003542,食料品・飼料・飲料製造業,〒018-5201秋田県鹿角市花輪町端3-6,0186253737（0186-25-3737）,2000（千円）,平野　亮一（ヒラノ リヨウイチ）
秋田いなふく米菓株式会社,2410001000187,食料品・飼料・飲料製造業,〒010-0941秋田県秋田市川尻町大川反170,0188631729（018-863-1729）,112200（千円）,代表取締役社長／日下　浩一（クサカ コウイチ）
秋田新産線材株式会社,2410001000344,金属製品製造業,〒011-0901秋田県秋田市寺内神屋敷295-67,0188471510（018-847-1510）,83000（千円）,代表取締役社長／草ナギ　弘（クサナギ ヒロシ）
秋田車体株式会社,2410001000385,輸送用機械器具製造業,〒011-0901秋田県秋田市寺内三千刈217,0188651215（018-865-1215）,10000（千円）,石田　哲治（イシダ テツジ）
秋田白玉工業株式会社,2410001000393,食料品・飼料・飲料製造業,〒010-0114秋田県秋田市金足下刈北野5-2,0188734210（018-873-4210）,50000（千円）,代表取締役社長／村井　成人（ムライ ナルト）
秋田中央印刷株式会社,2410001000451,出版・印刷・同関連産業,〒010-1612秋田県秋田市新屋豊町6-43,0188237577（018-823-7577）,30000（千円）,大野　正樹（オオノ マサキ）
株式会社秋田人形会館,2410001000476,その他の製造業,〒010-0061秋田県秋田市卸町2-3-1,0188635963（018-863-5963）,10000（千円）,小倉　進一（オグラ シンイチ）
株式会社井川鉄工所,2410001000617,一般機械器具製造業,〒010-0941秋田県秋田市川尻町大川反170-24,0188234148（018-823-4148）,10000（千円）,井川　敬子（イカワ ケイコ）
秋田酒造株式会社,2410001001020,食料品・飼料・飲料製造業,〒010-1631秋田県秋田市新屋元町23-28,0188281315（018-828-1315）,10000（千円）,野本　翔（ノモト シヨウ）
三宝食品株式会社,2410001001268,食料品・飼料・飲料製造業,〒010-0802秋田県秋田市外旭川待合28,0188749176（018-874-9176）,8500（千円）,木村　仁（キムラ ヒトシ）
株式会社サンワ,2410001001284,食料品・飼料・飲料製造業,〒010-0913秋田県秋田市保戸野鉄砲町4-25,0188641623（018-864-1623）,3000（千円）,吉田　義男（ヨシダ ヨシオ）
株式会社シー・ケー・アーテック,2410001001318,金属製品製造業,〒010-1611秋田県秋田市新屋天秤野3-15,0188641723（018-864-1723）,10000（千円）,平野　健（ヒラノ ケン）
株式会社電洋社,2410001001788,その他の製造業,〒010-1633秋田県秋田市新屋鳥木町1-76,0188889200（018-888-9200）,10000（千円）,代表取締役社長／八代　千秋（ヤシロ チアキ）
株式会社那波商店,2410001001994,食料品・飼料・飲料製造業,〒010-0921秋田県秋田市大町3-1-13,0188245341（018-824-5341）,10000（千円）,那波　三郎右衛門（ナバ サブロウエモン）
株式会社マルイシフーズ,2410001002415,食料品・飼料・飲料製造業,〒010-0918秋田県秋田市泉南1-4-39,0188230247（018-823-0247）,20000（千円）,代表取締役社長／佐藤　充良（サトウ ミツヨシ）
株式会社リベール,2410001002679,食料品・飼料・飲料製造業,〒010-1611秋田県秋田市新屋天秤野125-26,0188244551（018-824-4551）,33000（千円）,武藤　真人（ムトウ マサト）
株式会社縫工,2410001002794,衣服・その他の繊維製品製造業,〒010-1638秋田県秋田市新屋表町2-17,0188286162（018-828-6162）,10000（千円）,猿田　吉文（サルタ ヨシフミ）
株式会社佐々木工業,2410001003388,金属製品製造業,〒010-0201秋田県潟上市天王江川39-5,0188784666（018-878-4666）,10000（千円）,佐々木　隆昌（ササキ タカマサ）
天王縫製株式会社,2410001003470,衣服・その他の繊維製品製造業,〒010-0101秋田県潟上市天王上江川176-1,0188786674（018-878-6674）,10000（千円）,千種　勇（チグサ イサム）
