会社名,法人番号,業種,住所,電話番号,資本金,代表氏名
株式会社オートヨ,4490001006415,衣服・その他の繊維製品製造業,〒789-0166高知県長岡郡大豊町東土居200-6,0887750021（0887-75-0021）,30000（千円）,代表取締役社長／小笠原　俊一（オガサワラ シユンイチ）
株式会社坂本技研,4490001006555,一般機械器具製造業,〒783-0022高知県南国市小籠941-6,0888644277（088-864-4277）,15000（千円）,坂本　正興（サカモト マサオキ）
第十工業株式会社,4490001006646,一般機械器具製造業,〒781-5451高知県香南市香我美町上分1153-7,0887551222（0887-55-1222）,5000（千円）,第十　忍（ダイジユウ シノブ）
株式会社初月溶接,4490001007066,金属製品製造業,〒780-0974高知県高知市円行寺1674-3,0888568117（088-856-8117）,2500（千円）,國久　晴朗（クニヒサ ハルオ）
株式会社北斗技研,4490001007280,一般機械器具製造業,〒781-0241高知県高知市横浜新町4-501-5,"",1000（千円）,北條　英二（ホウジヨウ エイジ）
土佐海興株式会社,4490001007561,食料品・飼料・飲料製造業,〒780-0811高知県高知市弘化台14-28,0888565992（088-856-5992）,8000（千円）,山本　茂（ヤマモト シゲル）
株式会社土佐レジン,4490001008329,その他の製造業,〒780-8017高知県高知市南竹島町45,0888377525（088-837-7525）,3000（千円）,小川　宏（オガワ ヒロシ）
有限会社泉利昆布海産,4490002000508,食料品・飼料・飲料製造業,〒780-8036高知県高知市東城山町112-9,0888330572（088-833-0572）,10000（千円）,代表取締役社長／泉谷　伸司（イズタニ シンジ）
有限会社共伸印刷所,4490002001175,出版・印刷・同関連産業,〒780-0926高知県高知市大膳町6-5,0888252266（088-825-2266）,3000（千円）,西森　紀詔（ニシモリ トシアキ）
有限会社菜香,4490002001811,食料品・飼料・飲料製造業,〒781-0316高知県高知市春野町西諸木579-3,0888428928（088-842-8928）,3000（千円）,辻　博史（ツジ ヒロシ）
有限会社高知真空,4490002002132,金属製品製造業,〒781-5103高知県高知市大津乙1956-2,0888667241（088-866-7241）,6000（千円）,野村　俊明（ノムラ トシアキ）
有限会社ジオ,4490002002355,出版・印刷・同関連産業,〒780-0914高知県高知市宝町9-5,0888732055（088-873-2055）,5000（千円）,野本　香織（ノモト カオリ）
有限会社東雲工作所,4490002002405,一般機械器具製造業,〒781-8135高知県高知市一宮南町1-8-37,0888451335（088-845-1335）,5000（千円）,尾崎　詳司（オザキ シヨウジ）
有限会社ナカムラ製作所,4490002003824,一般機械器具製造業,〒780-8040高知県高知市神田1138,0888324031（088-832-4031）,3000（千円）,中村　妙（ナカムラ タエ）
有限会社野村煎豆加工店,4490002004070,食料品・飼料・飲料製造業,〒781-5103高知県高知市大津乙1910-3,0888662261（088-866-2261）,10000（千円）,代表取締役社長／野村　純司（ノムラ キヨシ）
有限会社平田工作所,4490002004376,金属製品製造業,〒781-0112高知県高知市仁井田4638,0888470040（088-847-0040）,5000（千円）,平田　幹生（ヒラタ ミキオ）
有限会社松岡蒲鉾店,4490002004797,食料品・飼料・飲料製造業,〒780-0841高知県高知市帯屋町2-4-3,0888723916（088-872-3916）,6000（千円）,猪野　文雄（イノ フミオ）
有限会社森製作所,4490002005218,金属製品製造業,〒781-8125高知県高知市五台山16-4,0888843527（088-884-3527）,3000（千円）,森　登（モリ ノボル）
有限会社ほにや,4490002006034,衣服・その他の繊維製品製造業,〒780-0841高知県高知市帯屋町2-2-4,0888800020（088-880-0020）,3000（千円）,深瀬　真弓（フカセ マユミ）
有限会社幡多コンクリートサービス,4490002008526,窯業・土石製品製造業,〒787-0019高知県四万十市具同7388-9,0880374871（0880-37-4871）,35000（千円）,代表取締役社長／高岡　始（タカオカ ハジメ）
有限会社谷脇工作所,4490002009160,金属製品製造業,〒788-0034高知県宿毛市大深浦2198-6,0880658645（0880-65-8645）,3000（千円）,谷脇　廣一（タニワキ ヒロイチ）
有限会社宮地製作所,4490002009235,一般機械器具製造業,〒788-0784高知県宿毛市山奈町山田136-2,0880662661（0880-66-2661）,3000（千円）,宮地　司（ミヤジ ツカサ）
森製紙有限会社,4490002009623,パルプ・紙・紙加工品製造業,〒781-2152高知県高岡郡日高村沖名5226,0889244122（0889-24-4122）,3000（千円）,森　竜二（モリ リユウジ）
高岡コンクリート工業有限会社,4490002009771,窯業・土石製品製造業,〒781-1105高知県土佐市蓮池1044-1,0888525300（088-852-5300）,10000（千円）,矢野　武志（ヤノ タケシ）
有限会社岡村畳製作所,4490002010201,その他の製造業,〒781-2100高知県吾川郡いの町47-6,0888933030（088-893-3030）,8000（千円）,岡村　篤志（オカムラ アツシ）
須崎燃料有限会社,4490002010523,その他の製造業,〒785-0028高知県須崎市上分丙1758-1,0889460811（0889-46-0811）,5000（千円）,吉村　一博（ヨシムラ カズヒロ）
有限会社東津野砕石工業,4490002011075,窯業・土石製品製造業,〒785-0502高知県高岡郡津野町北川3744,0889623015（0889-62-3015）,13000（千円）,川上　和孝（カワカミ カズタカ）
有限会社ハチロー染工場,4490002011356,"繊維工業（衣服,その他の繊維製品を除く）",〒782-0051高知県香美市土佐山田町楠目76,0887532276（0887-53-2276）,3000（千円）,三谷　隆博（ミタニ タカヒロ）
有限会社カワサキマシン,4490002011612,一般機械器具製造業,〒783-0041高知県南国市岡豊町定林寺75,0888783711（088-878-3711）,6000（千円）,西川　明（ニシカワ アカシ）
合資会社佐川印刷所,4490003000515,出版・印刷・同関連産業,〒789-1201高知県高岡郡佐川町甲1602,0889221023（0889-22-1023）,"",矢野　豊彦（ヤノ トヨヒコ）
嶺北林材協同組合,4490005004778,木材・木製品製造業（家具を除く）,〒789-0303高知県長岡郡大豊町川口2042-6,0887721177（0887-72-1177）,9340（千円）,坂本　一（サカモト ハジメ）
鷹取キムチの里づくり実行委員会,4700150080726,食料品・飼料・飲料製造業,〒785-0624高知県高岡郡檮原町下折渡210,0889622401（0889-62-2401）,"",矢野　豪佑（ヤノ ゴウスケ）
株式会社南四国アスコン,5470001011993,石油製品・石炭製品製造業,〒783-0084高知県南国市稲生4012,0888658452（088-865-8452）,10000（千円）,星野　聡介（ホシノ ソウスケ）
旭フレッシュ株式会社,5490001000020,食料品・飼料・飲料製造業,〒781-0302高知県高知市春野町弘岡中1402,0888946363（088-894-6363）,80000（千円）,代表取締役社長／竹内　紘之（タケウチ ヒロユキ）
兼松エンジニアリング株式会社,5490001000318,輸送用機械器具製造業,〒781-5101高知県高知市布師田3981-7,0888455511（088-845-5511）,313700（千円）,代表取締役社長／佃　維男（ツクダ ツナオ）
株式会社川村生コンクリート工業,5490001000342,窯業・土石製品製造業,〒781-0304高知県高知市春野町西分150,0888942240（088-894-2240）,10000（千円）,代表取締役社長／川村　浩司（カワムラ コウジ）
株式会社技研製作所,5490001000359,一般機械器具製造業,〒781-5101高知県高知市布師田3948-1,0888462933（088-846-2933）,5855158（千円）,代表取締役社長／北村　精男（キタムラ アキオ）
株式会社太陽,5490001000887,金属製品製造業,〒781-5101高知県高知市布師田3950,0888461230（088-846-1230）,60000（千円）,代表取締役社長／久松　朋水（ヒサマツ トモミ）
株式会社コーワ,5490001000920,一般機械器具製造業,〒781-0270高知県高知市長浜5033-21,0888420100（088-842-0100）,23000（千円）,代表取締役会長／安岡　和彦（ヤスオカ カズヒコ）
興洋フリーズ株式会社,5490001001035,食料品・飼料・飲料製造業,〒780-0811高知県高知市弘化台19-9,0888831492（088-883-1492）,10000（千円）,高橋　哲（タカハシ オサム）
新高知重工株式会社,5490001001290,輸送用機械器具製造業,〒781-0112高知県高知市仁井田4613-1,0888471111（088-847-1111）,387000（千円）,代表取締役社長／入佐　晃（イリサ アキラ）
株式会社中央グリーン施設,5490001001472,金属製品製造業,〒781-5106高知県高知市介良乙1044-9,0888600055（088-860-0055）,10000（千円）,山中　滿夫（ヤマナカ ミツオ）
東洋電化工業株式会社,5490001001605,"鉄鋼業,非鉄金属製造業",〒780-8006高知県高知市萩町2-2-25,0888344800（088-834-4800）,300000（千円）,代表取締役社長／入交　建太（イリマジリ ケンタ）
株式会社浜幸,5490001001836,食料品・飼料・飲料製造業,〒781-5103高知県高知市大津乙695-1,0888662323（088-866-2323）,34400（千円）,代表取締役社長／浜田　幸広（ハマダ ユキヒロ）
丸和林業株式会社,5490001002355,木材・木製品製造業（家具を除く）,〒780-0806高知県高知市知寄町3-303,0888826155（088-882-6155）,10000（千円）,代表取締役社長／北岡　幸一（キタオカ コウイチ）
株式会社岡崎工芸,5490001003337,家具・装備品製造業,〒781-0270高知県高知市長浜1592-1,0888424338（088-842-4338）,10000（千円）,岡崎　圭（オカザキ ケイ）
だるま味噌株式会社,5490001003650,食料品・飼料・飲料製造業,〒781-5103高知県高知市大津乙1910-11,0888663138（088-866-3138）,7500（千円）,白石　伸夫（シライシ ノブオ）
関西砕石株式会社,5490001004500,窯業・土石製品製造業,〒780-8021高知県高知市孕東町50,0888328701（088-832-8701）,30000（千円）,代表取締役社長／合田　良介（ゴウダ リヨウスケ）
株式会社白鯨,5490001004681,食料品・飼料・飲料製造業,〒780-0823高知県高知市菜園場町4-10,0888852777（088-885-2777）,3500（千円）,谷脇　継一郎（タニワキ ケイイチロウ）
株式会社四万十屋,5490001004839,食料品・飼料・飲料製造業,〒787-0157高知県四万十市山路2494-1,0880362828（0880-36-2828）,12700（千円）,田村　吉教（タムラ ヨシノリ）
松田縫製株式会社,5490001005333,衣服・その他の繊維製品製造業,〒789-1932高知県幡多郡黒潮町下田の口536,0880431247（0880-43-1247）,500（千円）,松田　忍（マツダ シノブ）
四国特紙株式会社,5490001005374,パルプ・紙・紙加工品製造業,〒781-2110高知県吾川郡いの町4013,0888921201（088-892-1201）,20000（千円）,代表取締役社長／刈谷　繁彦（カリヤ シゲヒコ）
株式会社近澤製紙所,5490001005390,パルプ・紙・紙加工品製造業,〒781-2110高知県吾川郡いの町4003,0888920126（088-892-0126）,10000（千円）,代表取締役社長／近澤　隆志（チカザワ タカシ）
光電設株式会社,5490001005408,電気機械器具製造業,〒781-5102高知県高知市大津甲365-1,0888216663（088-821-6663）,20000（千円）,代表取締役社長／宮地　正進（ミヤジ セイシン）
本川生コン工業株式会社,5490001005416,窯業・土石製品製造業,〒781-2614高知県吾川郡いの町葛原228-12,0888692301（088-869-2301）,10000（千円）,代表取締役社長／山中　伯（ヤマナカ ツカサ）
コーシン製紙株式会社,5490001005440,パルプ・紙・紙加工品製造業,〒781-1103高知県土佐市高岡町丙501,0888522126（088-852-2126）,45000（千円）,代表取締役社長／坂本　健次郎（サカモト ケンジロウ）
サンヨー製紙株式会社,5490001005449,パルプ・紙・紙加工品製造業,〒781-1102高知県土佐市高岡町乙3198,0888526116（088-852-6116）,60000（千円）,森澤　豊明（モリサワ トヨアキ）
フロンティアヒロセ株式会社,5490001005465,パルプ・紙・紙加工品製造業,〒781-1102高知県土佐市高岡町乙3182,0888521151（088-852-1151）,30000（千円）,岡田　祥司（オカダ シヨウジ）
菱高精機株式会社,5490001005845,一般機械器具製造業,〒789-1302高知県高岡郡中土佐町上ノ加江2085-2,0889540221（0889-54-0221）,45000（千円）,町田　淳一郎（マチダ ジユンイチロウ）
井上石灰工業株式会社,5490001006141,化学工業,〒783-0060高知県南国市蛍が丘2-3-5,0888559975（088-855-9975）,20000（千円）,代表取締役社長／井上　孝志（イノウエ タカシ）
エフピコダックス株式会社,5490001006158,その他の製造業,〒783-0046高知県南国市岡豊町江村11,0888782311（088-878-2311）,100000（千円）,且田　久雄（カツダ ヒサオ）
中央生コンクリート株式会社,5490001006174,窯業・土石製品製造業,〒783-0006高知県南国市篠原115,0888635555（088-863-5555）,20500（千円）,池本　靜男（イケモト シズオ）
株式会社キプロ,5490001006182,家具・装備品製造業,〒783-0055高知県南国市双葉台18,0888048228（088-804-8228）,13000（千円）,上山　太志（ウエヤマ タイシ）
株式会社田中ライム工業,5490001006224,窯業・土石製品製造業,〒783-0084高知県南国市稲生3185,0888652151（088-865-2151）,10000（千円）,田中　克也（タナカ カツヤ）
株式会社大陽四國セミテック,5490001006331,電気機械器具製造業,〒781-5332高知県香南市香我美町徳王子関屋2220-25,0887551181（0887-55-1181）,100000（千円）,井上　純一（イノウエ ジユンイチ）
株式会社暁産業,5490001006348,"鉄鋼業,非鉄金属製造業",〒781-5242高知県香南市吉川町古川301-1,0887571831（0887-57-1831）,30000（千円）,代表取締役社長／野島　和男（ノジマ カズオ）
カワクボＦＡＣＴＯＲＹ株式会社,5490001006364,一般機械器具製造業,〒781-5310高知県香南市赤岡町1586,0887543040（0887-54-3040）,10000（千円）,川久保　武志（カワクボ タケシ）
株式会社エスイージー,5490001006570,金属製品製造業,〒783-0004高知県南国市大ソネ甲1498,0888633186（088-863-3186）,10700（千円）,代表取締役社長／大利　賀臣（オオリ ヨシトミ）
株式会社滝口石材店,5490001006612,窯業・土石製品製造業,〒781-4641高知県香美市物部町岡ノ内735,0887584380（0887-58-4380）,100（千円）,滝口　満壽夫（タキグチ マスオ）
株式会社羽根産業社,5490001006835,窯業・土石製品製造業,〒781-6742高知県室戸市羽根町乙3209-552,0887261858（0887-26-1858）,10000（千円）,代表取締役社長／佃　幸壽（ツクダ ユキトシ）
株式会社ＫＡＷＡＭＵＲＡ,5490001007065,その他の製造業,〒780-0965高知県高知市福井町689-25,0888728000（088-872-8000）,10000（千円）,代表取締役社長／川村　裕夫（カワムラ ヒロオ）
株式会社トリプルエイ,5490001007288,金属製品製造業,〒783-0054高知県南国市比江48-1,0888622878（088-862-2878）,10000（千円）,近森　優博（チカモリ マサヒロ）
株式会社浜田兄弟和紙製作所,5490001007395,パルプ・紙・紙加工品製造業,〒781-2134高知県吾川郡いの町神谷564,0888921022（088-892-1022）,2000（千円）,浜田　洋直（ハマダ ヒロナオ）
株式会社合田ネーム,5490001007461,衣服・その他の繊維製品製造業,〒780-0056高知県高知市北本町3-4-4,0888837652（088-883-7652）,3000（千円）,合田　宗司（ゴウダ ヒロシ）
株式会社松木商店,5490001008105,食料品・飼料・飲料製造業,〒783-0085高知県南国市十市4803-34,0888658431（088-865-8431）,5000（千円）,松木　利一（マツギ トシカズ）
株式会社タナカ,5490001009136,食料品・飼料・飲料製造業,〒781-5101高知県高知市布師田1761,0888452451（088-845-2451）,11000（千円）,代表取締役社長／田中　幸彦（タナカ ユキヒコ）
有限会社高知合板工業所,5490002001397,木材・木製品製造業（家具を除く）,〒781-0112高知県高知市仁井田4513,0888470017（088-847-0017）,10000（千円）,窪田　正明（クボタ マサアキ）
有限会社黒岩味好堂,5490002001942,食料品・飼料・飲料製造業,〒780-8040高知県高知市神田475-10,0888322931（088-832-2931）,3000（千円）,黒岩　勲（クロイワ イサオ）
有限会社七福堂製菓,5490002002404,食料品・飼料・飲料製造業,〒781-5103高知県高知市大津乙1738-1,0888663118（088-866-3118）,3000（千円）,斉藤　章雄（サイトウ アキオ）
有限会社四万十川物産,5490002002445,食料品・飼料・飲料製造業,〒781-0270高知県高知市長浜6022-2,0888411648（088-841-1648）,3000（千円）,雨森　俊二郎（アメノモリ シユンジロウ）
有限会社西川屋老舗,5490002003930,食料品・飼料・飲料製造業,〒780-8019高知県高知市北竹島町270-7,0888328757（088-832-8757）,70000（千円）,池田　聰博（イケダ アキヒロ）
有限会社福ちゃん出版社,5490002004458,出版・印刷・同関連産業,〒780-8031高知県高知市大原町152-8,0888325581（088-832-5581）,3000（千円）,池田　達雄（イケダ タツオ）
有限会社ブティックまちだ,5490002004549,衣服・その他の繊維製品製造業,〒780-8050高知県高知市鴨部973-4,0888439753（088-843-9753）,5000（千円）,町田　美智子（マチダ ミチコ）
有限会社みちや印刷所,5490002005010,出版・印刷・同関連産業,〒780-8010高知県高知市桟橋通2-9-32,0888322330（088-832-2330）,3000（千円）,久保　徳康（クボ ノリヤス）
有限会社森岡製作所,5490002005209,金属製品製造業,〒781-0304高知県高知市春野町西分1127-1,0888942410（088-894-2410）,5000（千円）,加納　恭子（カノウ キヨウコ）
有限会社森下商店,5490002005225,食料品・飼料・飲料製造業,〒780-8038高知県高知市石立町97-1,0888332454（088-833-2454）,3000（千円）,森下　吉広（モリシタ ヨシヒロ）
有限会社やまがた特殊印刷,5490002005316,出版・印刷・同関連産業,〒780-8040高知県高知市神田2005-8,0888322707（088-832-2707）,3000（千円）,井之上　ノブ子（イノウエ ノブコ）
有限会社西川,5490002006264,食料品・飼料・飲料製造業,〒780-8019高知県高知市北竹島町270-7,0888328757（088-832-8757）,70000（千円）,池田　聰博（イケダ アキヒロ）
佐竹木材有限会社,5490002008203,木材・木製品製造業（家具を除く）,〒787-1443高知県四万十市蕨岡乙2080-1,0880321100（0880-32-1100）,5000（千円）,佐竹　日出男（サタケ ヒデオ）
有限会社四万十食品,5490002008392,食料品・飼料・飲料製造業,〒787-0150高知県四万十市井沢744-1,0880354966（0880-35-4966）,3000（千円）,加用　高常（カヨウ タカツネ）
有限会社竹中畳製作所,5490002009151,その他の製造業,〒788-0271高知県宿毛市小筑紫町小筑紫487-32,0880670326（0880-67-0326）,5000（千円）,竹中　徳久（タケナカ トクヒサ）
ひだか和紙有限会社,5490002009580,パルプ・紙・紙加工品製造業,〒781-2152高知県高岡郡日高村沖名3486-1,0889247857（0889-24-7857）,5000（千円）,鎭西　まり子（チンゼイ マリコ）
有限会社明神木材店,5490002009861,木材・木製品製造業（家具を除く）,〒781-1154高知県土佐市新居1266,0888561127（088-856-1127）,10000（千円）,明神　州哲（ミヨウジン クニノリ）
土佐ブロック工業有限会社,5490002009911,窯業・土石製品製造業,〒781-1101高知県土佐市高岡町甲1196-1,0888522620（088-852-2620）,10000（千円）,明神　正隆（ミヨウジン マサタカ）
有限会社クマミ,5490002010290,食料品・飼料・飲料製造業,〒789-1201高知県高岡郡佐川町甲1634-3,0889222112（0889-22-2112）,3000（千円）,熊巳　泰昌（クマミ ヤスマサ）
有限会社西岡酒造店,5490002010737,食料品・飼料・飲料製造業,〒789-1301高知県高岡郡中土佐町久礼6154,0889522018（0889-52-2018）,5600（千円）,西岡　大介（ニシオカ ダイスケ）
有限会社上双葉木工所,5490002011248,木材・木製品製造業（家具を除く）,〒782-0033高知県香美市土佐山田町旭町5-7-28,0887533077（0887-53-3077）,3000（千円）,鍵山　正臣（カギヤマ セイシン）
有限会社小松印刷所,5490002011272,出版・印刷・同関連産業,〒782-0032高知県香美市土佐山田町西本町1-3-24,0887532040（0887-53-2040）,3000（千円）,中越　忠男（ナカゴシ タダオ）
有限会社比与森商店,5490002011363,窯業・土石製品製造業,〒782-0039高知県香美市土佐山田町栄町3-8,0887533188（0887-53-3188）,3000（千円）,比与森　正幸（ヒヨモリ マサユキ）
有限会社高橋工作所,5490002011776,一般機械器具製造業,〒783-0087高知県南国市三和琴平3-1065-27,0888651451（088-865-1451）,5000（千円）,高橋　博人（タカハシ ヒロト）
有限会社西峯ソーイング,5490002012436,衣服・その他の繊維製品製造業,〒789-0166高知県長岡郡大豊町東土居196-11,0887750840（0887-75-0840）,3000（千円）,小松　憲一（コマツ ケンイチ）
有限会社小松コンクリート工業,5490002012824,窯業・土石製品製造業,〒784-0043高知県安芸市川北甲1812-12,0887352551（0887-35-2551）,3000（千円）,小松　敬明（コマツ ヒロアキ）
有限会社仙頭酒造場,5490002012857,食料品・飼料・飲料製造業,〒781-5701高知県安芸郡芸西村和食甲1551・甲1570-1,0887332611（0887-33-2611）,7600（千円）,仙頭　美紀（セントウ ミキ）
有限会社松崎冷菓工業,5490002012964,食料品・飼料・飲料製造業,〒781-6410高知県安芸郡田野町2764-1,0887382107（0887-38-2107）,18000（千円）,松崎　達也（マツサキ タツヤ）
レイホク木材工業協同組合,5490005004620,木材・木製品製造業（家具を除く）,〒781-3618高知県長岡郡本山町吉野305,0887701388（0887-70-1388）,36000（千円）,野村　俊夫（ノムラ トシオ）
株式会社飯田鉄工,6490001000102,一般機械器具製造業,〒781-0270高知県高知市長浜3111-2,0888422496（088-842-2496）,29000（千円）,代表取締役社長／飯田　祥司（イイダ シヨウジ）
株式会社久万田海産,6490001000507,食料品・飼料・飲料製造業,〒780-0811高知県高知市弘化台6-3,0888841472（088-884-1472）,10000（千円）,久万田　幸正（クマダ コウセイ）
ソフトメカニカル株式会社,6490001000886,一般機械器具製造業,〒781-0253高知県高知市瀬戸南町2-1-5,0888415256（088-841-5256）,10000（千円）,畠中　秀昌（ハタケナカ ヒデマサ）
高陵マシン株式会社,6490001001042,金属製品製造業,〒781-5103高知県高知市大津乙1858-1,0888662824（088-866-2824）,10000（千円）,岡林　孝之（オカバヤシ タカシ）
筒井紙業印刷株式会社,6490001001488,出版・印刷・同関連産業,〒780-8038高知県高知市石立町158,0888316569（088-831-6569）,10000（千円）,筒井　善樹（ツツイ ヨシキ）
株式会社ときわ建工,6490001001629,金属製品製造業,〒781-0270高知県高知市長浜5033-21,0888413141（088-841-3141）,15000（千円）,代表取締役社長／國藤　孝志（クニトウ タカシ）
日新砕石株式会社,6490001001752,窯業・土石製品製造業,〒781-0302高知県高知市春野町弘岡中1062-5,0888943311（088-894-3311）,10000（千円）,代表取締役社長／徳平　豊（トクヒラ ユタカ）
日和崎生コン株式会社,6490001001959,窯業・土石製品製造業,〒780-0841高知県高知市帯屋町2-2-1,0888473333（088-847-3333）,20000（千円）,代表取締役社長／日和崎　三郎（ヒワサキ サブロウ）
株式会社和田機械,6490001002305,一般機械器具製造業,〒780-0001高知県高知市久礼野249-1,0888464848（088-846-4848）,10000（千円）,代表取締役社長／和田　徳男（ワダ ノリオ）
株式会社高南食品,6490001003501,食料品・飼料・飲料製造業,〒780-0026高知県高知市秦南町1-5-54,0888731353（088-873-1353）,21000（千円）,宮本　正司（ミヤモト シヨウジ）
アクアデザインシステム株式会社,6490001004227,一般機械器具製造業,〒781-8104高知県高知市高須2-6-56-203号,"",10000（千円）,武田　良輔（タケダ リヨウスケ）
藤娘酒造株式会社,6490001004945,食料品・飼料・飲料製造業,〒787-0022高知県四万十市中村新町4-5,0880344131（0880-34-4131）,47350（千円）,矢部　允一（ヤベ ミツカズ）
