会社名,法人番号,業種,住所,電話番号,資本金,代表氏名
有限会社細木テント,2490002010608,衣服・その他の繊維製品製造業,〒785-0021高知県須崎市池ノ内16-1,0889421447（0889-42-1447）,3000（千円）,細木　辰男（ホソギ タツオ）
有限会社丸共味噌醤油醸造場,2490002010632,食料品・飼料・飲料製造業,〒785-0008高知県須崎市中町1-2-21,0889420129（0889-42-0129）,3000（千円）,竹中　栄嗣（タケナカ エイジ）
有限会社山崎製材所,2490002011408,木材・木製品製造業（家具を除く）,〒781-4401高知県香美市物部町大栃1597-1,0887582013（0887-58-2013）,5000（千円）,山崎　光教（ヤマサキ ミツノリ）
有限会社伊藤工作所,2490002011556,一般機械器具製造業,〒783-0007高知県南国市明見913-17テクノ高知工業団地Dー3,0888641156（088-864-1156）,5000（千円）,伊藤　幸博（イトウ ユキヒロ）
有限会社井上満吉商店,2490002011564,窯業・土石製品製造業,〒783-0084高知県南国市稲生3154-4,0888658446（088-865-8446）,5000（千円）,井上　健（イノウエ タケシ）
有限会社コウチ防蝕,2490002011655,金属製品製造業,〒783-0064高知県南国市宍崎334-14,0888048770（088-804-8770）,4000（千円）,渡邊　理（ワタナベ マコト）
有限会社谷村製作所,2490002011804,金属製品製造業,〒783-0096高知県南国市久枝乙222-2,0888642946（088-864-2946）,3000（千円）,濱田　正夫（ハマダ マサオ）
有限会社吉本鉄工所,2490002012018,金属製品製造業,〒783-0091高知県南国市立田770-4,0888643478（088-864-3478）,8000（千円）,吉本　宏（ヨシモト ヒロシ）
有限会社久保熱錬,2490002012158,金属製品製造業,〒781-5242高知県香南市吉川町古川301-6,0887553001（0887-55-3001）,3000（千円）,久保　淳二朗（クボ ジユンジロウ）
高知エスジーロイ有限会社,2490002012182,一般機械器具製造業,〒781-5232高知県香南市野市町西野1179,0887560292（0887-56-0292）,8000（千円）,岡崎　隆典（オカザキ タカノリ）
有限会社龍馬の里,2490002012364,食料品・飼料・飲料製造業,〒781-5224高知県香南市野市町東佐古122,0887563877（0887-56-3877）,3000（千円）,酒井　吉弘（サカイ ヨシヒロ）
有限会社有光酒造場,2490002012728,食料品・飼料・飲料製造業,〒784-0033高知県安芸市赤野甲38-1,0887332117（0887-33-2117）,3600（千円）,有光　尚（アリミツ シヨウ）
有限会社川島製菓,2490002012785,食料品・飼料・飲料製造業,〒784-0033高知県安芸市赤野甲1774,0887352224（0887-35-2224）,35000（千円）,川島　清貴（カワシマ キヨタカ）
協同組合須崎木材工業団地,2490005003690,木材・木製品製造業（家具を除く）,〒785-0002高知県須崎市港町76,0889421001（0889-42-1001）,10000（千円）,市川　正孝（イチカワ マサタカ）
環境プランニング株式会社,3490001000393,一般機械器具製造業,〒780-0034高知県高知市三園町231,0888711900（088-871-1900）,10000（千円）,黒木　健司（クロキ タケシ）
株式会社研農,3490001000567,食料品・飼料・飲料製造業,〒780-8015高知県高知市百石町2-25-10,0888344557（088-834-4557）,10000（千円）,明神　周作（ミヨウジン シユウサク）
高知県食品工業株式会社,3490001000716,食料品・飼料・飲料製造業,〒780-8006高知県高知市萩町1-5-19,0888333393（088-833-3393）,10000（千円）,堀地　昭久（ホリチ アキヒサ）
株式会社総合企画,3490001000872,出版・印刷・同関連産業,〒780-8010高知県高知市桟橋通2-8-5-2F,0888789955（088-878-9955）,10000（千円）,中西　惣一（ナカニシ ソウイチ）
株式会社高知歯車,3490001001193,一般機械器具製造業,〒781-5101高知県高知市布師田3961-1,0888462388（088-846-2388）,10000（千円）,鈴江　寿浩（スズエ トシヒロ）
酔鯨酒造株式会社,3490001001375,食料品・飼料・飲料製造業,〒781-0270高知県高知市長浜566-1,0888414080（088-841-4080）,10000（千円）,代表取締役社長／竹内　孝久（タケウチ タカヒサ）
株式会社中央精機,3490001001474,一般機械器具製造業,〒781-8135高知県高知市一宮南町1-8-37,0888451373（088-845-1373）,20000（千円）,代表取締役社長／中野　耕喜（ナカノ コウキ）
橋田食品株式会社,3490001001813,食料品・飼料・飲料製造業,〒781-8125高知県高知市五台山2858,0888832424（088-883-2424）,10000（千円）,代表取締役社長／橋田　照喜（ハシダ テルキ）
浜源食品株式会社,3490001001838,食料品・飼料・飲料製造業,〒781-5103高知県高知市大津乙1758,0888662271（088-866-2271）,10000（千円）,代表取締役社長／濱口　朋之（ハマグチ トモユキ）
株式会社美統,3490001001937,出版・印刷・同関連産業,〒781-0250高知県高知市瀬戸2-5-54,0888414166（088-841-4166）,10000（千円）,宮本　守（ミヤモト マモル）
株式会社フジ工芸,3490001001994,その他の製造業,〒780-0074高知県高知市南金田3-47-4号,0888846992（088-884-6992）,10000（千円）,藤田　健治（フジタ ケンジ）
明星産商株式会社,3490001002134,パルプ・紙・紙加工品製造業,〒783-0044高知県南国市岡豊町八幡411-1,0888048111（088-804-8111）,98000（千円）,代表取締役社長／森　彰良（モリ アキラ）
株式会社ミフク,3490001002200,食料品・飼料・飲料製造業,〒781-8132高知県高知市一宮東町2-1-15,0888460300（088-846-0300）,10000（千円）,横山　稔（ヨコヤマ ミノル）
株式会社ワールドコーラル,3490001002316,その他の製造業,〒781-0112高知県高知市仁井田187-3,0888475050（088-847-5050）,10000（千円）,代表取締役社長／近藤　健治（コンドウ ケンジ）
溝渕林産興業株式会社,3490001002365,木材・木製品製造業（家具を除く）,〒783-0055高知県南国市双葉台6-1,0888622244（088-862-2244）,10000（千円）,代表取締役社長／溝渕　浩一（ミゾブチ ヒロカズ）
株式会社ＳＵＮ電装,3490001004741,電気機械器具製造業,〒781-0324高知県高知市春野町西畑989-1,0888943007（088-894-3007）,100（千円）,三宮　智明（サンノミヤ トモアキ）
株式会社福原砕石,3490001004873,窯業・土石製品製造業,〒787-0033高知県四万十市中村大橋通7-13-3,0880342244（0880-34-2244）,30000（千円）,福原　雅敬（フクハラ マサノリ）
中村ソーイング株式会社,3490001004931,衣服・その他の繊維製品製造業,〒787-0011高知県四万十市右山元町1-10-10,0880342634（0880-34-2634）,10000（千円）,代表取締役社長／岡崎　福夫（オカザキ フクオ）
足摺生コンクリート株式会社,3490001004956,窯業・土石製品製造業,〒787-0445高知県土佐清水市下益野1201,0880850727（0880-85-0727）,36000（千円）,中野　正一（ナカノ マサカズ）
浅井水産株式会社,3490001004972,食料品・飼料・飲料製造業,〒787-0242高知県土佐清水市下ノ加江157-1,0880840011（0880-84-0011）,10000（千円）,浅井　久也（アサイ ヒサヤ）
株式会社カタシマクリエーション,3490001004997,一般機械器具製造業,〒788-0012高知県宿毛市高砂11-15,0880657221（0880-65-7221）,10000（千円）,代表取締役社長／松本　武（マツモト タケシ）
株式会社永野,3490001005013,その他の製造業,〒787-0320高知県土佐清水市清水853-1-2,0880823461（0880-82-3461）,50000（千円）,代表取締役社長／永野　雅道（ナガノ マサミチ）
三陽興産株式会社,3490001005112,"繊維工業（衣服,その他の繊維製品を除く）",〒788-0036高知県宿毛市野地352-2,0880630892（0880-63-0892）,28000（千円）,久保　慶剛（クボ ヨシタカ）
株式会社しまんと美野里,3490001005285,食料品・飼料・飲料製造業,〒787-1603高知県四万十市西土佐用井862-1,0880316300（0880-31-6300）,10000（千円）,濱田　敦夫（ハマダ アツオ）
澁谷食品株式会社,3490001005368,食料品・飼料・飲料製造業,〒781-2153高知県高岡郡日高村本郷716,0889245131（0889-24-5131）,30000（千円）,代表取締役社長／澁谷　伸一（シブヤ シンイチ）
株式会社四国わがみ,3490001005376,パルプ・紙・紙加工品製造業,〒781-2100高知県吾川郡いの町4035,0888920055（088-892-0055）,20000（千円）,刈谷　明由（カリヤ アキヨシ）
丸林製紙株式会社,3490001005418,パルプ・紙・紙加工品製造業,〒781-2100高知県吾川郡いの町3873,0888920368（088-892-0368）,30000（千円）,林　勝彦（ハヤシ カツヒコ）
和光製紙株式会社,3490001005426,パルプ・紙・紙加工品製造業,〒781-2100高知県吾川郡いの町3936,0888921144（088-892-1144）,80000（千円）,代表取締役社長／塩田　誠人（シオタ マサト）
三和製紙株式会社,3490001005450,"繊維工業（衣服,その他の繊維製品を除く）",〒781-1103高知県土佐市高岡町丙443-1,0888523811（088-852-3811）,30000（千円）,代表取締役社長／鈴木　恭一（スズキ キヨウイチ）
望月製紙株式会社,3490001005475,パルプ・紙・紙加工品製造業,〒781-1111高知県土佐市北地3008-1,0888540831（088-854-0831）,12000（千円）,森澤　良水（モリサワ リヨウスイ）
株式会社ヘイワ原紙,3490001005558,パルプ・紙・紙加工品製造業,〒781-2152高知県高岡郡日高村沖名4069,0889245546（0889-24-5546）,20000（千円）,代表取締役社長／山岡　大祐（ヤマオカ ダイスケ）
フソー化成株式会社,3490001005649,その他の製造業,〒781-2151高知県高岡郡日高村下分3702-17,0889201750（0889-20-1750）,5000（千円）,丁野　務（チヨウノ ツトム）
共伸木材株式会社,3490001005764,木材・木製品製造業（家具を除く）,〒785-0002高知県須崎市港町85-2,0889432110（0889-43-2110）,10000（千円）,代表取締役／松浦　和弘（マツウラ カズヒロ）
吉村木材株式会社,3490001005830,木材・木製品製造業（家具を除く）,〒785-0002高知県須崎市港町83,0889425500（0889-42-5500）,10000（千円）,代表取締役社長／吉村　宗展（ヨシムラ ムネノブ）
美良布木材株式会社,3490001006102,木材・木製品製造業（家具を除く）,〒781-4206高知県香美市香北町小川156,0887592031（0887-59-2031）,10000（千円）,横谷　和泰（ヨコダニ カズヒロ）
株式会社ミロクテクノウッド,3490001006317,輸送用機械器具製造業,〒783-0006高知県南国市篠原537-1,0888806713（088-880-6713）,80000（千円）,片山　弘紀（カタヤマ コウキ）
株式会社キヨトウ,3490001006366,一般機械器具製造業,〒781-5453高知県香南市香我美町山北123-4,0887542191（0887-54-2191）,10000（千円）,代表取締役社長／清藤　秀夫（キヨトウ ヒデオ）
株式会社れいほく畜産,3490001006440,食料品・飼料・飲料製造業,〒781-3617高知県長岡郡本山町寺家241-1,0887820601（0887-82-0601）,94000（千円）,今西　芳彦（イマニシ ヨシヒコ）
株式会社カゴオ,3490001006746,輸送用機械器具製造業,〒781-6402高知県安芸郡奈半利町乙883,0887383615（0887-38-3615）,30000（千円）,籠尾　信之（カゴオ ノブユキ）
株式会社浅川自然食品工業,3490001006812,食料品・飼料・飲料製造業,〒781-7101高知県室戸市室戸岬町3507-22,0887233377（0887-23-3377）,10000（千円）,浅川　良住（アサカワ ヨシズミ）
高知おおとよ製材株式会社,3490001006985,木材・木製品製造業（家具を除く）,〒789-0303高知県長岡郡大豊町川口2035-1,0887700020（0887-70-0020）,97000（千円）,中島　浩一郎（ナカジマ コウイチロウ）
株式会社明神フーズ,3490001007133,食料品・飼料・飲料製造業,〒789-1900高知県幡多郡黒潮町黒潮1,0880553644（0880-55-3644）,10000（千円）,明神　正一（ミヨウジン マサカツ）
株式会社かつら,3490001007315,食料品・飼料・飲料製造業,〒780-0811高知県高知市弘化台5-15,0888567217（088-856-7217）,97250（千円）,前田　泰昌（マエダ ヤスマサ）
有限会社石元食品,3490002000442,食料品・飼料・飲料製造業,〒781-0301高知県高知市春野町弘岡上570,0888945900（088-894-5900）,3000（千円）,代表取締役社長／石元　健二（イシモト ケンジ）
有限会社高知コンクリートサービス,3490002001408,窯業・土石製品製造業,〒780-8051高知県高知市鴨部上町2-13,0888441411（088-844-1411）,18000（千円）,代表取締役社長／石原　昇（イシハラ ノボル）
有限会社三青物産,3490002002249,食料品・飼料・飲料製造業,〒780-8066高知県高知市朝倉己87-12,0888401200（088-840-1200）,3000（千円）,西森　峯俊（ニシモリ ミネトシ）
有限会社サーマル工房,3490002002802,その他の製造業,〒780-8023高知県高知市六泉寺町167,0888338039（088-833-8039）,3000（千円）,谷村　正樹（タニムラ マサキ）
有限会社千寿商會,3490002002868,食料品・飼料・飲料製造業,〒780-8010高知県高知市桟橋通3-6-1,0888337160（088-833-7160）,5000（千円）,代表取締役社長／嶋崎　雅夫（シマサキ マサオ）
有限会社豚太郎,3490002003668,食料品・飼料・飲料製造業,〒781-5106高知県高知市介良乙1060-6,0888601111（088-860-1111）,49000（千円）,大本　明子（オオモト アキコ）
有限会社西村,3490002003949,出版・印刷・同関連産業,〒780-0901高知県高知市上町1-6-4,0888220492（088-822-0492）,3500（千円）,代表取締役社長／西村　勉（ニシムラ ツトム）
有限会社三星堂,3490002007149,その他の製造業,〒780-0870高知県高知市本町5-1-9,0888722980（088-872-2980）,3000（千円）,吉本　真（ヨシモト マコト）
有限会社福原ブロック,3490002008584,窯業・土石製品製造業,〒787-0033高知県四万十市中村大橋通7-13-3,0880342244（0880-34-2244）,22000（千円）,福原　敬祐（フクハラ ケイスケ）
金子石材有限会社,3490002008782,窯業・土石製品製造業,〒789-1720高知県幡多郡黒潮町佐賀684,0880552095（0880-55-2095）,3000（千円）,金子　英俊（カネコ ヒデトシ）
有限会社じぃんず工房大方,3490002008840,衣服・その他の繊維製品製造業,〒789-1932高知県幡多郡黒潮町下田の口536,0880431247（0880-43-1247）,3000（千円）,松田　和司（マツダ カズシ）
有限会社大田製材,3490002009070,木材・木製品製造業（家具を除く）,〒788-0011高知県宿毛市宿毛5343-13,0880632522（0880-63-2522）,3000（千円）,大田　忠彰（オオタ タダアキ）
有限会社丸英製紙,3490002009599,パルプ・紙・紙加工品製造業,〒781-2136高知県吾川郡いの町鹿敷523-2,0888920661（088-892-0661）,30000（千円）,代表取締役社長／濱田　満廣（ハマダ ミツヒロ）
有限会社浜吉ヤ,3490002009830,食料品・飼料・飲料製造業,〒781-1161高知県土佐市宇佐町宇佐1716,0888560045（088-856-0045）,10000（千円）,山中　昭典（ヤマナカ アキノリ）
有限会社サンライズマシン,3490002010177,一般機械器具製造業,〒781-1103高知県土佐市高岡町丙668-1,0888523956（088-852-3956）,5000（千円）,山本　富子（ヤマモト トミコ）
有限会社アスカ,3490002010375,パルプ・紙・紙加工品製造業,〒785-0167高知県須崎市浦ノ内灰方17-1,0888562823（088-856-2823）,3000（千円）,尾中　恭慈（オナカ キヨウジ）
有限会社市川鉄工所,3490002010383,金属製品製造業,〒785-0054高知県須崎市多ノ郷乙725-11,0889421791（0889-42-1791）,5000（千円）,市川　顯一郎（イチカワ ケンイチロウ）
有限会社須崎サブコン,3490002010714,窯業・土石製品製造業,〒789-1301高知県高岡郡中土佐町久礼7109-16,0889522718（0889-52-2718）,5000（千円）,鍋島　正男（ナベシマ マサオ）
有限会社繁春鉄工所,3490002011720,一般機械器具製造業,〒783-0005高知県南国市大ソネ乙1221-3,0888643534（088-864-3534）,5000（千円）,代表取締役社長／高田　繁正（タカダ シゲマサ）
有限会社眞功工作所,3490002011745,一般機械器具製造業,〒783-0054高知県南国市比江49-5,0888622189（088-862-2189）,3000（千円）,大石　信樹（オオイシ ノブキ）
有限会社徳弘鉄工所,3490002011869,一般機械器具製造業,〒783-0023高知県南国市廿枝1267-1,0888632678（088-863-2678）,3000（千円）,徳弘　信喜（トクヒロ ノブキ）
有限会社めぐみ写研,3490002012000,出版・印刷・同関連産業,〒783-0004高知県南国市大ソネ甲1956-2,0888642604（088-864-2604）,3000（千円）,松田　恵子（マツダ ケイコ）
有限会社さめうらフーズ,3490002012388,食料品・飼料・飲料製造業,〒781-3601高知県長岡郡本山町本山476,0887762148（0887-76-2148）,5000（千円）,高石　宣夫（タカイシ ノブオ）
有限会社安芸グループふぁーむ,3490002012710,食料品・飼料・飲料製造業,〒784-0032高知県安芸市穴内乙685,0887352620（0887-35-2620）,5600（千円）,小松　哲也（コマツ テツヤ）
有限会社池田柚華園,3490002012735,食料品・飼料・飲料製造業,〒781-6443高知県安芸郡北川村加茂314,0887384287（0887-38-4287）,7000（千円）,池田　一平（イケダ イツペイ）
有限会社本家アキ寅中川製瓦所,3490002012958,窯業・土石製品製造業,〒784-0022高知県安芸市庄之芝町1-19,0887353021（0887-35-3021）,10000（千円）,中川　裕也（ナカガワ ヒロナリ）
有限会社南酒造場,3490002012974,食料品・飼料・飲料製造業,〒781-6421高知県安芸郡安田町安田1875,0887386811（0887-38-6811）,3800（千円）,南　卓治（ミナミ タクジ）
有限会社宮崎造船所,3490002013213,輸送用機械器具製造業,〒781-7101高知県室戸市室戸岬町2025,0887232012（0887-23-2012）,3000（千円）,宮崎　敏（ミヤザキ サトシ）
ＴＯＳＡＹＡ合同会社,3490003000350,衣服・その他の繊維製品製造業,〒780-8088高知県高知市針木本町20-2,0888400101（088-840-0101）,1200（千円）,岡本　健（オカモト ケン）
マルサ醤油合資会社,3490003000425,食料品・飼料・飲料製造業,〒787-0001高知県四万十市中村本町5-13,0880352975（0880-35-2975）,"",佐竹　義典（サタケ ヨシノリ）
合資会社中野海産,3490003000466,食料品・飼料・飲料製造業,〒788-0013高知県宿毛市片島4-70,0880658308（0880-65-8308）,8000（千円）,中野　昌人（ナカノ マサト）
高知アイスクリーム商工業協同組合,3490005000035,食料品・飼料・飲料製造業,〒780-0833高知県高知市南はりまや町2-3-12,0888824852（088-882-4852）,4480（千円）,近澤　秀歳（チカザワ ヒデトシ）
土佐清水鰹節水産加工業協同組合,3490005002064,食料品・飼料・飲料製造業,〒787-0310高知県土佐清水市浦尻1-12,0880821251（0880-82-1251）,17280（千円）,武政　嘉八（タケマサ ヨシハチ）
土佐石灰化工協業組合,3490005004663,窯業・土石製品製造業,〒783-0084高知県南国市稲生3158,0888651776（088-865-1776）,112000（千円）,代表理事／吉川　和良（ヨシカワ カズヨシ）
株式会社アメニティコーポレーション,4490001000079,化学工業,〒780-0072高知県高知市杉井流17-23,0888781066（088-878-1066）,76600（千円）,竹田　幸彦（タケダ ユキヒコ）
株式会社亜俚亜,4490001000087,食料品・飼料・飲料製造業,〒780-0972高知県高知市中万々174-25,0888710781（088-871-0781）,10000（千円）,酒匂　佐太郎（サカワ サタロウ）
池田印刷株式会社,4490001000104,出版・印刷・同関連産業,〒780-0844高知県高知市永国寺町4-18,0888230071（088-823-0071）,30000（千円）,竹島　譲（タケシマ ユズル）
株式会社サンマリン,4490001000260,食料品・飼料・飲料製造業,〒780-0812高知県高知市若松町11-31,0888611222（088-861-1222）,11000（千円）,濱口　豊（ハマグチ ユタカ）
株式会社きさらぎ,4490001000426,食料品・飼料・飲料製造業,〒780-0812高知県高知市若松町10-17,0888829778（088-882-9778）,15000（千円）,代表取締役社長／川村　栄一（カワムラ エイイチ）
株式会社高知新聞総合印刷,4490001000582,出版・印刷・同関連産業,〒781-8121高知県高知市葛島1-10-70,0888825521（088-882-5521）,36000（千円）,崎山　正（サキヤマ タダシ）
株式会社高知稲田製作所,4490001000590,一般機械器具製造業,〒781-5101高知県高知市布師田3962,0888462600（088-846-2600）,40000（千円）,古賀　源治（コガ ゲンジ）
株式会社高知ヤマザキ,4490001000681,食料品・飼料・飲料製造業,〒781-5103高知県高知市大津乙1750,0888665566（088-866-5566）,100000（千円）,代表取締役社長／吉井　幸夫（ヨシイ ユキオ）
株式会社光栄鉄工所,4490001000839,一般機械器具製造業,〒781-0250高知県高知市瀬戸2-13-40,0888425111（088-842-5111）,50000（千円）,光内　強伸（ミツウチ キヨウシン）
三惠株式会社,4490001000938,一般機械器具製造業,〒780-8010高知県高知市桟橋通4-13-28,0888374811（088-837-4811）,20000（千円）,谷江　裕典（タニエ ユウスケ）
株式会社サヤカ,4490001001110,一般機械器具製造業,〒780-0002高知県高知市重倉524-4,0888660079（088-866-0079）,17000（千円）,山下　由美（ヤマシタ ユミ）
株式会社浜幸,4490001001837,食料品・飼料・飲料製造業,〒781-5103高知県高知市大津乙695-1,0888662323（088-866-2323）,34400（千円）,代表取締役社長／浜田　幸広（ハマダ ユキヒロ）
株式会社ｍｉｍｏｔｏ,4490001001878,衣服・その他の繊維製品製造業,〒781-0270高知県高知市長浜5984-2,0888372323（088-837-2323）,10000（千円）,味本　隆（ミモト タカシ）
安岡金属株式会社,4490001002075,"鉄鋼業,非鉄金属製造業",〒781-0112高知県高知市仁井田4570-1,0888474041（088-847-4041）,20000（千円）,代表取締役社長／安岡　英一（ヤスオカ エイイチ）
株式会社南の風社,4490001002199,出版・印刷・同関連産業,〒780-8040高知県高知市神田東赤坂2607-72,0888341488（088-834-1488）,10000（千円）,細迫　節夫（ホソサコ セツオ）
株式会社リーブル,4490001002265,出版・印刷・同関連産業,〒780-8040高知県高知市神田2126-1,0888371250（088-837-1250）,25000（千円）,新本　勝庸（アラモト カツノブ）
本山印刷株式会社,4490001003651,出版・印刷・同関連産業,〒780-0052高知県高知市大川筋2-6-11,0888720661（088-872-0661）,3000（千円）,本山　幸一（モトヤマ コウイチ）
四国ブロック工業株式会社,4490001005375,窯業・土石製品製造業,〒781-2146高知県吾川郡いの町柳瀬上分74-1,0888970036（088-897-0036）,18000（千円）,代表取締役社長／伊藤　準（イトウ ジユン）
コーヨー製紙株式会社,4490001005441,パルプ・紙・紙加工品製造業,〒781-1102高知県土佐市高岡町乙3198,0888522165（088-852-2165）,40000（千円）,代表取締役社長／坂本　健次郎（サカモト ケンジロウ）
富士紙化学株式会社,4490001005466,パルプ・紙・紙加工品製造業,〒781-1102高知県土佐市高岡町乙1225-1,0888520332（088-852-0332）,20000（千円）,代表取締役社長／藤田　惠美（フジタ エミ）
株式会社池川茶園,4490001005730,食料品・飼料・飲料製造業,〒781-1606高知県吾川郡仁淀川町土居甲695-4,0889343100（0889-34-3100）,750（千円）,山中　由貴（ヤマナカ ユキ）
株式会社園芸資材センター,4490001006150,パルプ・紙・紙加工品製造業,〒783-0094高知県南国市前浜834,0888650087（088-865-0087）,10000（千円）,兼田　哲邦（カネダ テツクニ）
共栄電機工業株式会社,4490001006200,電気機械器具製造業,〒783-0047高知県南国市岡豊町常通寺島535,0888642965（088-864-2965）,10000（千円）,代表取締役社長／上久保　隆介（カミクボ リユウスケ）
窪内木材株式会社,4490001006209,木材・木製品製造業（家具を除く）,〒783-0005高知県南国市大ソネ乙1709,0888642082（088-864-2082）,10000（千円）,窪内　健一（クボウチ ケンイチ）
園田鋼板株式会社,4490001006258,"鉄鋼業,非鉄金属製造業",〒783-0084高知県南国市稲生1264-7,0888652511（088-865-2511）,10000（千円）,代表取締役社長／園田　祐（ソノダ ユウ）
株式会社南建,4490001006266,金属製品製造業,〒783-0084高知県南国市稲生706,0888651211（088-865-1211）,10000（千円）,代表取締役社長／長瀬　孝男（ナガセ タカオ）
