会社名,法人番号,業種,住所,電話番号,資本金,代表氏名
株式会社柳砕石,5340001010950,窯業・土石製品製造業,〒894-0107鹿児島県大島郡龍郷町戸口1737-3,0997622114（0997-62-2114）,3000（千円）,柳　隆文（ヤナギ タカフミ）
朝日酒造株式会社,5340001011016,食料品・飼料・飲料製造業,〒891-6202鹿児島県大島郡喜界町湾41-1,0997651531（0997-65-1531）,12000（千円）,喜禎　浩之（キテイ ヒロユキ）
喜界島製糖株式会社,5340001011214,食料品・飼料・飲料製造業,〒891-6201鹿児島県大島郡喜界町赤連2966-12,0997650251（0997-65-0251）,5000（千円）,上園田　慶太（カミソノダ ケイタ）
株式会社ＦＴＨ,5340001011321,一般機械器具製造業,〒890-0045鹿児島県鹿児島市武1-9-12松山ビル2F,0992861201（099-286-1201）,1000（千円）,前原　重信（マエハラ シゲノブ）
鹿児島いずみ協同食品株式会社,5340001011742,食料品・飼料・飲料製造業,〒899-1604鹿児島県阿久根市山下3337-3,0996720608（0996-72-0608）,50000（千円）,中村　信行（ナカムラ ノブユキ）
長島コンクリート工業株式会社,5340001011800,窯業・土石製品製造業,〒899-1211鹿児島県出水郡長島町山門野4572-1,0996870155（0996-87-0155）,61000（千円）,代表取締役社長／桑木　喜久（クワキ ヨシヒサ）
株式会社マツバラ,5340001011833,食料品・飼料・飲料製造業,〒899-0401鹿児島県出水市高尾野町大久保3816-42,0996823383（0996-82-3383）,10000（千円）,代表取締役社長／松原　清俊（マツバラ キヨトシ）
水溜食品株式会社,5340001012559,食料品・飼料・飲料製造業,〒899-3511鹿児島県南さつま市金峰町宮崎2940,0993770108（0993-77-0108）,10000（千円）,代表取締役社長／水溜　政典（ミズタマリ マサノリ）
薩南製糖株式会社,5340001012591,食料品・飼料・飲料製造業,〒898-0093鹿児島県枕崎市仁田浦町163,0993763131（0993-76-3131）,20000（千円）,代表取締役社長／高井　顯（タカイ アキラ）
立秋水産株式会社,5340001012600,食料品・飼料・飲料製造業,〒898-0048鹿児島県枕崎市火之神町378,0993726141（0993-72-6141）,10000（千円）,立石　健藏（タテイシ ケンゾウ）
株式会社西村浅盛商店,5340001012617,食料品・飼料・飲料製造業,〒898-0033鹿児島県枕崎市宮前町166,0993720454（0993-72-0454）,20000（千円）,代表取締役社長／西村　協（ニシムラ キヨウ）
マルテ水産株式会社,5340001012633,食料品・飼料・飲料製造業,〒898-0058鹿児島県枕崎市岩戸町3,0993727432（0993-72-7432）,15000（千円）,鮫島　修次（サメシマ シユウジ）
株式会社枕崎冷凍食品,5340001012674,食料品・飼料・飲料製造業,〒898-0093鹿児島県枕崎市仁田浦町242,0993735510（0993-73-5510）,30000（千円）,代表取締役社長／西村　協（ニシムラ キヨウ）
おおすみ食品株式会社,5340001013821,食料品・飼料・飲料製造業,〒893-1603鹿児島県鹿屋市串良町岡崎2128,0994632745（0994-63-2745）,10000（千円）,金田　啓洋（カネダ ケイヨウ）
九州化工株式会社,5340001013870,化学工業,〒893-0037鹿児島県鹿屋市田崎町1100,0994424121（0994-42-4121）,62000（千円）,中屋　省三（ナカヤ シヨウゾウ）
アクロスコンクリート工業株式会社,5340001013929,窯業・土石製品製造業,〒893-2601鹿児島県肝属郡南大隅町佐多伊座敷2022,0994260535（0994-26-0535）,10000（千円）,福谷　俊哉（フクタニ トシヤ）
西文社印刷株式会社,5340001014332,出版・印刷・同関連産業,〒893-0013鹿児島県鹿屋市札元2-3808-6,0994433094（0994-43-3094）,10000（千円）,西ノ原　庄一（ニシノハラ シヨウイチ）
株式会社ライジング,5340001014381,電気機械器具製造業,〒893-0016鹿児島県鹿屋市白崎町5-5-2階ー4号,0994407361（0994-40-7361）,11000（千円）,上山　浩一（ウエヤマ ヒロイチ）
太久保酒造株式会社,5340001014935,食料品・飼料・飲料製造業,〒899-7603鹿児島県志布志市松山町尾野見1319-83,0994878282（099-487-8282）,10000（千円）,代表取締役社長／中山　信一（ナカヤマ シンイチ）
株式会社岡留蒲鉾本舗,5340001014943,食料品・飼料・飲料製造業,〒899-7402鹿児島県志布志市有明町野井倉8100-1,0994716005（099-471-6005）,10000（千円）,岡留　功治（オカドメ コウジ）
九州昭和産業株式会社,5340001014984,食料品・飼料・飲料製造業,〒899-7103鹿児島県志布志市志布志町志布志3309,0994733570（099-473-3570）,300000（千円）,代表取締役社長／玉井　章（タマイ アキラ）
株式会社都食品,5340001015108,食料品・飼料・飲料製造業,〒899-7306鹿児島県曽於郡大崎町永吉1202,0994760540（099-476-0540）,20000（千円）,代表取締役社長／吉留　一幸（ヨシドメ カズユキ）
サンテグレ株式会社,5340001015140,食料品・飼料・飲料製造業,〒899-8608鹿児島県曽於市末吉町南之郷158,0986761195（0986-76-1195）,50000（千円）,代表取締役社長／福田　博史（フクダ ヒロフミ）
株式会社薬草パパイヤ農園,5340001016758,食料品・飼料・飲料製造業,〒891-9301鹿児島県大島郡与論町茶花2300-1,0997973148（0997-97-3148）,5000（千円）,白尾　元久（シラオ モトヒサ）
株式会社マツシタ,5340001017021,一般機械器具製造業,〒891-1101鹿児島県鹿児島市花尾町390-2,0992456213（099-245-6213）,3000（千円）,松下　拓郎（マツシタ タクロウ）
有限会社アートワン,5340002000785,出版・印刷・同関連産業,〒891-0102鹿児島県鹿児島市星ケ峯4-40-5,0992759820（099-275-9820）,3000（千円）,有薗　修一（アリゾノ シユウイチ）
有限会社大園製薬,5340002002088,化学工業,〒891-0105鹿児島県鹿児島市中山町1590,0992674033（099-267-4033）,3000（千円）,大園　英和（オオゾノ ヒデカズ）
有限会社川井田仏壇店,5340002002666,家具・装備品製造業,〒891-0113鹿児島県鹿児島市東谷山2-51-8,0992693501（099-269-3501）,5000（千円）,川井田　耕二（カワイダ コウジ）
有限会社クラランス,5340002003607,食料品・飼料・飲料製造業,〒892-0847鹿児島県鹿児島市西千石町6-21,0992398194（099-239-8194）,3000（千円）,木元　英二（キモト エイジ）
有限会社迫釀造店,5340002004225,食料品・飼料・飲料製造業,〒892-0844鹿児島県鹿児島市山之口町7-36,0992223017（099-222-3017）,9000（千円）,迫　時治（サコ トキハル）
有限会社鶴丸機工商会,5340002006345,その他の製造業,〒892-0846鹿児島県鹿児島市加治屋町9-3,0992225583（099-222-5583）,8000（千円）,久保　健市（クボ ケンイチ）
有限会社ナポリ印刷,5340002007178,出版・印刷・同関連産業,〒892-0834鹿児島県鹿児島市南林寺町26-27,0992240494（099-224-0494）,6000（千円）,池水　孝弘（イケミズ タカヒロ）
有限会社西園商会,5340002007293,化学工業,〒891-1206鹿児島県鹿児島市皆与志町2389-1,0992464060（099-246-4060）,8000（千円）,西ノ園　幸二（ニシノゾノ コウジ）
有限会社福島畳店,5340002008184,その他の製造業,〒891-0116鹿児島県鹿児島市上福元町6243,0992683842（099-268-3842）,3000（千円）,福島　幸生（フクシマ コウセイ）
株式会社ゆきざき宝石,5340002010108,その他の製造業,〒892-0842鹿児島県鹿児島市東千石町2-19,0992233514（099-223-3514）,3000（千円）,佐藤　健一朗（サトウ ケンイチロウ）
豊産業機械販売有限会社,5340002010116,金属製品製造業,〒892-0822鹿児島県鹿児島市泉町16-13,0992242400（099-224-2400）,9000（千円）,代表取締役社長／丸田　健児（マルタ ケンジ）
有限会社カミノ,5340002012327,一般機械器具製造業,〒891-1305鹿児島県鹿児島市宮之浦町745-43,0992943390（099-294-3390）,3000（千円）,神野　恵輔（カミノ ケイスケ）
有限会社中村酒造場,5340002013952,食料品・飼料・飲料製造業,〒899-4315鹿児島県霧島市国分湊915,0995450214（0995-45-0214）,6000（千円）,代表取締役社長／中村　敏治（ナカムラ トシハル）
有限会社森食品工業所,5340002014240,食料品・飼料・飲料製造業,〒899-5102鹿児島県霧島市隼人町真孝1265,0995420232（0995-42-0232）,3000（千円）,森　二雄（モリ ツギオ）
大雄陸運有限会社,5340002014686,木材・木製品製造業（家具を除く）,〒895-2631鹿児島県伊佐市大口小木原896,0995220574（0995-22-0574）,10000（千円）,早水　竜治（ハヤミズ リユウジ）
有限会社フジスミ産業,5340002014744,窯業・土石製品製造業,〒895-2511鹿児島県伊佐市大口里150,0995224212（0995-22-4212）,3000（千円）,藤井　純博（フジイ スミヒロ）
有限会社山之上商事,5340002015131,食料品・飼料・飲料製造業,〒899-6505鹿児島県霧島市牧園町持松2363,0995571185（0995-57-1185）,3000（千円）,山之上　勝広（ヤマノウエ カツヒロ）
有限会社末元工芸,5340002015379,木材・木製品製造業（家具を除く）,〒899-6404鹿児島県霧島市溝辺町麓3391-68,0995583743（0995-58-3743）,5000（千円）,末元　利行（スエモト トシユキ）
有限会社九州リフォーム技研,5340002015750,化学工業,〒899-5412鹿児島県姶良市三拾町1397-2,0995659096（0995-65-9096）,3000（千円）,重野　勉（シゲノ ツトム）
有限会社ハラグチ,5340002016071,その他の製造業,〒899-5422鹿児島県姶良市松原町1-25-1,0995655145（0995-65-5145）,3000（千円）,原口　修作（ハラグチ シユウサク）
有限会社吉屋印刷所,5340002016278,出版・印刷・同関連産業,〒899-5222鹿児島県姶良市加治木町錦江町18,0995634500（0995-63-4500）,33010（千円）,吉屋　紀元（ヨシヤ ノリモト）
有限会社小倉水産,5340002016492,食料品・飼料・飲料製造業,〒899-1924鹿児島県薩摩川内市港町6115,0996262137（0996-26-2137）,5000（千円）,小倉　スヾ（オグラ スズ）
有限会社くすもと食品,5340002016591,食料品・飼料・飲料製造業,〒895-0002鹿児島県薩摩川内市楠元町1906,0996292434（0996-29-2434）,3000（千円）,北野　広（キタノ ヒロシ）
南竹鰻加工有限会社,5340002018051,食料品・飼料・飲料製造業,〒896-0036鹿児島県いちき串木野市浦和町109,0996322333（0996-32-2333）,3000（千円）,南竹　篤己（ミナミタケ アツミ）
有限会社三愛商事,5340002018167,食料品・飼料・飲料製造業,〒896-0014鹿児島県いちき串木野市元町87,0996335030（0996-33-5030）,3000（千円）,上夷　宏明（ウエエビス ヒロアキ）
有限会社みつわ,5340002019322,食料品・飼料・飲料製造業,〒891-3101鹿児島県西之表市西之表13067-109,0997247060（0997-24-7060）,3000（千円）,小田　晴夫（オダ ハルオ）
有限会社竿田酒造,5340002020486,食料品・飼料・飲料製造業,〒891-9101鹿児島県大島郡和泊町国頭1305,0997922124（0997-92-2124）,3000（千円）,石原　純子（イシハラ ジユンコ）
有限会社奄美制服センター,5340002020552,衣服・その他の繊維製品製造業,〒894-0022鹿児島県奄美市名瀬久里町9-13,0997525188（0997-52-5188）,3000（千円）,恵島　倫子（エジマ ノリコ）
有限会社山田酒造,5340002021443,食料品・飼料・飲料製造業,〒894-0105鹿児島県大島郡龍郷町大勝1373-ハ,0997622109（0997-62-2109）,5000（千円）,山田　隆博（ヤマダ タカヒロ）
有限会社出水義肢装具製作所,5340002022185,精密機械・医療機械器具製造業,〒899-0207鹿児島県出水市中央町335-1,0996633639（0996-63-3639）,3000（千円）,弓木野　勇次（ユミキノ ユウジ）
有限会社長船水産,5340002022251,食料品・飼料・飲料製造業,〒899-0138鹿児島県出水市住吉町13-9,0996672079（0996-67-2079）,5000（千円）,長船　久一（オサフネ ヒサイチ）
有限会社大田水産,5340002022268,食料品・飼料・飲料製造業,〒899-1625鹿児島県阿久根市波留6137-66,0996731235（0996-73-1235）,3000（千円）,大田　正彦（オオタ マサヒコ）
有限会社マルカワ水産,5340002022920,食料品・飼料・飲料製造業,〒899-1611鹿児島県阿久根市赤瀬川4461,0996721030（0996-72-1030）,3000（千円）,川畑　安勝（カワバタ ヤスカツ）
溝神工業有限会社,5340002023679,金属製品製造業,〒897-0002鹿児島県南さつま市加世田武田16121,0993535358（0993-53-5358）,3000（千円）,溝神　章一（ミゾガミ シヨウイチ）
有限会社大石商店,5340002023761,食料品・飼料・飲料製造業,〒898-0033鹿児島県枕崎市宮前町176-3,0993720415（0993-72-0415）,8000（千円）,代表取締役社長／大石　克彦（オオイシ カツヒコ）
有限会社菓子工房だるまや,5340002023786,食料品・飼料・飲料製造業,〒898-0013鹿児島県枕崎市山手町131,0993720766（0993-72-0766）,3000（千円）,前田　一安（マエダ カズヤス）
有限会社河村金具製作所,5340002024198,その他の製造業,〒897-0221鹿児島県南九州市川辺町田部田6402,0993562323（0993-56-2323）,3000（千円）,河村　浩史（カワムラ ヒロフミ）
有限会社有薗製材所,5340002024512,木材・木製品製造業（家具を除く）,〒897-0223鹿児島県南九州市川辺町高田2518,0993563828（0993-56-3828）,3000（千円）,有薗　藤教（アリゾノ フジノリ）
有限会社上津砕石,5340002025205,窯業・土石製品製造業,〒899-4633鹿児島県垂水市二川大坪768,0994362510（0994-36-2510）,3000（千円）,上津　義明（カミツ ヨシアキ）
有限会社木場商店,5340002025469,食料品・飼料・飲料製造業,〒891-2125鹿児島県垂水市旭町88,0994320037（0994-32-0037）,3000（千円）,木場　武士（コバ タケシ）
有限会社海野鉄工,5340002027283,金属製品製造業,〒899-8212鹿児島県曽於市大隅町月野360,0994822038（099-482-2038）,5000（千円）,海野　隆文（ウミノ タカフミ）
高耒食品合資会社,5340003000677,食料品・飼料・飲料製造業,〒895-0061鹿児島県薩摩川内市御陵下町30-38,0996223188（0996-22-3188）,"",野田　隆（ノダ タカシ）
北薩材プレカット事業協同組合,5340005003918,木材・木製品製造業（家具を除く）,〒895-1816鹿児島県薩摩郡さつま町時吉2033-5,0996520888（0996-52-0888）,10000（千円）,東條　正義（トウジヨウ マサヨシ）
二之宮畳企業組合,5340005007423,その他の製造業,〒899-8102鹿児島県曽於市大隅町岩川6524,0994820117（099-482-0117）,2000（千円）,二之宮　登（ニノミヤ ノボル）
日本漬物株式会社,6012401008375,食料品・飼料・飲料製造業,〒899-4503鹿児島県霧島市福山町福沢4244,0995562565（0995-56-2565）,20000（千円）,後藤　正剛（ゴトウ セイゴウ）
日置建設産業株式会社,6340001000158,石油製品・石炭製品製造業,〒899-2522鹿児島県日置市伊集院町飯牟礼3492,0992733311（099-273-3311）,15000（千円）,西郷　進一（サイゴウ シンイチ）
阿久根生コンクリート株式会社,6340001000265,窯業・土石製品製造業,〒891-0122鹿児島県鹿児島市南栄4-7,0992695155（099-269-5155）,10000（千円）,平神　和義（ヒラカミ カズヨシ）
株式会社有村屋,6340001000389,食料品・飼料・飲料製造業,〒891-0122鹿児島県鹿児島市南栄3-24-5,0992695711（099-269-5711）,10000（千円）,代表取締役社長／有村　興一（アリムラ コウイチ）
カワイ食品株式会社,6340001001222,食料品・飼料・飲料製造業,〒890-0034鹿児島県鹿児島市田上6-29-54,0992542969（099-254-2969）,10000（千円）,河合　好信（カワイ ヨシノブ）
新原製茶株式会社,6340001002121,食料品・飼料・飲料製造業,〒891-0122鹿児島県鹿児島市南栄3-11,0992686131（099-268-6131）,31500（千円）,代表取締役社長／新原　光太郎（シンバラ コウタロウ）
島津電子工業株式会社,6340001002138,電気機械器具製造業,〒891-1231鹿児島県鹿児島市小山田町1812-1,0992382686（099-238-2686）,10000（千円）,豊留　幸男（トヨドメ ユキオ）
株式会社仙夢,6340001002352,その他の製造業,〒892-0838鹿児島県鹿児島市新屋敷町5-17,0992231006（099-223-1006）,10000（千円）,小田　正弘（オダ マサヒロ）
株式会社太陽ステンレス,6340001002591,金属製品製造業,〒891-0116鹿児島県鹿児島市上福元町5612-2,0992678036（099-267-8036）,10000（千円）,吉村　秋夫（ヨシムラ アキオ）
株式会社中礼義肢製作所,6340001002798,精密機械・医療機械器具製造業,〒892-0846鹿児島県鹿児島市加治屋町11-3,0992250888（099-225-0888）,10000（千円）,中禮　光明（チユウレイ ミツアキ）
株式会社トライ社,6340001003012,出版・印刷・同関連産業,〒892-0834鹿児島県鹿児島市南林寺町12-6,0992260815（099-226-0815）,10000（千円）,濱田　眞民（ハマダ マサタミ）
株式会社フューチャーフーズ,6340001003788,食料品・飼料・飲料製造業,〒891-0132鹿児島県鹿児島市七ツ島1-6-11,0992611111（099-261-1111）,10000（千円）,岩切　雅弘（イワキリ マサヒロ）
北薩生コンクリート株式会社,6340001003870,窯業・土石製品製造業,〒891-1231鹿児島県鹿児島市小山田町6717,0992382233（099-238-2233）,10000（千円）,代表取締役社長／津曲　泰作（ツマガリ タイサク）
本坊酒造株式会社,6340001003887,食料品・飼料・飲料製造業,〒891-0122鹿児島県鹿児島市南栄3-27,0992101210（099-210-1210）,100000（千円）,代表取締役社長／本坊　和人（ホンボウ カズト）
株式会社万国屋,6340001003920,食料品・飼料・飲料製造業,〒899-2704鹿児島県鹿児島市春山町1011-2,0992016601（099-201-6601）,10000（千円）,柿木原　卓（カキノキハラ タク）
南日本くみあい飼料株式会社,6340001004241,食料品・飼料・飲料製造業,〒890-0064鹿児島県鹿児島市鴨池新町15,0992585681（099-258-5681）,1000000（千円）,代表取締役社長／北郷　栄（ホンゴウ サカエ）
株式会社ラッキーフーズ,6340001005702,食料品・飼料・飲料製造業,〒891-0204鹿児島県鹿児島市喜入一倉町11027,0993435653（099-343-5653）,10000（千円）,山田　宣文（ヤマダ ノリフミ）
株式会社大橋製茶,6340001005974,食料品・飼料・飲料製造業,〒891-0122鹿児島県鹿児島市南栄3-17-3,0992674757（099-267-4757）,10000（千円）,代表取締役社長／大橋　直（オオハシ ナオ）
朝日酢食品株式会社,6340001007161,食料品・飼料・飲料製造業,〒899-5116鹿児島県霧島市隼人町内2198,0995426153（0995-42-6153）,12000（千円）,今村　安隆（イマムラ ヤスタカ）
上園食品株式会社,6340001007178,食料品・飼料・飲料製造業,〒899-5102鹿児島県霧島市隼人町真孝3344-1,0995426969（0995-42-6969）,10000（千円）,堂園　健二（ドウゾノ ケンジ）
株式会社霧島町蒸留所,6340001007260,食料品・飼料・飲料製造業,〒899-4201鹿児島県霧島市霧島田口564-1,0995570865（0995-57-0865）,10000（千円）,古屋　芳高（フルヤ ヨシタカ）
小山田産業株式会社,6340001007888,食料品・飼料・飲料製造業,〒899-5302鹿児島県姶良市蒲生町上久徳2408,0995520061（0995-52-0061）,10000（千円）,小山田　辰夫（コヤマダ タツオ）
株式会社ミネサキ,6340001007905,金属製品製造業,〒899-5222鹿児島県姶良市加治木町錦江町109,0995623086（0995-62-3086）,10000（千円）,代表取締役社長／大脇　孝志（オオワキ タカシ）
野下食品株式会社,6340001007913,食料品・飼料・飲料製造業,〒899-5421鹿児島県姶良市東餅田2308,0995652185（0995-65-2185）,10000（千円）,野下　博之（ノシタ ヒロユキ）
出水酒造株式会社,6340001008060,食料品・飼料・飲料製造業,〒899-0208鹿児島県出水市文化町358,0996793671（0996-79-3671）,22660（千円）,東　孝昭（ヒガシ タカアキ）
株式会社アイエムティクリエイト,6340001008325,電気機械器具製造業,〒899-4332鹿児島県霧島市国分中央5-12-3-603号,0995462020（0995-46-2020）,10000（千円）,會田　和義（アイダ カズヨシ）
株式会社花田電子,6340001008655,電気機械器具製造業,〒899-1802鹿児島県薩摩川内市湯田町611-1,0996280411（0996-28-0411）,10000（千円）,花田　洋三（ハナダ ヨウゾウ）
株式会社親和産業,6340001008894,石油製品・石炭製品製造業,〒896-1411鹿児島県薩摩川内市下甑町長浜906,0996950347（09969-5-0347）,10000（千円）,中野　力丸（ナカノ リキマル）
アース化研株式会社,6340001008911,窯業・土石製品製造業,〒895-0013鹿児島県薩摩川内市宮崎町2052,0996205935（0996-20-5935）,10000（千円）,松若　讓二（マツワカ ジヨウジ）
株式会社中馬,6340001008993,窯業・土石製品製造業,〒896-0006鹿児島県いちき串木野市東塩田町1,0996323369（0996-32-3369）,61000（千円）,代表取締役社長／中馬　浩（チユウマン ヒロシ）
株式会社鹿児島ハイテク,6340001009109,電気機械器具製造業,〒895-1721鹿児島県薩摩郡さつま町山崎1555-1,0996568788（0996-56-8788）,200（千円）,大久保　忍（オオクボ シノブ）
三福水産株式会社,6340001009414,食料品・飼料・飲料製造業,〒891-0501鹿児島県指宿市山川新栄町1-53,0993352121（0993-35-2121）,10000（千円）,代表取締役社長／三福　盛高（ミフク モリタカ）
指宿酒造株式会社,6340001009496,食料品・飼料・飲料製造業,〒891-0312鹿児島県指宿市池田6173-1,0993262277（0993-26-2277）,50000（千円）,代表取締役社長／南　荒生（ミナミ コウセイ）
中央コンクリート製品株式会社,6340001009752,窯業・土石製品製造業,〒891-3601鹿児島県熊毛郡中種子町納官3765-2,0997277321（0997-27-7321）,20000（千円）,里村　定夫（サトムラ サダオ）
天川酒造株式会社,6340001010090,食料品・飼料・飲料製造業,〒891-7425鹿児島県大島郡徳之島町花徳789,0997841221（0997-84-1221）,10000（千円）,乾　眞一郎（イヌイ シンイチロウ）
奄美産業株式会社,6340001010487,食料品・飼料・飲料製造業,〒894-0012鹿児島県奄美市名瀬小俣町18-5,0997520149（0997-52-0149）,10000（千円）,中村　洋一郎（ナカムラ ヨウイチロウ）
株式会社奄美自然科学研究所,6340001010504,食料品・飼料・飲料製造業,〒894-0773鹿児島県奄美市名瀬朝戸1056,0997549787（0997-54-9787）,10000（千円）,山田　久美子（ヤマダ クミコ）
株式会社藤野造船所,6340001010719,輸送用機械器具製造業,〒894-0033鹿児島県奄美市名瀬矢之脇町25-6,0997520604（0997-52-0604）,10000（千円）,藤野　壽吉（フジノ ジユキチ）
株式会社奄美のしずく,6340001010891,食料品・飼料・飲料製造業,〒894-0005鹿児島県奄美市名瀬佐大熊町4-11,0997528245（0997-52-8245）,10000（千円）,安田　トシヱ（ヤスダ トシエ）
株式会社前田家具,6340001011329,家具・装備品製造業,〒890-0052鹿児島県鹿児島市上之園町14-7,0992542669（099-254-2669）,5000（千円）,前田　義則（マエダ ヨシノリ）
株式会社松栄軒,6340001011691,食料品・飼料・飲料製造業,〒899-0203鹿児島県出水市上鯖渕532-5,0996620617（0996-62-0617）,10000（千円）,代表取締役社長／松山　幸右（マツヤマ コウスケ）
株式会社イチノセ,6340001011700,一般機械器具製造業,〒899-0137鹿児島県出水市今釜町63,0996672991（0996-67-2991）,10000（千円）,市之瀬　勝弘（イチノセ カツヒロ）
株式会社オートメック,6340001011725,一般機械器具製造業,〒899-0217鹿児島県出水市平和町1954-1,0996638684（0996-63-8684）,10000（千円）,中村　明弘（ナカムラ アキヒロ）
株式会社塩入ファクトリー,6340001011766,一般機械器具製造業,〒899-0211鹿児島県出水市知識町412-1,0996633005（0996-63-3005）,10000（千円）,塩入　宗夫（シオイリ ムネオ）
株式会社宮後印刷,6340001011849,出版・印刷・同関連産業,〒899-0121鹿児島県出水市米ノ津町8-16,0996671014（0996-67-1014）,20000（千円）,宮後　治八（ミヤウシロ ジハチ）
落電子工業株式会社,6340001011873,電気機械器具製造業,〒899-1611鹿児島県阿久根市赤瀬川3867-1,0996731844（0996-73-1844）,10000（千円）,赤木　絹代（アカキ キヌヨ）
